id,page_index,text_id,text,language_code,reasoning
easyread-text-23-14,23,text-23-14,"Necesito más información para ayudar, pero puedo simplificar lo que dice un hablante si me lo proporcionas.",es,"Speaker 4 likely refers to a specific part of a text or transcript. Without the original content, it's unclear what subject this might relate to, but normally, I would need to simplify what Speaker 4 said for children. I should use simple words and short sentences so that it's easy for children to understand."
easyread-text-19-15,19,text-19-15,Hoy me siento genial. Me encanta la escuela y mis compañeros.,es,"A simple statement from a student expressing their positive feelings about the day, school, and their classmates. It uses very familiar words and concepts for school children."
easyread-text-27-0,27,text-27-0,Living in Uruguay is nice because it is easy and has many good things.,en,The text is about living in Uruguay and mentions the ease and benefits that come with it. The idea is to express living in Uruguay as something enjoyable and beneficial.
easyread-text-25-20,25,text-25-20,"The text helps children learn to talk about themselves. They can say their name, age, favorite things, and how they feel.",en,"The text 'Myself' consists of activities that encourage children to learn and express basic information about themselves. This can cover their name, age, favorite things, and feelings."
easyread-text-11-5,11,text-11-5,Use the words in the box to finish their talk.,en,"The task involves helping students fill in the blanks of a conversation using given words. To make it understandable for school children with learning disabilities, I will simplify the instruction by using clear and direct language."
easyread-text-11-5,11,text-11-5,Miren su charla y termínenla usando las palabras de la caja.,es,"The instruction asks to complete a conversation using words from a box. Simplifying this for children, it can be rephrased as an instruction to choose and write missing words in a chat."
easyread-text-25-21,25,text-25-21,The number is twenty-seven.,en,"I should provide a simplified sentence in English that is easy for children with learning disabilities to understand. This means using short, clear sentences with basic vocabulary."
easyread-text-20-5,20,text-20-5,Los ojos son para ver.,es,"The word 'eyes' is simple and doesn't require any complex explanation for children. To simplify, we can explain what eyes are used for."
easyread-text-13-17,13,text-13-17,I like pink best.,en,The text states a personal preference for a color. It is a simple statement without complex ideas or technical terms.
easyread-text-13-18,13,text-13-18,Mi número favorito es el catorce.,es,"The sentence is simple, mentioning a favorite number. No complex terms or structures are present. The translation should reflect the same simplicity and clarity."
easyread-text-20-4,20,text-20-4,"Teeth are the hard, white things in your mouth that help you chew food. You use them to bite and grind food so you can eat it easily.",en,"I need to explain what teeth are in simple terms suitable for children, by using easy and relatable words."
easyread-text-23-15,23,text-23-15,Lee y escucha para verificar tus respuestas.,es,"The original sentence is instructing the reader to both read and listen to check their answers, but it needs to be simplified for better understanding."
easyread-text-19-16,19,text-19-16,"Hoy, me siento",es,"The input text is a simple expression of current emotions, commonly used to describe one's mood. It needs to be translated into Spanish while keeping it simple. The words should be easy to understand for children."
easyread-text-26-3,26,text-26-3,"My house is small and cozy. It has two bedrooms, a kitchen, and a living room. The walls are painted blue. There is a garden outside with flowers.",en,"The text is about describing a house in a simple manner, suitable for young children or those with cognitive disabilities."
easyread-text-19-15,19,text-19-15,I feel happy today! I like school and I like my friends in class.,en,"The original sentence is already simple and clear. The text talks about feeling good about school and classmates, which are familiar concepts for children."
easyread-text-11-6,11,text-11-6,"No hay texto específico para simplificar. Por favor, proporciona más detalles o el texto completo que necesitas simplificar.",es,"The text was not provided, but I know to simplify any specific information by using simple and familiar terms to make it suitable for school children."
easyread-text-26-4,26,text-26-4,Use words from your lesson and the S.O.S. Box.,en,"The text is about using specific vocabulary from a lesson unit and a designated box of resources, called the S.O.S. Box."
easyread-text-26-4,26,text-26-4,Usa palabras de la unidad de vocabulario y de la caja S.O.S.,es,The text is instructing to use vocabulary from specific learning materials or resources to simplify a particular piece of text. I should clarify this instruction in a simpler way while explaining that the vocabulary should come from a given set of materials.
easyread-text-23-15,23,text-23-15,Read and listen to make sure your answers are right.,en,"The original text is an instruction asking the reader to read and listen to check their answers. For students with cognitive challenges, it's important to keep instructions very clear and straightforward, using simple language."
easyread-text-20-5,20,text-20-5,Eyes help us see things around us.,en,"The text is just a single word, 'eyes'. To simplify it for school children with cognitive and learning disabilities, I should provide a basic description or function of eyes that uses familiar words."
easyread-text-13-17,13,text-13-17,Mi color favorito es rosa.,es,The text states a preference for the color pink. This is a simple statement about a personal favorite. I should use simple language and keep the sentence short.
easyread-text-27-0,27,text-27-0,"Uruguay es un país donde la gente vive tranquila. Hay bonitas playas, buena comida y personas amables.",es,"The original text might be talking about living conditions in Uruguay. The topic is likely covering aspects like culture, environment, or lifestyle in Uruguay, and these need to be simplified for easier understanding by using clear and direct language in Spanish."
easyread-text-27-1,27,text-27-1,Un diccionario con imágenes es un libro que muestra dibujos de palabras para ayudar a entenderlas mejor. Es útil para niños pequeños o para aprender un nuevo idioma.,es,"A picture dictionary is a book that shows pictures of words to help understand their meanings. It is especially helpful for young children or those learning a language, as the visuals make it easier to connect the words to their meanings."
easyread-text-13-15,13,text-13-15,Please call me Em.,en,"The sentence is a simple request asking to be called by a specific name, which is already in a familiar and everyday language."
easyread-text-27-1,27,text-27-1,A picture dictionary is a book with pictures that help explain words.,en,"The phrase 'picture dictionary' refers to a book that uses images to help explain the meaning of words. It is specifically designed to aid understanding by associating visuals with textual content, making it a useful tool for learning."
easyread-text-11-6,11,text-11-6,Luis's name starts a story or sentence.,en,"The text 'Luis:' is incomplete and doesn't provide sufficient context for simplification. It appears to denote a person's name or introduction to dialogue, but without further text, the reasoning requires the receiver to infer or interpret context."
easyread-text-27-2,27,text-27-2,1,en,The number itself is a simple concept easily understood by school children.
easyread-text-13-18,13,text-13-18,I like the number 14 the most.,en,I want to express the concept of having a favorite number in simple terms that are easy to understand.
easyread-text-23-16,23,text-23-16,Este capítulo trata de ti mismo.,es,"The text is most likely about discussing personal identity or self-introduction as indicated by the title ""Myself."" I need to create a simple version for kids to understand easily."
easyread-text-20-6,20,text-20-6,Pelo,es,The word 'hair' refers to the strands that grow on a person's head and body. It's important to use simple terms so children can understand what it is.
easyread-text-23-16,23,text-23-16,This part is about learning to talk about who you are.,en,"This text is straightforward and general for a topic focusing on personal introduction or self-description, which is appropriate for young children learning to talk about themselves."
easyread-text-30-1,30,text-30-1,Mi papá está enojado.,es,I need to use simple words to express the idea that the person's father is feeling mad or upset.
easyread-text-19-11,19,text-19-11,Someone says OK when they agree with something or want to continue.,en,"The response should explain the situation in simple terms using familiar words, making it easy for school children to understand the basic idea without becoming confused by complex grammar or word choices."
easyread-text-19-17,19,text-19-17,¿Cómo te sientes cuando...?,es,The text is about understanding emotions by asking how someone feels in different situations. It should be simplified for better comprehension by children with disabilities.
easyread-text-30-0,30,text-30-0,Vivir en Uruguay es bonito. La gente es amable y tranquila. Los niños juegan en los parques. Las escuelas son buenas. Las familias pasean felices. Todos son amigables.,es,"The text explains what it's like to live in Uruguay, mentioning its environment, safety, culture, and other aspects of daily life. It needs simplification using familiar words for school children with cognitive and learning disabilities, avoiding complex terms and details."
easyread-text-11-7,11,text-11-7,No hay texto para simplificar.,es,"This appears to be a placeholder text from the user indicating no specific content to simplify, which means no meaningful action is required under current instructions. Still, it should be addressed properly according to the derived action plan."
easyread-text-17-35,17,text-17-35,"El violeta es un color que parece morado. Está en las flores y algunas frutas, como las uvas.",es,The task is to simplify the text about color 'violet' into easy Spanish for children with cognitive disabilities. The word 'violet' can refer to a color and should be described in simple terms that relate to everyday experiences or familiar objects.
easyread-text-11-7,11,text-11-7,The exclamation mark shows excitement or surprise.,en,"The input is an exclamation mark without any context. Since there's no additional information or text provided, we cannot simplify it further. In general, an exclamation mark indicates excitement, surprise, or emphasis in a sentence."
easyread-text-19-16,19,text-19-16,"'Today, I feel' is a way to start talking about how you feel on this day.",en,"The sentence 'Today, I feel' does not give a full thought or feeling, but it's generally an expression of how someone may begin to convey their emotions or state of being for a particular day. It is very simple and can be understood easily."
easyread-text-13-19,13,text-13-19,"Hola, me llamo Nico y mi apellido es Romero.",es,I need to keep the structure of introducing oneself by stating both their first and last names.
easyread-text-23-17,23,text-23-17,25,es,"This text consists of a solitary number, ""25"", which translates easily across languages and cognitive comprehension levels. Therefore, the translated and simplified text remains unchanged."
easyread-text-26-5,26,text-26-5,"At the end of the book, there are guides to help you know how well you did on your writing.",en,The text is about evaluation tools or guidelines for writing tasks provided at the end of a book.
easyread-text-30-1,30,text-30-1,My dad is mad.,en,The sentence is simple and indicates the father's emotional state which should be retained.
easyread-text-26-5,26,text-26-5,Pautas para escribir tareas al final del libro.,es,"The text discusses evaluation criteria or standards for writing activities at the end of a book, which may be complex for children with cognitive and learning difficulties. I should simplify it into more understandable terms."
easyread-text-13-19,13,text-13-19,Hi! My name is Nico Romero.,en,"The text introduces a person named Nico Romero. It is already simple, but I can make it even clearer."
easyread-text-11-8,11,text-11-8,Nico es el nombre de una persona.,es,"The text likely refers to a person named Nico, but without additional context, it's unclear what specific information needs to be simplified."
easyread-text-19-18,19,text-19-18,¿Estás con amigos?,es,The question is a simple and direct inquiry about whether someone is spending time with friends. It needs to stay straightforward and clear.
easyread-text-30-0,30,text-30-0,"""#livingUruguay"" might be talking about living in Uruguay. This could mean sharing stories or pictures about life in Uruguay.",en,The original text is a hashtag and doesn't include detailed information or a narrative that can be simplified further. The task is to provide a simplified explanation based on the implication of the hashtag.
easyread-text-23-17,23,text-23-17,The number is twenty-five.,en,"The text is about the number 25 and how it is written in different formats. Since it's already simple and not requiring contextual breakdown or simplification for cognitive understanding, I'm reaffirming the number's identity in a clear manner."
easyread-text-19-17,19,text-19-17,How does your heart feel when something happens?,en,"The text asks about feelings, which can be a broad and complex topic for kids with cognitive and learning disabilities. It's important to simplify the question so it's easy to understand and children can relate to it with their own experiences."
easyread-text-11-8,11,text-11-8,"Hi, my name is Nico.",en,"The text is about someone named Nico, but there isn't enough context to understand what the original content is describing about Nico."
easyread-text-27-2,27,text-27-2,Me pidieron que haga el texto más fácil de leer para los niños. Debo usar palabras simples para que los niños puedan entender mejor. No tengo que cambiar el significado del texto. Solo hacerlo más claro y fácil.,es,"The text is about explaining the context of what I am about to reply, that involves generating content specifically tailored for children with cognitive and learning disabilities. So, I need to simplify whatever text content is given and have a defined example approach to follow, which involves simpler syntax using everyday words."
easyread-text-27-3,27,text-27-3,Busca fotos de los lugares mencionados en la caja de S.O.S.,es,"The text instructs children to search for pictures of places mentioned in a box labeled 'S.O.S.' By simplifying, we use simple words to help them understand the task better."
easyread-text-11-9,11,text-11-9,¡Hola! ¿Cómo estás?,es,The goal is to simplify common greetings into an easy-to-understand format in Spanish.
easyread-text-30-2,30,text-30-2,My sister's room is very messy.,en,The original text states that the room belonging to the person's sister is not clean or organized. I need to simplify this idea using very basic and common words.
easyread-text-19-18,19,text-19-18,Are you spending time with friends?,en,"Explaining the concept of social interaction, like being with friends, in simple terms for children with cognitive disabilities."
easyread-text-20-7,20,text-20-7,Las cejas son pelo arriba de los ojos. Ayudan a proteger los ojos y a mostrar emociones.,es,"The task is to provide a simple explanation of what eyebrows are in Spanish. Eyebrows are hair above the eyes on the face, which protect the eyes and also help express emotions."
easyread-text-10-0,10,text-10-0,"Vivir en Uruguay significa disfrutar de hermosas playas, comer asados deliciosos y bailar tango. Las personas suelen ser amables y el país es tranquilo.",es,"The text provided is a vague or undefined concept, but simplifying content regarding living in a country would involve discussing basic daily activities, places, or aspects of life in that country in simple terms."
easyread-text-30-3,30,text-30-3,Le cuesta encontrar las cosas.,es,"The sentence indicates that she has trouble locating objects, so it can be simplified to convey that straightforwardly by using simple terms."
easyread-text-28-0,28,text-28-0,La vida en Uruguay es especial por su gente amable y sus hermosas playas.,es,This is the first part of a text about living in Uruguay and what makes it interesting or special.
easyread-text-27-3,27,text-27-3,Look inside the S.O.S. Box and find pictures of the places mentioned.,en,"The text asks to find pictures of places mentioned in the SOS Box, which implies locating visual representations of those places. The task is about simplifying this instruction for easier understanding."
easyread-text-13-20,13,text-13-20,Tengo 13 años y vivo en una ciudad con mucha gente en Uruguay.,es,"The statement shares that a 13-year-old lives in a crowded city in Uruguay. It's simple and should be easy to understand by children, but it can be slightly simplified further in sentence structure."
easyread-text-30-2,30,text-30-2,El dormitorio de mi hermana está muy desordenado.,es,This sentence is simple and states that the speaker's sister's bedroom is not tidy. I will retain the key information about the bedroom being messy.
easyread-text-19-14,19,text-19-14,"Hoy me siento feliz porque mis amigos me saludaron con una sonrisa cuando llegué a la escuela. También estoy contento porque comí mi comida favorita en el almuerzo. Sin embargo, me sentí un poco cansado después de jugar en el recreo.",es,"I need to write sentences that a child can understand easily about feelings today, using simple words and phrases."
easyread-text-13-20,13,text-13-20,I am 13 years old and live in a busy city in Uruguay.,en,The text is about a 13-year-old child living in a busy city. I should keep the age and location but simplify the language for easy understanding.
easyread-text-20-6,20,text-20-6,"Hair is what grows on your head and body. It can be straight, curly, or wavy. People can have different colors like black, brown, or blond. Hair can be long or short.",en,"Hair is something that is found on the heads and bodies of many animals, including people. It can come in different colors, lengths, and thicknesses, and is often used for protection, warmth, or even as a part of one's identity."
easyread-text-10-1,10,text-10-1,Draw two new places that are not in the picture you saw before.,en,"The text is asking to draw the two places not shown in a previous graphic organizer. To simplify for school children with cognitive and learning disabilities, we should explain what they need to do in simple terms, focusing on drawing and identifying new places."
easyread-text-23-14,23,text-23-14,We are talking about Speaker 4 in this conversation.,en,"Speaker 4 is part of a larger dialogue or event with multiple speakers. Understanding each speaker's part helps clarify the overall context. For school children, it is important to simplify the names of speakers to help them follow along easily."
easyread-text-10-0,10,text-10-0,This is about living in Uruguay. It talks about what it's like to live there.,en,"The original text provides information on moving to Uruguay, discussing general aspects of living there. To simplify it for children with cognitive and learning disabilities, I need to use simple words and clear sentences, focusing on key points like it being about living in Uruguay."
easyread-text-20-8,20,text-20-8,Tengo ojos marrones.,es,"The original text is simple, and its meaning is clear: someone is stating that they have eyes of a specific color. This idea can be simplified using everyday words."
easyread-text-11-9,11,text-11-9,Hi! How are you feeling?,en,"The question is a simple greeting and inquiry about well-being, which doesn't require simplification for understanding. It uses everyday language and an active voice, making it suitable for everyone."
easyread-text-13-21,13,text-13-21,Voy a la escuela número 5.,es,"The text describes a student's school which is identified by a number. Keeping it simple for comprehension, we maintain the key information that they attend a school."
easyread-text-10-1,10,text-10-1,Dibuja los dos lugares que no están en el dibujo anterior.,es,"The original text is asking for a drawing task related to a 'graphic organizer.' It can be simplified by explaining the task in easier words, focusing on what action needs to be taken rather than implying the need to understand complex terms like 'graphic organizers.'"
easyread-text-10-2,10,text-10-2,"Para hablar bien inglés, es importante saber cómo responder preguntas.",es,"The text is explaining that to talk in English, you need to know how to reply when someone asks you something. This is a basic element of communication."
easyread-text-26-7,26,text-26-7,Un garaje es un lugar donde guardamos el coche y las herramientas.,es,"The word ""garage"" is a place where we usually put our cars or tools. It's a familiar term and doesn't have technical jargon."
easyread-text-11-10,11,text-11-10,Luis es un niño.,es,I need to identify a possible context before simplifying given just the introduction 'Luis'. I'll assume it's asking about a person and keep the context open.
easyread-text-30-3,30,text-30-3,She can't find the things.,en,The sentence is about a girl or woman who has trouble locating things. I should keep it simple and use direct language that a child can understand.
easyread-text-19-19,19,text-19-19,Did you have a good sleep?,en,"The original text uses a casual and everyday language, which is already simple. It is a direct and easy-to-understand question often used in everyday conversations."
easyread-text-19-19,19,text-19-19,¿Dormiste bien?,es,"The text is a simple question asking about someone's quality of sleep, which is straightforward and uses common vocabulary easily understood by children."
easyread-text-20-8,20,text-20-8,My eyes are brown.,en,The text is simple. It states the color of the person's eyes. There is no need for added explanation or complexity.
easyread-text-28-1,28,text-28-1,"Los estantes son lugares donde pones cosas como libros, juguetes o fotos. Puedes encontrarlos en casa o en la escuela para organizar tus cosas.",es,"The text was not provided entirely, and a single word 'shelves' is vague. Assuming I need to explain what shelves are in an easy-read manner for children."
easyread-text-13-21,13,text-13-21,I go to middle school number 5.,en,I need to make it simple and clear that the person attends a middle school.
easyread-text-27-4,27,text-27-4,2 is a number we use for counting and telling order. It comes after 1 and before 3.,en,The text is given as a '2' which doesn't provide context or information. I should explain that '2' is a number used in counting.
easyread-text-26-7,26,text-26-7,A garage is a place where people keep their cars or bikes. It is like a room for vehicles.,en,Garage is often a term used to describe a shelter or space where vehicles like cars or bikes are parked. It's common in houses and buildings.
easyread-text-27-4,27,text-27-4,El número '2' es un número después de '1' y antes '3'. Es un número pequeño y fácil de contar con los dedos.,es,The input '2' represents a number. We should explain the number '2' in simpler terms for better understanding.
easyread-text-26-6,26,text-26-6,"Una ""Caja S.O.S."" podría ser una caja que ayudas en emergencias. Es como una señal de ayuda cuando tienes un problema grande.",es,"The term 'S.O.S. BOX' is not explained in the initial context, so I need to make a simple guess based on common knowledge that children might have. An 'S.O.S. BOX' might be something that helps people in emergency situations, as 'S.O.S.' is a known distress signal."
easyread-text-20-9,20,text-20-9,Tengo una boca pequeña/grande.,es,"The sentence talks about a person having either a small or big mouth. It is straightforward and uses simple language, suitable for children."
easyread-text-27-5,27,text-27-5,Pega los dibujos y ponles nombre.,es,The text is about labeling pictures. It uses simple words like 'pictures' and 'label' which are easy for children to understand. I will simplify it by replacing the word 'label' with 'name'.
easyread-text-19-20,19,text-19-20,¿Vas a una fiesta?,es,The text is asking if someone is going to attend a party. The syntax and vocabulary needs to be simple in Spanish.
easyread-text-10-2,10,text-10-2,It is important to know how to answer questions when speaking English.,en,"The text emphasizes the importance of knowing how to answer questions when communicating in English. To simplify it for children, I'll keep it short and straightforward."
easyread-text-26-8,26,text-26-8,Un balcón es un espacio pequeño fuera de una ventana de un edificio con barandilla.,es,A balcony is a space like a small floor outside a window of a building. It's usually surrounded by a railing.
easyread-text-28-2,28,text-28-2,Es un mueble con cajones para guardar ropa u otras cosas.,es,The text is just a simple term and we need to explain what a chest of drawers is to children.
easyread-text-13-22,13,text-13-22,Mis papás ya no están juntos.,es,"The input sentence is simple and clear, but I can make it even more accessible by using familiar words that describe the situation in a direct way."
easyread-text-28-1,28,text-28-1,Shelves are flat surfaces where you put things.,en,"The text provided is the single word 'shelves', which means surfaces in a structure to place items on. There is no complex information or structure to simplify further."
