id,page_index,text_id,text,language_code,reasoning
easyread-text-10-18,10,text-10-18,Today is Monday.,en,The text is simply informing the reader of the current day of the week.
easyread-text-28-16,28,text-28-16,A twin bed is a small bed for one person.,en,"The term 'twin bed' refers to a small bed usually meant for one person. It is an everyday term that children and most people might be familiar with, so it doesn't require complex simplification."
easyread-text-26-22,26,text-26-22,The number 28 is bigger than 27 and smaller than 29.,en,"The text 28 seems to refer to a number with no further context or information provided. To make it easy to understand for school children, I would add a bit of familiar context to make it relatable."
easyread-text-28-17,28,text-28-17,The letter F is the sixth letter of the alphabet and can be used in many words.,en,"The text is difficult, and I need to change it using simple words and sentences so kids can easily understand."
easyread-text-10-18,10,text-10-18,Hoy es lunes.,es,I need to simplify this into an easily understandable statement that maintains the original meaning.
easyread-text-11-26,11,text-11-26,Foto tomada por Aldo Rodriguez.,es,"The phrase indicates that the photo was taken by a person named Aldo Rodriguez, highlighting the photographer's credit."
easyread-text-30-21,30,text-30-21,Abajo de,es,"I need to simplify the concept of 'under' for kids, using familiar words and ensuring it's easy to understand."
easyread-text-10-20,10,text-10-20,Mi nombre es Peter.,es,This is a simple sentence introducing someone's name. I will translate it into Spanish keeping it straightforward and similar in structure.
easyread-text-10-19,10,text-10-19,El número es tres.,es,This is a simple question asking for the number 3. It does not need simplification as it is already in a form that is easy to understand.
easyread-text-27-20,27,text-27-20,El texto es confuso. No hay suficiente información.,es,The word is unclear without context. It could refer to multiple things. I aim to transform complex sentences rather than single letters or ambiguous input.
easyread-text-30-19,30,text-30-19,In front of,en,"""In front of"" is a preposition used to describe the location of something being before or ahead of another thing. It is already simple and using basic vocabulary. There is no need for simplification."
easyread-text-27-20,27,text-27-20,"The text 'D' is a letter, not a complete idea.",en,The text 'D' is just a single letter and does not convey a complete message or concept to simplify.
easyread-text-11-28,11,text-11-28,Hola y bienvenidos,es,"The phrase is a simple greeting, welcoming someone to a place or event. It can be translated directly into Spanish using straightforward language."
easyread-text-11-25,11,text-11-25,Hoy es el primer día de clases; la maestra está llamando a los estudiantes por sus nombres.,es,The sentence describes the first day of school when the teacher checks who is present by calling each student's name.
easyread-text-27-21,27,text-27-21,Puede hacer calor en un lugar y frío en otro al mismo tiempo.,es,The text is about the different temperatures across the northern and southern hemispheres. I simplified it to explain how it can be hot or cold in different parts of the world at the same time.
easyread-text-11-26,11,text-11-26,Aldo Rodriguez took this picture.,en,"The text indicates a photo taken by Aldo Rodriguez. To simplify it, I will mention that Aldo Rodriguez is the person who took the picture."
easyread-text-28-16,28,text-28-16,Una cama individual es una cama para una sola persona. Es más pequeña que otras camas.,es,"A 'twin bed' is simply a type of bed that is smaller and usually meant for one person. This term can be confusing, but it just refers to a single bed."
easyread-text-10-19,10,text-10-19,Three,en,"'3' is a number, and simplifying numbers doesn't change its representation. For school children, especially those with cognitive and learning disabilities, recognizing and identifying numbers is an important skill. Therefore, we represent the number as it is."
easyread-text-28-17,28,text-28-17,La letra F es la sexta letra del alfabeto.,es,The text needs to be simplified so that children can easily understand it and relate to everyday words. It should also be concise and maintain the overall gender context where applicable.
easyread-text-11-28,11,text-11-28,Hi and welcome!,en,I need to keep the message simple and welcoming for children with cognitive and learning disabilities.
easyread-text-10-17,10,text-10-17,Two is the number after one and before three.,en,"It is not entirely clear what text to simplify based on just '2'. If we assume it is asking to simplify the concept of the number, then the simplification would involve describing what the number represents or its significance in an easily understandable way."
easyread-text-30-19,30,text-30-19,en frente de,es,"The text simply refers to a position or location. It doesn't need to be simplified further for an easy-read version, as the phrase 'in front of' is already quite simple. However, in Spanish, 'en frente de' conveys the same straightforward concept."
easyread-text-11-27,11,text-11-27,Unidad 1,es,"UNIT 1 may refer to the first section or chapter of a document or book. Since this needs more context to be simplified accurately for children, I will interpret it as just indicating the start of a section or lesson."
easyread-text-28-18,28,text-28-18,G,en,"Although the original input 'G' does not provide context, an easy-read version aims to simplify complex text for children with cognitive and learning disabilities. In this case, 'G' itself cannot be simplified further. If 'G' is part of a larger context or sentence, I can assist better with more information."
easyread-text-30-20,30,text-30-20,'Between' means in the middle of two things.,en,"Without additional context, the word 'between' generally indicates a position or a situation that involves two parties or objects. My goal is to simplify any provided text by using everyday language that would make it easier for children with cognitive and learning disabilities to understand."
easyread-text-28-18,28,text-28-18,G es una letra del alfabeto. Se usa en muchas palabras.,es,"There is no context provided in the input text, so it's challenging to generate new content. Instead, I'll treat 'G' as a placeholder for completing the task and will create a sample response."
easyread-text-30-17,30,text-30-17,You can grow tiny plants from seeds. These are called microgreens. You can eat microgreens and they give you lots of energy.,en,"The text describes a process called microgreens which involves growing small, edible leaves as a hobby. The simplified version should focus on how seeds can be grown into these small greens and eat them for more energy."
easyread-text-27-21,27,text-27-21,"There is no text to simplify, only the letter 'E'.",en,"The text provided is not complete and only consists of the letter 'E', so it is not possible to simplify it further."
easyread-text-10-20,10,text-10-20,My name is Peter.,en,This text is already simple and clear for young children or those with cognitive disabilities. It introduces the person's name in an easy-to-understand way.
easyread-text-27-23,27,text-27-23,The text is unclear. Please provide a complete sentence or thought.,en,"The text seems to be incomplete or not meaningful. Without more context, I can't provide a simplification."
easyread-text-27-22,27,text-27-22,The letter F is the sixth letter in the alphabet.,en,"The input text ""F"" is a single letter and does not provide any specific context or meaning to simplify into an easy-read version. However, in situations with a single letter or context-less input, my approach is to acknowledge the lack of context for meaningful simplification."
easyread-text-10-21,10,text-10-21,Cuatro,es,"The given text is a number, which is '4'. This has no further context or complexity to simplify, other than stating it in words."
easyread-text-28-19,28,text-28-19,"Por favor, proporciona un texto completo para simplificarlo.",es,"Without a complete text, I'm unable to provide a simplification. However, typically, my task would involve rephrasing the provided text into short, clear sentences using simple vocabulary. For example, if the text was about a complex science topic, I'd explain it using everyday words and examples that kids understand."
easyread-text-10-22,10,text-10-22,Está nublado y llueve.,es,I need to convey simple information about the weather using everyday language.
easyread-text-11-29,11,text-11-29,Trece,es,"The text given is a number, which does not require further simplification."
easyread-text-30-22,30,text-30-22,Describe cómo sería tu dormitorio perfecto.,es,"The text is asking about someone's perfect bedroom. The idea is to express a simple version that is easy for children to understand about sharing what their dream bedroom would look like, including basic things they might want in it."
easyread-text-27-23,27,text-27-23,G,es,"The text only contains the letter 'G', which doesn't seem to have an inherent meaning or context. However, if it's intended to mean something like a person's initial or a letter in a sequence, that's all that can be simplified."
easyread-text-28-20,28,text-28-20,There is no text to simplify.,en,"There is no text provided to simplify, so I am unable to provide a simplified version."
easyread-text-27-25,27,text-27-25,No hay texto para simplificar.,es,The input ideally should have included a complete sentence to simplify.
easyread-text-30-20,30,text-30-20,La palabra 'entre' se usa para decir que algo está en el medio de dos cosas.,es,The text 'between' represents a concept often used to describe the location or relation of an object relative to two other objects. It's important to convey this idea in simple terms for children.
easyread-text-10-22,10,text-10-22,The sky is covered with clouds and it's raining.,en,"The given sentence is simple and clear, stating the weather condition."
easyread-text-30-22,30,text-30-22,Tell us about your perfect bedroom.,en,The instruction asks the reader to describe their perfect or favorite bedroom. I need to simplify and shorten the instruction using simple words.
easyread-text-11-25,11,text-11-25,"Today is the first day of school, and the teacher is saying everyone's name to see who is here.",en,"Children need to understand that it's the start of a new school day, and the teacher is checking attendance by calling each student's name."
easyread-text-11-29,11,text-11-29,The number given is 13.,en,The input provided seems to be just a number with no context or additional content to simplify.
easyread-text-30-24,30,text-30-24,No hay texto para simplificar.,es,"The text seems to be missing or incomplete, so there is no content to simplify."
easyread-text-27-24,27,text-27-24,Please provide more information or a full text to simplify.,en,"Since the input didn't provide any specific text to simplify, there's no simplified text that can be generated. The input text 'H' is not enough to form a simplified response."
easyread-text-28-21,28,text-28-21,No entiendo el texto. Falta información para simplificar.,es,This text seems to be an incomplete input with only one letter 'J'.
easyread-text-28-19,28,text-28-19,The text is just a letter and doesn't make sense by itself. Please provide more text to understand it better.,en,"The incoming text does not provide sufficient content to determine its meaning or context. Therefore, it is not possible to simplify or rewrite it without more information."
easyread-text-30-23,30,text-30-23,La Unidad 2 trata sobre conocerme a mí mismo.,es,"The text is about the topic of self-identity and understanding oneself. I need to simplify it by using familiar words that a child can easily understand, focusing on self-awareness and personal characteristics."
easyread-text-27-26,27,text-27-26,No hay información para simplificar.,es,There seems to be no content to simplify in the text provided.
easyread-text-10-23,10,text-10-23,cinco,es,"The number 5 is already simple and easy to understand for children, but I need to translate it into Spanish."
easyread-text-30-24,30,text-30-24,This text is too short and does not provide a complete context for simplification. Please provide more detail.,en,The text is about preventing people from reading a specific idea or concept.
easyread-text-30-23,30,text-30-23,"This lesson is about learning who you are. You will talk about your name, age, and what you like.",en,"The text probably involves learning about oneself, which includes basic personal information. It's important to keep explanations straightforward for children, using simple words."
easyread-text-10-23,10,text-10-23,Five,en,"The input is just a number and there is no specific context or complexity to simplify. So, the easiest way to present it is as a count or value."
easyread-text-10-24,10,text-10-24,This is John.,en,"The text introduces a person named John, which is a simple sentence."
easyread-text-30-21,30,text-30-21,I understand that you want me to make the text easier to read for children. I will make the words simple and the sentences short. This will help all children understand better.,en,"The request is to simplify the text provided into an easy-to-understand version suitable for school children with cognitive and learning disabilities. The request includes simplifying the language, making sentences clear and concise and using the active voice."
easyread-text-28-21,28,text-28-21,J,en,"The input consists of a single letter 'J', without context, no action or text simplification is possible. Thus, no changes are needed, and no simplification can be provided since there is no meaningful content to simplify."
easyread-text-10-21,10,text-10-21,Number '4' means four. Like four apples.,en,"The text '4' is a numeral representing the quantity four. Simplifying for easy understanding, especially for children with cognitive and learning disabilities, involves confirming the concept of the numeral itself, relating it to familiar objects or visuals."
easyread-text-27-25,27,text-27-25,I am ready to help.,en,"Your task is to simplify text for children with cognitive and learning disabilities when you are given text. Since 'I' is not a complete text, there is nothing to simplify."
easyread-text-10-24,10,text-10-24,Él es Juan.,es,The original text introduces a person named John. My task is to maintain this simple concept using basic Spanish vocabulary accessible to children.
easyread-text-28-23,28,text-28-23,"Son diferentes tamaños de camas: twin, full, queen, king y California king.",es,The text is listing different types of bed sizes.
easyread-text-27-27,27,text-27-27,Yo hablo sobre mí mismo.,es,"The text refers to someone talking about themselves, likely including personal details about who they are. I should simplify this idea for clarity and understanding."
easyread-text-27-28,27,text-27-28,The number is 29.,en,"The text contains information about a number, '29', which does not require simplification as it is already a simple numeric concept."
easyread-text-10-25,10,text-10-25,¡Buen trabajo!,es,The text is a form of praise for someone's achievement. It is important to use simple words that convey appreciation and positivity.
easyread-text-10-26,10,text-10-26,Habla con un amigo en clase.,es,"The sentence is asking to roleplay a dialogue with a classmate, which can be simplified to something more direct and specific for children."
easyread-text-10-25,10,text-10-25,Great job!,en,"The text is simply praising or congratulating someone for something they have done well. There are no complex terms or passive voice, so it is already easy to understand."
easyread-text-27-24,27,text-27-24,Jack y Joe son dos amigos que encuentran una cueva secreta. Allí conocen a personas amables llamadas Elfos. Los Elfos invitan a los chicos a tomar té y les hablan de su cultura. Los niños se sienten asombrados y felices por aprender sobre los Elfos.,es,"The text is about two boys, Jack and Joe, who find a hidden cave and encounter a group of friendly people called Elves. They have tea and learn about Elf culture, which is fascinating for the boys."
easyread-text-27-28,27,text-27-28,Veintinueve,es,"The text suggests the number 29 without any additional context or explanation, so no simplification or reasoning is needed beyond identifying that it is a number."
easyread-text-10-26,10,text-10-26,Pretend to have a talk with a classmate.,en,The text is instructing someone to act out a conversation with a classmate as if they are playing a role.
easyread-text-28-24,28,text-28-24,¿Cuáles de estos objetos tienes en tu habitación?,es,The question asks what items are present in the bedroom. An easy-read version should use simpler words and a common structure to help understanding.
easyread-text-27-27,27,text-27-27,"In this unit, you will learn to talk about yourself. You can share your name, age, what you like, and what interests you.",en,"The title 'UNIT 2 Myself' indicates the content is about oneself. It is important to convey that this unit will help the reader learn to describe themselves, including their name, age, likes, and interests, using simple language."
easyread-text-27-26,27,text-27-26,There's no content to simplify as the input is just the letter 'J'.,en,"The text is not provided, it seems to be a placeholder or an error with just a single letter 'J'."
easyread-text-10-28,10,text-10-28,Hola y bienvenido,es,The text is a general greeting saying hello and welcoming someone.
easyread-text-10-28,10,text-10-28,Hi there! Good to see you!,en,I am presented with a greeting text. The task is to simplify it for school children with cognitive and learning disabilities. The text should be clear and concise in everyday English.
easyread-text-28-22,28,text-28-22,"Diferentes tipos de camas pueden ser: una cama simple para una persona, una cama doble para dos personas, una litera que tiene una cama arriba de otra, y una cama plegable que se puede guardar cuando no se usa.",es,The text lists different types of beds which might be difficult to understand for children with learning disabilities. I need to use simple language and examples they can relate to in order to explain this concept.
easyread-text-28-22,28,text-28-22,"There are different kinds of beds. Some are bunk beds, others are single beds, and there are also double beds.",en,"The text 'Types of bed:' implies a list or categorization of different kinds of beds. For simplicity, we should name some common types of beds that children might be familiar with."
easyread-text-28-27,28,text-28-27,30,en,The number 30 doesn't require simplification. It's a basic number understood by school children.
easyread-text-24-1,24,text-24-1,Número uno.,es,The input text requires simplification for easy understanding by school children with cognitive and learning disabilities. The translated and simplified text should use simple Spanish words and should be concise.
easyread-text-28-24,28,text-28-24,What things do you have in your bedroom?,en,"The sentence asks about things you might have in your bedroom. I should use simple words and make sure it's easy to understand, focusing on personal belongings one might find in a bedroom."
easyread-text-10-29,10,text-10-29,Doce,es,"The number 12 is a simple concept, often represented in counting and basic math. It doesn't need simplification as it's universally understood."
easyread-text-27-22,27,text-27-22,La letra 'F' es parte del alfabeto. Es una letra muy importante.,es,"The text 'F' has no context or meanings similar to a letter by itself. I will create a simple text around a familiar concept using 'F',' which can help a child read and understand them."
easyread-text-10-27,10,text-10-27,La primera parte de un libro o curso.,es,"The text ""UNIT 1"" refers to a section or a part in a book or a course which is usually labeled as 'unit' followed by a number. This means it is the first unit, typically indicating the starting chapter or introduction to the learning material."
easyread-text-24-2,24,text-24-2,Esta casa es pequeña y solo tiene un piso.,es,The sentence describes the house as being small and having only one level or floor.
easyread-text-24-1,24,text-24-1,1 is a number. It comes after 0 and before 2.,en,I will simplify each sentence to make it easier for school children to understand. The goal is to use simple words and short sentences.
easyread-text-28-20,28,text-28-20,"La letra ""I"" no tiene suficiente información para simplificar.",es,"The original text needs to be simplified into a basic level Spanish equivalent for school children with learning disabilities. However, the provided text is a single character 'I', which is not complete or specific enough to simplify. As there is not enough content to interpret or simplify, the response should acknowledge this."
easyread-text-10-29,10,text-10-29,The number is twelve.,en,"I should keep the explanation simple, as the text provided is just a number and has no context. My goal is to provide a clear and concise description of the number."
easyread-text-28-25,28,text-28-25,"En mi cuarto tengo una cama, una mesa, una silla y una lámpara.",es,The text should simple enough for children to understand the objects that could be in a room. Use simple and familiar words.
easyread-text-28-28,28,text-28-28,Guías para actividades de escritura al final de este libro.,es,"The text refers to evaluation guidelines or criteria used for writing activities. These could be complicated for some students, so I aim to replace 'rubrics' with 'guidelines' and describe them simply."
easyread-text-24-2,24,text-24-2,The house is little and has one floor.,en,The original sentence talks about a house being small and having only one floor. I will simplify it by using simpler words and keeping the meaning the same.
easyread-text-28-25,28,text-28-25,"I have a bed, a table, a chair, and a lamp in my room. There are also some books, toys, and a soft rug on the floor.",en,"The instruction is to simplify the description of objects typically found in a room, using simple language that is suitable for children with cognitive and learning disabilities."
easyread-text-28-26,28,text-28-26,Unidad 2: Yo mismo,es,"The text 'UNIT 2 Myself' likely indicates a chapter or section from a learning resource that focuses on self-awareness or personal information. I need to simplify this for children, making it relatable and understandable."
easyread-text-28-26,28,text-28-26,This is about knowing who I am. I will talk about myself.,en,"The text likely aims to encourage self-identification and personal discovery, focusing on knowing oneself. It should use simple language to ensure understanding by school children, particularly those with cognitive and learning disabilities."
easyread-text-24-6,24,text-24-6,2,en,The text is a simple number that needs no further simplification.
easyread-text-28-28,28,text-28-28,The book has guides to help you know how to do writing tasks.,en,"The original sentence is talking about assessment guides called rubrics for writing tasks in a book. Rubrics might not be familiar to children as a term, so I will use simple words to convey the message."
easyread-text-10-27,10,text-10-27,Unit 1,en,"The text just mentions 'UNIT 1', which could refer to a section in a book or lesson plan. Since there isn't much context or content to simplify, the simplified version could be the same."
easyread-text-28-27,28,text-28-27,30,es,"The input only contains the number 30 which doesn't require simplification. For comprehension, use familiar objects or quantities. For example, I could relate it to things like 30 pieces of candy or 30 school days. But the original input needs to stay as is in this case."
easyread-text-24-8,24,text-24-8,Tiene dos pisos.,es,The sentence describes that there are two levels in a building or structure. There is no need for complex terms here.
easyread-text-24-7,24,text-24-7,"This house stands alone, not joined to any other house.",en,The sentence describes a type of house that stands alone and is not joined to another house.
easyread-text-28-23,28,text-28-23,"These are names for different bed sizes: twin, full, queen, king, and California king.",en,"The text lists different sizes of beds, which are terms easily understood, so minimal simplification is needed. However, clarifying these as bed sizes might be helpful for understanding."
easyread-text-24-3,24,text-24-3,The walls are white and the roof is yellow.,en,"The text describes the color of the walls and roof of a structure, using simple adjectives for colors."
easyread-text-24-5,24,text-24-5,También hay un jardín.,es,"The sentence is simple, stating the presence of a garden. We make it child-friendly by translating it into Spanish using basic words."
easyread-text-11-27,11,text-11-27,A unit is a section of work or learning. It helps to organize topics and lessons.,en,"The text requires a response or simplification but lacks specific content details. Hence, I will provide an example unit simplification instead."
easyread-text-24-8,24,text-24-8,The building has two floors.,en,"The sentence is simple, but I can make it clearer for children by being more descriptive about what 'it' refers to."
easyread-text-24-3,24,text-24-3,Las paredes son blancas y el techo es amarillo.,es,The sentence describes the color of the walls and the roof of a building. We need a simple and clear version of this description in Spanish.
