id,page_index,text_id,text,language_code,reasoning
easyread-text-21-4,21,text-21-4,This is Michael.,en,"The text is very straightforward and clear, simply introducing someone named Michael. There's no need for simplification."
easyread-text-21-1,21,text-21-1,Esta es Carolina.,es,The sentence is an introduction of a person named Caroline. It is already simple and direct.
easyread-text-21-3,21,text-21-3,"Tiene el pelo rubio, largo y liso.",es,"The text describes a person's hair using simple physical details like color, length, and texture, which easily can be represented with familiar words."
easyread-text-21-4,21,text-21-4,Este es Michael.,es,"The text introduces someone named Michael, and this is a simple statement that doesn't require any technical language."
easyread-text-21-2,21,text-21-2,"Ella tiene ojos grandes y azules, una nariz pequeña y una boca grande.",es,"The text describes a person by mentioning three facial features: big blue eyes, a small nose, and a big mouth. I should use simple, everyday words to describe the person."
easyread-text-21-0,21,text-21-0,"Vivir en Uruguay es bonito. Hay playas, y la gente es amable. Puedes jugar y disfrutar del tiempo libre al aire libre.",es,"The text likely provides basic information about living in Uruguay, which may include aspects such as culture, environment, or lifestyle. Simplification involves removing complex terms and ensuring the text uses familiar words suitable for children with cognitive disabilities."
easyread-text-21-3,21,text-21-3,"She has long, straight, blonde hair.",en,"I should describe the girl's hair in an easy way for children to understand. The details are that it is blonde, long, and straight."
easyread-text-21-1,21,text-21-1,This is Caroline.,en,The original text introduces Caroline. The text is already simple and easy to understand for young children. The statement is clear without using complex language.
easyread-text-21-2,21,text-21-2,"She has big blue eyes, a tiny nose, and a wide mouth.",en,"The sentence describes a person's physical features in simple terms. It maintains the gender and details about her eyes, nose, and mouth."
easyread-text-21-5,21,text-21-5,"He has small green eyes, a big nose, and a small mouth.",en,"I need to describe the person's features in simple words, focusing on familiar descriptors like 'small' and 'big' which are easy to understand."
easyread-text-21-6,21,text-21-6,"Su cabello es marrón, corto y rizado.",es,"The sentence is a simple description of physical appearance, specifically about the hair's color, length, and texture. It involves basic vocabulary suitable for easy understanding by school children."
easyread-text-21-8,21,text-21-8,Mira tu cara en un espejo y dibújala o pega una foto tuya.,es,"The text is instructing the reader to either draw their face or paste a picture on a mirror, which might be a task to recognize oneself. I need to simplify the instruction to make it easier for children."
easyread-text-21-7,21,text-21-7,Looking at myself in the mirror.,en,The text might be related to self-reflection or looking at oneself in a mirror. I should simplify it to convey this meaning in an easy and understandable way for children.
easyread-text-21-0,21,text-21-0,The text 'livingUruguay1' refers to living in Uruguay but doesn't give more details to simplify.,en,"The text 'livingUruguay1' might be a title or keyword related to living in Uruguay, but it does not provide any content to simplify. I assume it hints at a broader context about life in Uruguay."
easyread-text-21-7,21,text-21-7,Yo en el espejo:,es,"The original text's intent appears to be introspective or reflective, simply referring to one's own image in the mirror, without any complex context or details."
easyread-text-21-6,21,text-21-6,"His hair is brown, short, and curly.",en,"The sentence describes someone's hair color, length, and texture using simple adjectives."
easyread-text-15-0,15,text-15-0,Vivir en Uruguay puede ser agradable por su gente amable y sus paisajes bonitos. A las personas les gusta por su tranquilidad y su buena comida.,es,"The text is likely about living in Uruguay and possibly focuses on some aspects that make it good or bad to live there. I'll simplify by emphasizing basic, relatable information like what the country is known for or reasons someone might like living there."
easyread-text-21-5,21,text-21-5,"Él tiene ojos verdes pequeños, una nariz grande y una boca pequeña.",es,The original sentence describes the facial features of a male individual using simple adjectives for size and color. The goal is to translate this description clearly to Spanish while maintaining the original meaning and using easy words.
easyread-text-15-1,15,text-15-1,"Para hacer un informe sobre un compañero de clase, puedes escribir sobre sus cualidades buenas y las cosas que hace bien. Por ejemplo, puedes decir si es amigable y qué materias o deportes le gustan.",es,"The text is a prompt asking to write a report about a classmate. To simplify, I should address the topic by describing how one could write a report focusing on the classmate's positive qualities and activities."
easyread-text-21-10,21,text-21-10,UNIT 1,en,The text 'UNIT 1' is a title and does not contain content to simplify. It's just a section header.
easyread-text-21-9,21,text-21-9,"When you look in the mirror, you see yourself. You see your face, hair, and eyes. You might also see your smile or the clothes you are wearing. It's like seeing a picture of you.",en,The task is to explain to children how they might describe their reflection in a mirror without using complex language. We should keep it simple and relatable.
easyread-text-21-8,21,text-21-8,Look at the mirror and either draw your face on paper or stick your photo there.,en,The text asks children to either draw their face or stick a picture of themselves on a mirror. It's a simple task-oriented instruction and can easily be understood by children.
easyread-text-15-3,15,text-15-3,¡Hola! Me llamo,es,"To give an easy-read version of an introduction, I need to understand that simple self-introduction in Spanish should be straightforward and relatable."
easyread-text-15-0,15,text-15-0,"Living in Uruguay is about enjoying good food, friendly people, and a peaceful country. It has beautiful beaches and many animals. The weather is nice most of the time. Many families like to spend time together here.",en,"The task is to provide an easy-to-read version of given text that considers the needs of young children, particularly those with cognitive and learning disabilities. I will ensure that the text is simple, uses familiar words, and is concise."
easyread-text-15-2,15,text-15-2,"Un pirata asustaba a la gente en los mares, y sus aventuras hicieron que otros escribieran historias y canciones sobre él.",es,"To make the text simple for children, I need to use easy words and short sentences. The text talks about a pirate who frightened people on the seas and inspired others to create stories about him."
easyread-text-15-1,15,text-15-1,Write about your classmate.,en,"The original text is a simple instruction asking someone to write a report. My task is to simplify it for easier understanding. The term 'report' can feel formal, so I'll change it to 'write about'. This makes it more accessible for children with cognitive and learning disabilities."
easyread-text-21-11,21,text-21-11,Hi there! It's nice to see you.,en,The text is a simple greeting to welcome someone. I should retain the friendly tone in the simplified version.
easyread-text-15-4,15,text-15-4,Voy a presentar a mi amigo.,es,The text is about introducing a friend. It is a simple idea that can be expressed in familiar terms.
easyread-text-15-3,15,text-15-3,Hi! I am.,en,"The text is an introduction where someone is saying their name. Simplifying, it's a common and easy way to start when meeting new people."
easyread-text-15-5,15,text-15-5,Este es mi compañero o Esta es mi compañera.,es,"This sentence is about introducing someone in Spanish, maintaining the gender of words."
easyread-text-21-11,21,text-21-11,Hola y bienvenidos,es,"The text is a greeting, welcoming someone in a friendly manner. The goal is to use simple Spanish words that convey a warm welcome."
easyread-text-21-12,21,text-21-12,23,es,"The text should be simplified using everyday language to ensure comprehensibility for children with cognitive and learning disabilities, while preserving the original intent and meaning."
easyread-text-15-4,15,text-15-4,I want you to meet my friend.,en,"The original sentence is already simple, short, and clear. However, it can be made even more direct by using simple language in the context of making friends."
easyread-text-21-9,21,text-21-9,"Cuando me miro en el espejo, veo mi cara, mis ojos, mi nariz y mi boca. Puedo ver mi pelo y mi sonrisa.",es,"The text asks to describe oneself when looking in the mirror, likely focusing on physical attributes or feelings. I should use simple words and an active voice to make it easy for children with disabilities to understand."
easyread-text-15-2,15,text-15-2,This is a task guide to help create simple texts.,en,The instruction is about simplifying a text aimed at school children with cognitive and learning disabilities to make it more understandable by using familiar words and active voice.
easyread-text-21-10,21,text-21-10,La primera parte o sección de algo.,es,"The term 'Unit 1' is a label often used in educational or instructional contexts to refer to the first section or topic in a series. In simplifying this, it's important to maintain the fundamental idea that it represents the beginning or initial part of a sequence."
easyread-text-21-12,21,text-21-12,I see the number 23.,en,"The only information given is the number 23, which is not sufficient to generate a meaningful simplified text. Therefore, it reflects the number in a simple statement."
easyread-text-15-6,15,text-15-6,The person is called,en,"I need to ensure that I retain the meaning of identifying someone's name, while keeping it simple and retaining the gender neutrality presented in the input."
easyread-text-15-6,15,text-15-6,Su nombre es,es,"The text shares a name, hence I should convey it simply, while describing what is meant by 'name' in context."
easyread-text-15-7,15,text-15-7,Puedes llamarlo/llamarla.,es,"The phrase indicates that someone has the option to call another person, possibly a friend or family member. I need to translate it into Spanish while maintaining gender options."
easyread-text-15-8,15,text-15-8,Su cumpleaños es el,es,"I need to translate the sentence into simple Spanish while ensuring that 'his/her' is translated in a way that maintains neutral gender, which in Spanish is usually addressed singularly if not specified."
easyread-text-15-7,15,text-15-7,You can phone this person.,en,The text implies that you have the option to call either a man or a woman. It simply refers to contacting a person using a phone.
easyread-text-15-5,15,text-15-5,This is my partner.,en,"The text is introducing someone as the speaker's partner. The sentence is already simple and clear, and it retains the same meaning."
easyread-text-15-8,15,text-15-8,"His or her birthday is on a specific day, but I don't know when.",en,The text aims to specify someone's birthday but doesn't provide any exact details such as date or additional context.
easyread-text-15-9,15,text-15-9,Su color favorito es,es,The sentence is about someone's favorite color. I need to simplify it while keeping the gender neutral and maintaining its meaning.
easyread-text-15-10,15,text-15-10,This person likes a certain number the most.,en,The text mentions someone's favorite number and uses both 'his' and 'her' to indicate any gender. It's important to simplify this and maintain the gender-neutral meaning.
easyread-text-15-12,15,text-15-12,Look at our classroom.,en,The original text is simple and asks the reader to observe the classroom. It uses everyday words and is already in an easy-read format.
easyread-text-15-11,15,text-15-11,This is my friend from class. They are nice and fun to play with.,en,"The task is to simplify the text for children with learning disabilities by using familiar and easy words. To do this, I need to keep the message clear and use simple sentence structures."
easyread-text-15-9,15,text-15-9,He or she likes a certain color best.,en,"The statement talks about a person's favorite color, which is a simple concept. I need to convey that a person likes a certain color."
easyread-text-15-13,15,text-15-13,A picture was taken after the Math class.,en,The sentence is talking about a picture that is related to or was taken after a math class. It needs to be simplified without losing the context.
easyread-text-15-14,15,text-15-14,La otra foto es después de la clase de inglés.,es,"The original sentence is straightforward, but it might need a simpler structure for better understanding. The key information is about the timing of when the other picture was taken, which is after the English class."
easyread-text-15-11,15,text-15-11,Mi amigo se llama Juan. Le gusta mucho jugar al fútbol. Es muy bueno y siempre sonríe. Juan también quiere ayudar a los demás. Es un gran amigo.,es,"The task involves introducing a classmate in a simple and clear manner, using everyday language appropriate for children with cognitive and learning disabilities."
easyread-text-15-10,15,text-15-10,Su número favorito es,es,"The sentence has to be simplified for children to understand. The sentence should be short, in active voice, and clear in the message about favorite numbers."
easyread-text-15-18,15,text-15-18,Foto de Aldo Rodriguez,es,The task is to simplify a title or credit line for a photo to make it more accessible to children with learning disabilities.
easyread-text-15-12,15,text-15-12,Mira nuestra clase.,es,The text asks someone to see the classroom. It's a simple sentence meant to invite someone to observe the classroom setting.
easyread-text-15-13,15,text-15-13,Una foto es después de la clase de Matemáticas.,es,"The sentence refers to a picture that was taken specifically after the Math class, and it is important to communicate this simply and directly for better understanding."
easyread-text-15-15,15,text-15-15,Busca qué cosas no son iguales en las dos imágenes.,es,"The task involves comparing two pictures to find differences, which means identifying what is not the same in both images. This might involve differences in color, shape, position, or items present."
easyread-text-15-17,15,text-15-17,En la foto B hay una goma de borrar en la silla.,es,"The instruction is simple, stating that there's an eraser located on a specific object, the chair. The aim is to convey this information clearly for easier understanding."
easyread-text-15-18,15,text-15-18,The photo was taken by Aldo Rodriguez.,en,The text is attributing a photo to a person named Aldo Rodriguez.
easyread-text-15-16,15,text-15-16,There is an eraser on the table in picture A.,en,The sentence describes an object (an eraser) and its location (on the table). The goal is to simplify this information for clarity.
easyread-text-15-14,15,text-15-14,The other picture was taken after English class.,en,The sentence suggests that there is another picture taken after an English class. It should be simplified to be more direct for better understanding.
easyread-text-15-17,15,text-15-17,Picture B shows an eraser on the chair.,en,I need to make the sentence simple for children to understand. It clearly states the object (eraser) and its location (on the chair).
easyread-text-15-16,15,text-15-16,En la imagen A hay una goma sobre la mesa.,es,"We want to make the information simple for children. It should be very straightforward, stating what is seen in the picture."
easyread-text-15-21,15,text-15-21,17,es,"The number 17 is a simple and straightforward concept, requiring no significant simplification."
easyread-text-15-20,15,text-15-20,Hola y bienvenidos,es,The text is a simple greeting phrase and should remain in its essence without any complex words or expressions.
easyread-text-15-15,15,text-15-15,Look at the two pictures. Find what is different about them. Tell what you see is not the same.,en,I should explain that the task is about observing two images and describing the differences between them in a way that's easy for children to understand.
easyread-text-22-1,22,text-22-1,Yo mismo,es,"I need to facilitate your understanding by recognizing that you are talking about yourself, and I should use simple words to convey this concept."
easyread-text-15-19,15,text-15-19,This could be the first part of a lesson or book.,en,"The text may refer to different things based on context, such as an introductory chapter in a textbook or a section in a course. Without more specific information, I will interpret it as referring to a lesson module."
easyread-text-15-19,15,text-15-19,UNIDAD 1,es,The text 'UNIT 1' is a phrase usually indicating a section or chapter in a book or course. There is no gender-specific language or jargon to simplify here. It mainly signposts the beginning of a section.
easyread-text-15-21,15,text-15-21,17 is a number that comes after 16 and before 18.,en,17 is a numerical value representing a quantity or position.
easyread-text-22-3,22,text-22-3,Escucha y lee para conocer diferentes tipos de casas.,es,The task involves identifying different house types through descriptions by reading and listening. It is important to simplify the idea for better understanding.
easyread-text-22-1,22,text-22-1,"This word means you are talking about yourself, like 'me' or 'I'.",en,"The text 'myself' is a simple self-reference term. To simplify it for school children, I can simply explain that it means talking about oneself in an easy way without any additional complexity."
easyread-text-22-0,22,text-22-0,"""Unidad 2"" es una parte de una lección o un curso que enseña algo nuevo.",es,"Unit 2 is likely a lesson or section in a textbook or course that covers specific content. In simplifying, I need to explain that it is a part of learning."
easyread-text-22-4,22,text-22-4,"Sala, cocina, baño, dormitorio, comedor.",es,The request is simple and asks for names of rooms that can be found in a typical house. An easy method is to list common rooms using simple and familiar words.
easyread-text-22-2,22,text-22-2,"Al terminar esta parte, podrás hacer algo nuevo.",es,"The original text communicates a goal or outcome, focusing on the future ability of the reader after completing a unit. It needs to be simplified to be more direct and clear for children."
easyread-text-22-0,22,text-22-0,"""Unit 2"" is not enough information to simplify. It seems to be a section name for a book or course.",en,"This is a placeholder text for a specified section or unit, but lacks any context or content that would need simplifying."
easyread-text-22-2,22,text-22-2,"When you finish this unit, you will know how to do something new.",en,"The text implies that a goal will be achieved after completing a unit or lesson, which involves acquiring a new ability or understanding."
easyread-text-22-4,22,text-22-4,"In a house, there can be a bedroom, kitchen, bathroom, living room, and dining room.",en,The request asks to list common rooms found in a house in simple terms for easy understanding.
easyread-text-22-3,22,text-22-3,Learn about different types of houses by reading about them and listening to their descriptions.,en,"The text is about identifying different kinds of houses by using our skills of reading and listening. For children, it's important to use simple language to ensure comprehension."
easyread-text-22-5,22,text-22-5,"My house has four rooms. The walls are painted yellow. There is a garden outside with flowers. We have a kitchen to cook food, and a living room to watch TV.",en,"The user asks for a description of a house, so I need to provide a child-friendly, simple depiction that focuses on easy-to-understand characteristics without complex architectural details."
easyread-text-22-5,22,text-22-5,"Mi casa es pequeña y de color azul. Tiene una puerta, ventanas, una cocina, un baño, y dos habitaciones. También hay un jardín con flores.",es,"I should make it easy for children to understand by describing the shape, color, and features like rooms or garden."
easyread-text-22-10,22,text-22-10,Conozcan palabras sobre ropa.,es,The text is about learning words related to clothing. I should simplify it by using familiar words for children.
easyread-text-22-12,22,text-22-12,Mi amigo lleva una camisa y pantalones. Yo uso una camiseta y jeans.,es,"The task requires us to describe outfits in simple and understandable terms for children, using easy language that specifies the clothing items worn by each person."
easyread-text-22-8,22,text-22-8,Haz un diccionario con dibujos para aprender palabras nuevas. Dibuja una imagen para cada palabra.,es,Creating a picture dictionary is helpful because it allows children to understand new words by associating them with images. It is easier for them to remember words when they can see a picture that represents the word.
easyread-text-22-13,22,text-22-13,¿Qué ropa te gusta más?,es,"The original text suggests talking about which clothes you like. To make it simple for children, we can directly ask them which clothes they like."
easyread-text-22-11,22,text-22-11,"Winter clothes are warm, like jackets and sweaters, because it is cold. Summer clothes are light, like t-shirts and shorts, because it is hot.",en,I need to explain the difference between clothes we wear in winter and summer in a simple way that school children can understand.
easyread-text-22-10,22,text-22-10,Let's learn some easy words about clothes.,en,"The text is asking the reader to learn about words that describe clothing. To make it easy to understand for children, I will use simple words and a friendly tone."
easyread-text-22-13,22,text-22-13,Share what kinds of clothes you like to wear.,en,The text asks about showing likes or dislikes for clothes. It should be explained simply so everyone can understand easily.
easyread-text-22-8,22,text-22-8,Make a picture dictionary with new words and pictures. This helps you understand and remember the words better.,en,"Children can learn new words more easily when they see pictures that help explain the meaning. This way, they can associate the word with the image and remember it better. A picture dictionary can make learning fun and more engaging."
easyread-text-14-1,14,text-14-1,Nico se presentó. Ahora te toca a ti. Completa la tabla.,es,The text is about taking turns to introduce oneself and fill in some information in a chart.
easyread-text-22-7,22,text-22-7,"Here are some things you might find in a bedroom:
1. The bed is in the middle of the room.
2. The lamp is on the bedside table.
3. The dresser is against the wall.
4. The closet is next to the door.
5. The chair is by the window.",en,"I need to simplify the text by naming common objects found in a bedroom and indicating where they are, using simple and familiar words."
easyread-text-22-7,22,text-22-7,La cama está en el medio del dormitorio. La mesita de noche está al lado de la cama. El armario está en la esquina del dormitorio. La lámpara está sobre la mesita de noche. La alfombra está en el suelo. La ventana está en la pared cerca de la cama.,es,The task is to list common objects in a bedroom and describe where they are using simple and familiar words.
easyread-text-22-11,22,text-22-11,Las ropas de invierno son abrigadas para el frío. Usamos chaquetas y suéteres. Las ropas de verano son ligeras para el calor. Usamos camisetas y pantalones cortos.,es,"Winter clothes are warm and help protect from the cold, like coats and sweaters. Summer clothes are light and keep us cool, like t-shirts and shorts."
easyread-text-22-12,22,text-22-12,I am wearing blue jeans and a red shirt. My partner is wearing a green dress.,en,"The text asks to describe the clothes that someone and their partner are wearing. To make this simple, I will use everyday words and short sentences."
easyread-text-22-14,22,text-22-14,El número 24 es después del 23 y antes del 25.,es,"The text '24' is a number that stands alone without additional context. In such cases, simplifying it into a narrative suitable for children involves associating it with familiar concepts."
easyread-text-22-6,22,text-22-6,"My ideal bedroom has a big, soft bed with lots of pillows. The room is bright with sunlight coming through the windows. I have a small desk by the window for drawing and reading. My favorite toys and books are neatly on shelves. The walls are painted in happy colors like blue and yellow. It feels very cozy and safe.",en,"The original prompt asks for a description of an ideal bedroom, which could be complex for young children to imagine or understand. I will provide a simpler and more concrete description of a cozy and pleasant room so that it is easier for children to understand and envision."
easyread-text-22-9,22,text-22-9,Piensa en tu juguete favorito cuando eras niño. Habla sobre cómo era y por qué te gustaba mucho.,es,"The text asks to think about a favorite toy from childhood and discuss it. This relates to personal experiences, so the simplified text should encourage thinking about easy-to-understand concepts like remembering, describing, and sharing feelings about the toy."
easyread-text-14-2,14,text-14-2,Hello! My name is,en,"The text simply states a greeting and the phrase ""My name is,"" suggesting the introduction of a person's name. It's straightforward and already uses simple language, hence there's nothing more to simplify."
easyread-text-14-4,14,text-14-4,Soy,es,Potentially completing the sentence as a form of assistance.
