id,page_index,text_id,text,language_code,reasoning
easyread-text-10-2,10,text-10-2,9,es,The number 9 is straightforward and doesn't require simplification.
easyread-text-10-0,10,text-10-0,Dibuja y escribe lo que te gusta hacer cuando no tienes tarea.,es,The task is asking students to draw and write about their hobbies. I should keep the instructions simple and direct.
easyread-text-10-1,10,text-10-1,Dibuja o escribe sobre las cosas que haces muy bien.,es,The text asks to either draw or write about things you are good at doing. The instruction is meant to encourage self-reflection on personal skills or talents.
easyread-text-11-0,11,text-11-0,Diez,es,I need to simplify the number '10' for children.
easyread-text-12-8,12,text-12-8,Once,es,"Since the input is simply a numerical value and not a sentence or a complex statement, the reasoning involves understanding that there is no need for further simplification besides categorizing what the number might represent in context."
easyread-text-12-5,12,text-12-5,Elena corre cuando hay luz.,es,"El texto original se refiere a correr y menciona a Elena corriendo bajo una luz, lo que es una situación abstracta. Simplificando, sólo hay que retener que Elena está corriendo iluminada, evitando el condicional y la repetición de 'corre'."
easyread-text-12-7,12,text-12-7,Puedes revisar la respuesta leyendo el cuento en la página 12.,es,The text is giving a simple instruction to check something on a specific page of a book.
easyread-text-12-0,12,text-12-0,Luces y sombras,es,"The text 'LUCES Y SOMBRAS' means 'LIGHTS AND SHADOWS'. This is a simple text referring to the concept of having both bright (lights) and dark (shadows) aspects in some context. It uses simple, everyday words that are familiar to children. In Spanish, the words used are common and understandable."
easyread-text-12-1,12,text-12-1,¿Quién corre con Elena?,es,"The text is asking a simple question about who is running with Elena. It is straightforward, so just rephrase it in a more easy-to-understand format for children."
easyread-text-12-3,12,text-12-3,No es un animal para tener en casa.,es,The text is stating that something is not a pet. I need to simplify it for easy understanding while keeping the meaning.
easyread-text-12-6,12,text-12-6,Elena corre con otra persona o algo.,es,"The text is simple, stating that Elena is running with someone or something. It's already in a simple form and the only possibility is to add more context if available."
easyread-text-12-2,12,text-12-2,Es una persona.,es,The message communicates a simple fact. It needs to be conveyed in straightforward Spanish for clarity.
easyread-text-12-4,12,text-12-4,No es deportista.,es,"The text is simple, stating that 'He/She is not an athlete'. We just need to maintain the same meaning in an easy-read format for kids."
easyread-text-13-10,13,text-13-10,Lo que más le gustaba era correr carreras.,es,"The text explains a person's preference for running races. To simplify it, I will use easy words and keep the idea clear."
easyread-text-13-11,13,text-13-11,No mires la tele.,es,"The text suggests something being done without the involvement of television, and it implies it's about finding entertainment or activities excluding watching TV. The response should be simple and in Spanish."
easyread-text-13-6,13,text-13-6,Retaba a su tortuga.,es,"The sentence is about someone challenging their turtle. The word 'desafiaba' means 'challenged' or 'was challenging', so the sentence should be simplified keeping this in mind."
easyread-text-13-8,13,text-13-8,No tenía miedo de competir corriendo con su papá.,es,The text is about someone who is not afraid of running against their dad. It should be simplified to express the meaning without losing the context.
easyread-text-13-9,13,text-13-9,¡Perdí!,es,"The original text is very simple and direct, indicating someone exclaimed they lost. It is concise and already uses everyday language."
easyread-text-13-12,13,text-13-12,Ni siquiera los helados.,es,"This phrase means 'Not even the ice creams.' It's a simple phrase indicating that something does not affect or apply to even the ice creams, possibly implying the extent or magnitude of something."
easyread-text-13-4,13,text-13-4,Él corría con su perro.,es,The instruction is to make the text simple and clear for children with cognitive and learning disabilities. I'll provide a simple sentence saying the person runs with his dog.
easyread-text-13-5,13,text-13-5,¡He perdido!,es,"The text is an exclamation of having lost something or a game. It's a very simple statement, so simplifying it involves just reacting to the idea of losing."
easyread-text-13-2,13,text-13-2,Corría con su hermano que gateaba.,es,The text states that someone is running against their brother who is crawling. The task is to simplify this statement without changing its meaning. I will use simpler words and keep it short for better understanding.
easyread-text-13-7,13,text-13-7,¡Gané!,es,"The text is an exclamatory expression of winning, which needs to be simple and clear."
easyread-text-13-0,13,text-13-0,¿Quién viene a correr conmigo?,es,"The question asks about who is running with the speaker, aiming to engage or find a running partner, using simple and direct language."
easyread-text-13-1,13,text-13-1,A Elena le gustaba mucho correr en las carreras.,es,"The sentence describes an activity that Elena enjoys, which is running races. It's a simple sentence indicating her interest or hobby."
easyread-text-13-16,13,text-13-16,Estoy aburrido.,es,"The sentence is very simple and doesn't need further simplification. It means 'I'm bored.' in Spanish, which is already easy to understand."
easyread-text-13-3,13,text-13-3,¡Yo gané!,es,The text is a simple exclamation of winning a game or competition. It conveys excitement.
easyread-text-13-25,13,text-13-25,"Vamos, Elena, a casa del abuelo Enrique y ¡a divertirnos!",es,The text tells Elena to go to Grandpa Enrique's house and have fun. It's simple and invites an action to have a good time.
easyread-text-13-26,13,text-13-26,Los niños que juegan solos aprenden a usar su imaginación y a pensar más.,es,The sentence suggests that children who never play alone will become unintelligent adults. The goal is to simplify the message without implying harsh or negative judgments. The focus should be on the potential benefits of playing alone rather than the negative outcome.
easyread-text-13-23,13,text-13-23,La vecina de al lado es una señora mayor.,es,"The text indicates that the neighbor next door is old. The goal is to keep the meaning straightforward and clear, using simple words."
easyread-text-13-27,13,text-13-27,Doce,es,The number 12 is already in its simplest form for any child to recognize.
easyread-text-13-24,13,text-13-24,"La mamá dijo: ""No le hagas caso.""",es,The text is giving direct instructions to not pay attention to someone. It involves a mother who is telling someone not to listen or consider something else.
easyread-text-13-21,13,text-13-21,"El papá, que es hijo del abuelo Enrique, está triste por lo que dijo Elena, pero dice que tiene unos libros fabulosos.",es,"This text is about a father who is sad because of something Elena said, and he talks about some fabulous books."
easyread-text-13-15,13,text-13-15,Elena dijo que no le gusta ir a la casa del abuelo.,es,The text is about Elena expressing a dislike or reluctance to visit her grandfather. The sentence is simple to understand but needs to be even more clear for school children by possibly adding a bit more context that children can relate to.
easyread-text-13-18,13,text-13-18,Elena se aburre y pone cara de enojo.,es,"The text expresses Elena's feeling of boredom in a simple and direct manner, suitable for children to understand. The active voice 'Elena se aburre' simplifies the text effectively for children with cognitive and learning disabilities."
easyread-text-13-20,13,text-13-20,"¿Quién va a jugar conmigo? No tengo perro, gato ni tortuga.",es,"The text describes a person who is looking for someone to play with. The person does not have any pets like dogs, cats, or even a turtle."
easyread-text-13-14,13,text-13-14,Elena estaba triste porque sus papás le dijeron que tenía que ir a casa del abuelo Enrique.,es,"El texto trata sobre Elena que hace pucheros porque no quiere ir a casa de su abuelo, según le dijeron sus padres."
easyread-text-13-19,13,text-13-19,El abuelo no puede caminar bien.,es,This sentence needs to be made simpler for understanding by school children. The sentence is about an older man who has difficulty walking.
easyread-text-13-22,13,text-13-22,Me gusta correr.,es,"The sentence is simple and direct, saying that someone likes to run. It uses common words that are easy to understand."
easyread-text-13-17,13,text-13-17,El papá dijo que esa persona tiene una casa con un jardín muy lindo.,es,"The text is a statement by a father who comments on someone having a beautiful garden. The aim is to make it clear and simple, especially for a school child with cognitive or learning disabilities."
easyread-text-13-13,13,text-13-13,No hay libros dibujados.,es,I will simplify this sentence by removing the negative 'Ni' to make it easier to understand for children.
easyread-text-14-8,14,text-14-8,—¿Tienes miedo? —preguntó el abuelo.,es,"The text shows a situation where a grandfather is challenging someone, questioning if they are scared. This interaction is usually simple and direct. For children, it's good to use terms that show the conversation without losing the challenge's essence."
easyread-text-14-9,14,text-14-9,Elena dice que no tiene miedo y está lista para correr.,es,El texto es un diálogo en el que Elena responde con orgullo que no tiene miedo y está lista para correr.
easyread-text-14-12,14,text-14-12,Corrieron muchas veces.,es,"The text is repeating the action of running multiple times, indicating that someone or something ran multiple times."
easyread-text-14-11,14,text-14-11,"Es la señal para comenzar una carrera, como decir: ¡preparados, listos, ya!",es,The phrase is a common call given at the start of a race to prompt participants to prepare and begin running.
easyread-text-14-10,14,text-14-10,El abuelo dijo que empezaran.,es,"The text mentions that the grandfather gave a signal to start something, which is a common concept where someone initiates an event or action. Simplifying it involves using familiar terms for starting something."
easyread-text-14-6,14,text-14-6,¿Por qué no corres con tu sombra?,es,"The text is asking why someone doesn't race against their shadow, which is a playful and imaginative question. To simplify this, it should convey a sense of playing or doing something fun and silly. The verb 'corrés' also needs to be simplified as 'corres'."
easyread-text-14-3,14,text-14-3,A ella le gustaba competir en las carreras.,es,The sentence is about a girl who enjoys the challenge aspect of racing. The focus is on racing and the excitement it brings to the girl.
easyread-text-14-4,14,text-14-4,El abuelo le preguntó a Elena por qué estaba triste.,es,The text shows a grandfather asking Elena why she looks upset. The grandfather notices Elena's expression and asks about it in simple words.
easyread-text-14-2,14,text-14-2,Pero pronto se cansó.,es,"The sentence is very simple, stating that a person (gender-neutral) soon got bored. It uses common words appropriate for children."
easyread-text-14-5,14,text-14-5,Estoy aburrido porque no tengo a nadie con quien correr.,es,The text shows that someone is bored because they have no one to race with.
easyread-text-14-14,14,text-14-14,"Elena corrió muy rápido, más rápido que los conejos en el campo.",es,"The sentence describes Elena running very fast, faster than hares, which are known for their speed. The aim is to convey this simple and clear to children."
easyread-text-14-1,14,text-14-1,"Primero, él corrió alrededor del jardín.",es,The sentence describes someone running around the garden initially. I need to simplify it using straightforward words.
easyread-text-14-7,14,text-14-7,¿Estás enojado con tu sombra?,es,"The text asks if someone is against their shadow. Shadows are familiar concepts for children, making it relatable."
easyread-text-14-22,14,text-14-22,"Apúrate, apúrate, apúrate.",es,The text is telling someone to be fast or to hurry. The words are repeated for emphasis.
easyread-text-14-19,14,text-14-19,A Elena no le gustaba cuando no ganaba.,es,"The text is about Elena, and it highlights that she doesn't like losing. I should focus on making this idea clear and simple for children."
easyread-text-14-26,14,text-14-26,Elena siempre estaba un poquito adelantada.,es,The sentence emphasizes that Elena was always slightly ahead in whatever she was doing. The idea is to retain this sense of competence or quickness in Elena's actions.
easyread-text-14-27,14,text-14-27,"Elena dijo que ganó y que es muy rápida, más que su sombra.",es,The text is about Elena celebrating her victory by claiming she is faster than her shadow. The key idea is her excitement and self-confidence.
easyread-text-14-24,14,text-14-24,"La sombra corría rápido, más rápido que las nubes en el cielo.",es,"The text describes a shadow that moves very fast, faster than clouds in the sky. To simplify, we focus on how the shadow moves quickly."
easyread-text-14-25,14,text-14-25,La sombra se movió rápido.,es,"The text is explaining an action involving a shadow moving quickly, making it necessary to simplify the concept of speed for understanding."
easyread-text-14-23,14,text-14-23,"Elena corrió muy rápido, como un rayo.",es,"The sentence describes how fast Elena ran, comparing her speed to that of a lightning bolt. To simplify it for children, it uses familiar and simple language without altering the meaning of the sentence."
easyread-text-14-13,14,text-14-13,¡Corre rápido!,es,"The text uses the same word repeated multiple times, emphasizing speed or urgency. We need to simplify by using a phrase that is easy to understand for children."
easyread-text-14-20,14,text-14-20,"—¡Corran hacia mí! —dijo el abuelo—. A sus marcas, listos, ¡ya!",es,The text involves a grandfather telling children to run and start a race. The wording should be easy to understand and follow for children.
easyread-text-14-18,14,text-14-18,"—¡Perdí!, ¡perdí jugando contra mi sombra! —dijo enojada.",es,The text is about someone who is upset because they lost to their own shadow. The person is expressing frustration over this situation.
easyread-text-14-21,14,text-14-21,Ellos corrían mucho.,es,The text is about people running repeatedly. The idea is to emphasize that they ran a lot.
easyread-text-14-17,14,text-14-17,Pero la sombra siempre estaba un poco adelante.,es,The sentence talks about a shadow that is always slightly ahead. It needs to be simplified for better understanding by children.
easyread-text-14-15,14,text-14-15,"La sombra corría rápido, más rápido que los leones en la selva.",es,"The text describes a shadow moving faster than lions in the jungle. To simplify for children, it uses simple words and a familiar context of fast animals."
easyread-text-14-16,14,text-14-16,Elena fue rápido.,es,"The sentence is already simple and short, making it suitable for school children. 'Elena se apuró' is a straightforward sentence that tells us that Elena hurried."
easyread-text-14-0,14,text-14-0,Elena tuvo que ir a la casa de su abuelo.,es,The sentence implies Elena had to go to her grandfather's house despite any circumstances. It's important to convey this simple action clearly.
easyread-text-14-28,14,text-14-28,13,es,The text '13' is a number and does not require simplification as it is already simple and commonly understood.
easyread-text-15-16,15,text-15-16,El sol está detrás de ti.,es,The text describes the position of the sun and emphasizes a clear concept that is easy to visualize for children.
easyread-text-15-28,15,text-15-28,"De repente, todas las sombras del jardín se fueron.",es,"The sentence describes a sudden change in the garden where shadows vanish, implying a change in lighting, such as the sun coming out. For children, it's easier to say it straightforwardly."
easyread-text-15-34,15,text-15-34,La tarde en casa del abuelo fue muy emocionante.,es,The text describes an exciting end to an afternoon spent at the grandfather's house.
easyread-text-15-27,15,text-15-27,La noche llegó.,es,"The text is simple and short. It states that night had arrived. For school children with cognitive and learning disabilities, it helps to use very direct language that conveys the same meaning."
easyread-text-15-3,15,text-15-3,"Cada vez que perdía, lloraba un poco y sus ojos brillaban.",es,The sentence describes how someone cries and their eyes shine when they lose. I need to use simple language to convey this emotion.
easyread-text-15-32,15,text-15-32,Elena estaba muy cansada. Comió un poco y luego usó la tortilla como almohada.,es,The text describes how Elena was very tired and used a tortilla as a pillow after taking a few bites of food.
easyread-text-15-10,15,text-15-10,El secreto es esto:,es,"The original text is very short and doesn't provide any context or complex ideas to simplify, but it is given in a mysterious tone as 'The secret says this:' in Spanish. The simplification aims to maintain this tone while using everyday, easy-to-understand language."
easyread-text-15-31,15,text-15-31,El abuelo hizo una tortilla de papas muy grande.,es,"The sentence tells us that the grandfather cooked a large potato omelet. It uses simple vocabulary and can be understood easily, so it will be simplified while keeping the core information."
easyread-text-15-29,15,text-15-29,La sombra de Elena siempre está con ella.,es,"The text is quite abstract. It refers to the shadow of Elena, which can mean different things. To simplify it, I need to make it more understandable for children, possibly by explaining that shadows follow us or are always with us."
easyread-text-15-26,15,text-15-26,El abuelo contó ochenta y siete victorias.,es,The sentence states that the grandfather counted eighty-seven victories. I will simplify this by using everyday words and making sure it's easily understandable.
easyread-text-15-23,15,text-15-23,"Elena sabía un gran secreto para vencer a las sombras. Por eso, ella corría mirando al sol.",es,"The text is about a girl named Elena who knows a big secret to defeat shadows, so she runs towards the sunlight."
easyread-text-15-24,15,text-15-24,¡Ganó muchas veces! ¡Cada carrera la celebró muy feliz!,es,The text shows someone who is very happy and excited after winning races. I need to keep the excitement and the repetitive nature of their exclamations in a simplified manner.
easyread-text-15-25,15,text-15-25,A Elena le gustaba ganar.,es,The sentence specifies a person's name 'Elena' and her liking for winning. The goal is to maintain simplicity and keep the main information: Elena likes to win.
easyread-text-15-13,15,text-15-13,La sombra te sigue muy de cerca.,es,"The text describes something that feels close and threatening, like a shadow biting at one's heels. A simpler way to say this for children would be to describe the shadow as following closely."
easyread-text-15-18,15,text-15-18,"aunque corras rápido y fuerte,",es,The text is encouraging a person and mentions running hard. The focus is to simplify the idea and keep it relatable.
easyread-text-15-19,15,text-15-19,Ella va a ganar seguro.,es,"The sentence implies certainty about her winning, without context or complex structure. It should remain straightforward, focusing on the assured outcome and gender-specific pronoun."
easyread-text-15-15,15,text-15-15,Siempre serás el primero.,es,The text is about being first. I need to simplify it using simple words for children.
easyread-text-15-17,15,text-15-17,La sombra que tienes delante se hace más larga.,es,The phrase 'sombra ante ti se alarga' can be complex for children. We can simplify it to convey the idea that a shadow in front of you is getting longer.
easyread-text-15-21,15,text-15-21,El abuelo habló.,es,"The text is a simple sentence where the grandfather says something. To simplify it for children, I state that the grandfather spoke."
easyread-text-15-22,15,text-15-22,Estás lista para ganar.,es,"The original text is a motivational statement in Spanish, meaning that the person is ready to win or overcome challenges."
easyread-text-15-20,15,text-15-20,Elena dijo los versos muchas veces hasta que los aprendió de memoria.,es,The text is about Elena repeating verses until she memorized them. It's important to use simple words like 'aprender' (learn) and 'de memoria' (by heart) because they are more understandable for children.
easyread-text-15-33,15,text-15-33,¿No tendrías sueño después de correr mucho?,es,The original text asks a question about feeling tired after running. The simplified version removes complex structures and uses more familiar words.
easyread-text-15-37,15,text-15-37,"Pero, de pronto, apareció la luna.",es,The phrase indicates a sudden appearance of the moon. It's important to ensure the sentence remains simple and clear.
easyread-text-15-8,15,text-15-8,Elena pregunta emocionada si eso nunca pasó.,es,Elena siente mucha emoción y hace una pregunta a alguien sobre algo que parece no haber sucedido antes.
easyread-text-15-4,15,text-15-4,"Cada vez que ganaba, sonreía mucho y mostraba sus dientes brillantes.",es,The sentence talks about how winning makes someone smile with shiny teeth. It needs to be simplified and made easy for school children to understand.
easyread-text-15-1,15,text-15-1,A Elena le gustaba mucho ganar.,es,"The original sentence just says that Elena loves to win. This is a simple concept and doesn't need much simplification, but I can ensure it remains straightforward."
easyread-text-15-2,15,text-15-2,Participó en muchas carreras.,es,"The text is simple and states that someone participated in several races. To ensure clarity and understanding for children, I will use a simple phrase with familiar words."
easyread-text-15-0,15,text-15-0,El número es 14.,es,"The number '14' is presented, which is a simple numeric value without any complex context, making it already easy to understand by children."
easyread-text-15-9,15,text-15-9,El abuelo dijo que siempre ganarás.,es,The text is the grandfather assuring someone that they will always win. It's important to convey this assurance in a simple manner for better understanding.
easyread-text-15-30,15,text-15-30,"Elena quería correr con alguien, pero no había nadie. Así que entró a la casa.",es,"Elena tenía ganas de correr, pero no había nadie con quien hacerlo. Por eso, decidió entrar a la casa."
easyread-text-15-14,15,text-15-14,"Corre lento o rápido,",es,The text gives advice about running speed.
easyread-text-15-5,15,text-15-5,"Luego, el abuelo vino y le habló.",es,The text involves a simple interaction where the grandfather speaks to someone. The aim is to simplify the text for better understanding.
easyread-text-15-35,15,text-15-35,"Elena se durmió, entonces su abuelo fue al jardín.",es,The text is about Elena falling asleep and then her grandfather going out to the garden. The sentence structure is simple and should be kept straightforward for easy understanding.
easyread-text-15-38,15,text-15-38,"Cuando el animal de hocico blanco apareció, todo volvió a tener sombra.",es,"The text describes how the appearance of a creature with a white muzzle affected the environment, specifically causing things to regain their shadows. The sentence is poetic and metaphorical, so the simple version should keep the essence but explain it more plainly for children."
easyread-text-15-11,15,text-15-11,Un gran secreto para no tener miedo.,es,The text likely refers to a significant or important way to overcome fears or problems symbolized by 'shadows'. I need to simplify this concept for children.
easyread-text-15-36,15,text-15-36,Al principio no había luz.,es,"The text describes the beginning when everything was dark, and it can be simplified for children to understand that initially, there was no light."
easyread-text-15-12,15,text-15-12,"Cuando miras al sol,",es,"The text refers to an action someone can do, which is turning their face towards the sun. This needs to be simplified with straightforward words for better understanding."
easyread-text-15-6,15,text-15-6,"Ahora que has ganado y perdido mucho, te voy a contar un gran secreto para vencer a las sombras.",es,"The text is saying that after experiencing many wins and losses, someone is about to learn a big secret to defeating shadows. The sentence can be simplified by using everyday words like 'secret' and 'shadows' and turning it into a more readable format for children."
easyread-text-15-7,15,text-15-7,"Si conoces a alguien que corre muy rápido, siempre ganas las carreras contra los demás.",es,The text describes someone who is so skilled in running that people who know them never lose a race against others. The focus is on the impressive ability of this person.
easyread-text-15-39,15,text-15-39,Ruth Kaufman es una persona de Argentina y tiene algo que ver con 'Sudamericana'.,es,Ruth Kaufman is a person from Argentina who is associated with the term 'Sudamericana.' I need to present this information in simple language for children.
easyread-text-16-8,16,text-16-8,Elena es una niña que vive con su familia.,es,"The text introduces a girl named Elena and mentions she lives with her family. It is a straightforward text with no complex language. However, it could be simplified slightly for even better understanding by younger children."
