id,page_index,text_id,text,language_code,reasoning
easyread-text-22-8,22,text-22-8,La palabra 'como' pregunta cómo hacer algo o describe una acción.,es,"La palabra 'como' se puede usar de diferentes maneras en español. Puede significar 'de qué manera' o 'de qué forma', usado para preguntar o describir cómo hacer algo. Es importante darle un contexto para mantener la simplicidad."
easyread-text-22-15,22,text-22-15,Es muy amable.,es,"The prompt is asking to complete a sentence with a personality trait. To make it simple and accessible for school children, I'll use straightforward language and a common personality trait that children might relate to."
easyread-text-22-23,22,text-22-23,y cuando sonríe parece algo bonito,es,The text is about someone who smiles and it looks like something. I need to simplify this idea with clear words.
easyread-text-22-11,22,text-22-11,Piernas son la parte del cuerpo que usamos para caminar y correr.,es,The text is a single word 'Piernas' which means 'Legs' in Spanish. It refers to a body part that helps humans and animals to stand and move.
easyread-text-22-20,22,text-22-20,Tiene el pelo corto.,es,"The text 'Tiene el pelo' is a fragment that can be part of a sentence about someone's hair. To make it simple, we need to complete it with common descriptors or actions."
easyread-text-22-25,22,text-22-25,Le gusta.,es,The text states a simple phrase about someone's liking. I need to keep it straightforward and translate it to a readable form for children.
easyread-text-22-24,22,text-22-24,Sus manos,es,"The text is very simple, just referring to hands. No further simplification or additional context is needed for young readers."
easyread-text-22-13,22,text-22-13,El abuelo de Elena.,es,"The text is about someone's grandparent, specifically Elena's grandfather. Since there's no more information, it's a simple statement indicating a relationship."
easyread-text-22-1,22,text-22-1,Pelo,es,"The word 'pelo' in English means 'hair.' It refers to the strands growing on a person's head or body. Since it is just a simple noun, it does not need further simplification."
easyread-text-22-4,22,text-22-4,Es humo.,es,"The text is very concise and lacks context, but it refers to smoke."
easyread-text-22-0,22,text-22-0,El abuelo de Elena es fuerte como un árbol y sabio como un libro.,es,I need to use simple comparisons to describe Elena's grandfather in a way that's easy to understand.
easyread-text-22-2,22,text-22-2,Gris es un color entre negro y blanco.,es,The word ‘gris’ means a color. It is a shade between black and white.
easyread-text-23-6,23,text-23-6,¿Te asusta?,es,"The text is asking if something scares you, using a direct and simple question form."
easyread-text-23-4,23,text-23-4,¿Por qué no juegas a correr con tu sombra?,es,The text asks someone why they don't run against their shadow. This can be simplified for children by using simpler language and making it a bit playful.
easyread-text-23-0,23,text-23-0,Mira las palabras importantes del cuento.,es,"The instruction asks to focus on the underlined words in the dialogue of a story or tale, which might be a complex task for children with cognitive and learning disabilities. Simplifying involves breaking down the instruction into an easy action."
easyread-text-23-1,23,text-23-1,"¿Por qué estás triste, Elena?",es,The text is asking Elena why she looks upset or unhappy. The expression 'tener trompa' is a colloquial way to say someone is making a sour face or is pouty. I should simplify this idea while keeping it friendly and easy to understand.
easyread-text-23-7,23,text-23-7,El abuelo la retó.,es,The grandfather challenged someone or something.
easyread-text-23-2,23,text-23-2,El abuelo hizo una pregunta.,es,The text is a simple statement that the grandfather asked something. Using the active voice and simple vocabulary can make it more accessible.
easyread-text-23-13,23,text-23-13,Pon las cosas en una caja y escríbelas abajo.,es,"The text instructs someone to enclose something and write it underneath. For simplifying, I will make it clear that they should put something in a box and write below it."
easyread-text-23-3,23,text-23-3,Me aburro porque no tengo a nadie para correr.,es,The sentence is about someone expressing boredom because they do not have anyone to race against. I will simplify it using easy words.
easyread-text-23-5,23,text-23-5,¿Contra mi sombra? - ¿Lucho contra algo que no puedo ver?,es,"The text is a Spanish dialogue fragment meaning 'Against my shadow?', suggesting a confrontation or a question of whether to fight against something as intangible as a shadow."
easyread-text-23-14,23,text-23-14,El número 22 es un número después del 21 y antes del 23.,es,"The provided input '22' does not contain enough context or content to elaborate upon. However, for the sake of demonstration and following the guidelines, I will provide an example of how one might simplify a similar scenario."
easyread-text-23-12,23,text-23-12,Busca en la escena cosas que tengan las letras 'mp' o 'mb' en su nombre.,es,"The text asks to find objects with names that include the letters 'mp' or 'mb'. The simplified version should instruct children in a clear manner, avoiding unnecessary complexity."
easyread-text-23-11,23,text-23-11,"Sombra es lo que se forma cuando algo bloquea la luz del sol o de una lámpara. Por ejemplo, si te pones frente al sol, tu cuerpo creará una sombra en el suelo.",es,"The text provided is extremely brief, containing only the word ""sombra"", which means ""shadow"" in English. Shadows are familiar concepts, particularly for children, as they often play with shadows or see them regularly."
easyread-text-23-8,23,text-23-8,Completa los cuadros con palabras que se parecen a trompa y sombra.,es,The text is instructing to fill in blanks with words related to 'trompa' and 'sombra'. We need to simplify it for children by explaining the family of words.
easyread-text-23-9,23,text-23-9,Puedes usar el diccionario para ayudarte.,es,"Simplifying this means breaking down complex language into familiar terms. Here, 'puedes ayudarte' suggests an action that a person can take themselves."
easyread-text-23-10,23,text-23-10,Trompa es la nariz larga del elefante.,es,"The word 'trompa' can refer to several things depending on context, such as a musical instrument (trumpet), an elephant's trunk, or a snout. For children, using an everyday example like an elephant's trunk makes it relatable and understandable."
easyread-text-24-10,24,text-24-10,¡Gané! Estoy muy contento por ganar.,es,"The text expresses excitement and celebration over winning, which is a clear and simple concept for children to understand."
easyread-text-24-11,24,text-24-11,No tenía miedo de correr contra algo o alguien.,es,The text states that someone did not have a fear of running against something or someone. It's important to maintain the meaning and simplicity.
easyread-text-24-12,24,text-24-12,Papá significa papá o padre en español.,es,The input 'papá' is a simple Spanish word for 'dad'. There is no complex structure or vocabulary to simplify.
easyread-text-24-7,24,text-24-7,"¡Oh no, perdí un juego!",es,The text is expressing disappointment or stating that someone lost a game or competition. It needs to be conveyed in a simple way for easy understanding.
easyread-text-24-13,24,text-24-13,Cambia los pronombres resaltados para usar nombres de los personajes.,es,The instruction is to change highlighted pronouns into names or titles for characters. This will help children understand who is being talked about without confusion from pronouns.
easyread-text-24-14,24,text-24-14,A ella le gustaba mucho correr en carreras.,es,"The sentence says that she loved to run races, and I need to keep the idea simple and clear."
easyread-text-24-5,24,text-24-5,También él corría en la competencia.,es,"The text seems to suggest that someone was running against someone or something, perhaps in a race or competition."
easyread-text-24-17,24,text-24-17,El número '23' es fácil de entender.,es,"The number '23' is a simple number and does not require simplification for easy reading. It is already accessible to most readers, including children with cognitive and learning disabilities."
easyread-text-24-15,24,text-24-15,Ella se puso triste cuando le dijeron que tenía que ir a su casa.,es,"The original text describes a girl who is upset because someone told her that she has to go to someone's house. The phrase 'hizo pucheros' might be difficult to understand, so I need to use simpler words."
easyread-text-24-9,24,text-24-9,Tortuga.,es,"The text is short and just says 'tortuga,' which is the Spanish word for 'turtle.' There are no complex sentences or concepts to simplify."
easyread-text-24-8,24,text-24-8,Retaba a alguien o algo.,es,"The text is about a person or character who challenges or confronts something or someone, maintaining the action in active form for clarity."
easyread-text-24-16,24,text-24-16,Él dijo que sus libros son fabulosos. Era el nieto del abuelo Enrique y se puso triste con lo que ella dijo.,es,The sentence describes a boy who is the grandson of abuelo Enrique and feels sad after a girl mentioned something about his fabulous books.
easyread-text-24-0,24,text-24-0,Escribe el pronombre correcto en la línea.,es,"The sentence asks to write the correct pronoun on the dotted line, which is a simple instruction task."
easyread-text-24-1,24,text-24-1,A Elena le gustaba mucho correr en competencias.,es,"The text is about Elena, who loves to run races. It uses simple words but needs to be clear with an emphasis on Elena's enjoyment of running races."
easyread-text-24-4,24,text-24-4,¡Yo gané!,es,The text is a short exclamation of winning. I should keep it straightforward and reflect the enthusiasm.
easyread-text-24-2,24,text-24-2,Corría en contra de algo.,es,"The phrase 'Corría contra' seems to be missing context, but it implies running against or opposing something. I'll simplify the phrase to 'Corría en contra de algo', which children can understand better."
easyread-text-24-3,24,text-24-3,Mi hermano bebé está aprendiendo a gatear.,es,"Hermano que gateaba describes a sibling who is crawling, possibly in the context of a toddler or young child learning to move by crawling. This statement is simple and direct, as it describes a common action observed in young children."
easyread-text-24-6,24,text-24-6,Un perro es un animal doméstico que ladra.,es,"The text simply states the term 'perro', which means 'dog' in Spanish. The task requires simplifying the term for better understanding. Since 'perro' is already a simple term, little modification is needed."
easyread-text-25-9,25,text-25-9,"Los cuerpos opacos, como el cartón, no dejan pasar la luz y crean sombras.",es,"The text explains what opaque objects are. Opaque objects, such as cardboard, do not let light pass through and create shadows."
easyread-text-25-10,25,text-25-10,"Los cuerpos translúcidos dejan pasar la luz, pero no se puede ver claro a través de ellos.",es,The text is about translucent bodies that let light pass through but do not allow clear vision. The simplified text should use simple words to describe that.
easyread-text-25-12,25,text-25-12,"Los objetos transparentes dejan pasar la luz, como el vidrio de las ventanas o los lentes.",es,"The text explains that transparent objects let light pass through them clearly, like window glass or lenses."
easyread-text-25-2,25,text-25-2,El Sol es una estrella y está hecho de gases que explotan.,es,"The text explains that the sun is a star and is made up of explosive gases, but we need to make it simple and relatable for young children."
easyread-text-25-5,25,text-25-5,La mayoría de las cosas que vemos no tienen su propia luz.,es,The text explains that most objects do not produce their own light. I need to convey this in simple terms so children understand that not everything shines or emits light by itself.
easyread-text-25-13,25,text-25-13,La sombra tiene diferentes formas.,es,"The text 'LA FORMA DE LAS SOMBRAS' is about the shape of shadows, which is a simple concept involving everyday observations of how shadows appear depending on light sources."
easyread-text-25-4,25,text-25-4,"Algunas luces no son naturales, como las lamparitas y las velas.",es,"The text is about sources of light that are not natural, such as electric lamps and candles. Children can connect with these everyday examples easily."
easyread-text-25-6,25,text-25-6,Podemos verlos porque les llega luz de algo que brilla.,es,The original text talks about how we can see objects because they get light from something bright. I need to simplify the sentence and use everyday words.
easyread-text-25-0,25,text-25-0,Es un libro grande con mucha información sobre diferentes temas.,es,"The text 'ENCICLOPEDIA' refers to a comprehensive collection of information on various topics. To make it simpler for children, we can say it's a big book with lots of information about many different things."
easyread-text-25-1,25,text-25-1,"La luz ayuda a ver las cosas. Cuando algo bloquea la luz, se forma una sombra.",es,"The text is about basic concepts of light and shadow, which are familiar to school children. These concepts can be explained using simple language that emphasizes observation and experience."
easyread-text-25-3,25,text-25-3,Es el Sol que nos da luz y calor en la Tierra.,es,"The text is about the source of light and heat on Earth, which is the sun."
easyread-text-25-11,25,text-25-11,"Algunos ejemplos son el cristal opaco y el nailon, un material muy usado en ropa.",es,"The original text gives examples of frosted glass and nylon, but it uses technical names. For easy understanding, I should simplify the language so it is more about the everyday uses or appearances of the materials."
easyread-text-25-14,25,text-25-14,Las sombras cambian de forma durante el día cuando el sol brilla.,es,The text talks about how the shapes of shadows change during the day because of sunlight.
easyread-text-25-8,25,text-25-8,"Los objetos se pueden clasificar como opacos, traslúcidos y transparentes según la cantidad de luz que dejan pasar.",es,The text is about classifying objects based on how much light they let through. I need to simplify the language for children by using everyday terms and ensuring the meaning is clear.
easyread-text-25-16,25,text-25-16,La luz del sol viaja en línea recta y por eso las sombras cambian de forma.,es,"The text explains that sunlight travels in straight lines, causing shadows to change shape."
easyread-text-25-18,25,text-25-18,"Para aprender sobre la luz y la sombra, busca en internet usando tu computadora.",es,"The original text directs the reader to search and learn more about light and shadow using a specific website link. To simplify for children, I need to convey the main action of looking up information about light and shadow online in a straightforward manner."
easyread-text-25-19,25,text-25-19,Veinticuatro,es,"The number '24' is a simple numerical value, and in translating it for easy comprehension, I should directly translate it to Spanish as it is already a universally recognized number."
easyread-text-25-17,25,text-25-17,El texto fue hecho por ProLEE usando muchas enciclopedias para este cuaderno.,es,"The text involves explaining the origin of a text created by ProLEE for a notebook using various encyclopedic sources. School children with cognitive and learning disabilities need text simplified to ensure understanding, using familiar words in everyday language."
easyread-text-25-15,25,text-25-15,"Las sombras son largas en la mañana, cortas o no se ven al mediodía, y largas otra vez en la tarde.",es,"The text describes how shadows change during the day: they are long in the morning and evening, and short or gone at noon. My goal is to simplify this information for better understanding."
easyread-text-25-7,25,text-25-7,"Los cuerpos son cosas como personas, animales o objetos. La luz es lo que nos ayuda a ver. Algunos cuerpos brillan con la luz, otros no dejan pasar la luz, y hay cuerpos que dejan pasar un poco de luz.",es,"The text title refers to how bodies interact with light. This means how things behave with light, like how they may reflect, absorb, or transmit it. For children, I will explain this in a simple manner, showing the basic idea of how light reacts with objects."
easyread-text-26-11,26,text-26-11,Los objetos opacos no dejan pasar la luz.,es,"The original text incorrectly states that opaque objects let light pass through. In reality, opaque objects do not let any light through, while transparent objects do."
easyread-text-26-12,26,text-26-12,Las cosas opacas no dejan pasar la luz.,es,The original text talks about opaque objects blocking light from passing through. I need to simplify and explain this concept using familiar words.
easyread-text-26-17,26,text-26-17,Veinticinco,es,"The input is just the number 25, which does not require simplification but translation to Spanish."
easyread-text-26-14,26,text-26-14,Es igual a decir,es,We need to simplify the concept without using complex words or expressions. Use basic and familiar words for easy understanding.
easyread-text-26-16,26,text-26-16,La luz del Sol viaja en línea recta desde donde sale hasta el objeto.,es,"The sentence is about how sunlight travels in a straight line from its source to an object. To make it easy to understand, I need to use simple and direct language."
easyread-text-26-13,26,text-26-13,La luz del Sol viaja en línea recta.,es,"The sentence explains how sunlight travels in a straight line. It uses simple words that are easy for children to understand. However, we can simplify it further by breaking it down into even more basic terms."
easyread-text-26-15,26,text-26-15,La luz del Sol viaja en línea recta.,es,The text describes how sunlight travels in a straight line. I will use simple words and clear sentence to make this concept understandable for children.
easyread-text-26-0,26,text-26-0,El texto habla sobre la luz y la sombra.,es,"The original text was likely about light and shadow, possibly explaining some concepts related to these topics. It might have contained complex explanations."
easyread-text-26-7,26,text-26-7,El Sol nos da luz y calor en la Tierra.,es,"The text informs us that the Sun provides light and heat to Earth. To simplify it, we should use simple words and make it clear directly what the sun gives to us."
easyread-text-26-4,26,text-26-4,Escribe en la línea cómo puedes explicarlos de otra forma.,es,"The text is giving instructions on writing an explanation. To make it easy to understand for children, I need to simplify the language and sentences."
easyread-text-26-5,26,text-26-5,El Sol da luz y calor a la Tierra.,es,"The text describes the Sun as the natural source of light and warmth for Earth, which is a simple concept that can be expressed in basic language."
easyread-text-26-2,26,text-26-2,Fíjate bien en las frases resaltadas.,es,"The original text asks to pay attention to specific highlighted expressions. Simplifying this involves using easy, clear language to communicate the same action of paying attention."
easyread-text-26-8,26,text-26-8,El Sol da mucha luz.,es,"The text is talking about the Sun being a source of light, using simpler words and familiar concepts."
easyread-text-26-3,26,text-26-3,Elige la respuesta correcta.,es,"The text uses simple, everyday words and asks to choose the right option."
easyread-text-26-10,26,text-26-10,Significa lo mismo.,es,The text suggests that two things are the same. An easy way to say this in Spanish for children is to mention that two things mean the same.
easyread-text-26-6,26,text-26-6,Significa lo mismo.,es,"The text asks if two things are the same, likely comparing two statements or situations."
easyread-text-26-9,26,text-26-9,Los objetos opacos no dejan pasar la luz.,es,"The text is explaining that opaque objects do not let light pass through them. For school children, it is important to use simple words to help them understand this concept more easily."
easyread-text-26-1,26,text-26-1,Lee estas oraciones.,es,The instruction is asking to read some statements.
easyread-text-27-18,27,text-27-18,26,es,"The text is simply a number, '26'. There's no additional context or content in the original text to simplify further for school children."
easyread-text-27-11,27,text-27-11,La mayoría de las cosas que vemos no tienen su propia luz.,es,The text explains that most objects do not emit their own light. I should use simple words to convey that concept.
easyread-text-27-4,27,text-27-4,Estrella,es,"The text is a single word, ""Estrella,"" which means ""Star"" in English. The word does not need further simplification as it is already simple and familiar in Spanish."
easyread-text-27-12,27,text-27-12,Podemos ver las cosas porque la luz les ilumina.,es,The text says that we can see something because it receives light from a bright object. We need to simplify it by explaining that we see things because light shines on them.
easyread-text-27-6,27,text-27-6,Brillante o que da mucha luz.,es,The word 'luminoso' means bright or shining. It is used to describe something that gives off light or is well-lit. The simplified text maintains this meaning in an easy-to-understand way.
easyread-text-27-5,27,text-27-5,Objeto en el espacio que da luz por sí mismo.,es,"The text refers to an astronomical body that emits its own light. This can be any natural celestial body like a star, which shines brightly on its own. The language should be simplified so that children can understand that it is something in space that gives off light by itself."
easyread-text-27-9,27,text-27-9,El sol nos da luz y calor a la Tierra.,es,"The text talks about the sun, which provides light and warmth to the Earth. I need to keep the information straightforward and use simple language."
easyread-text-27-13,27,text-27-13,Copia el texto y añade la información de las libretas.,es,"The task is to rewrite the given text to be simple and understandable for children with cognitive and learning disabilities, in the Spanish language. The original sentence is asking to include notes from notebooks, which can be complex. The simplified version should remove any unnecessary complexity and focus on conveying a straightforward action."
easyread-text-27-14,27,text-27-14,Haz esta tarea en tu cuaderno de clase.,es,"The sentence instructs someone to do a task in their class notebook. The instruction is straightforward and doesn't contain any complex terms, so it only needs slight simplification."
easyread-text-27-15,27,text-27-15,El Sol es una estrella grande que brilla por sí sola en el cielo.,es,"The text explains that the Sun is a star, which means it's a celestial body that shines by itself. Simplifying this for children involves using simpler words and concepts like saying the Sun is a big star that shines by itself in the sky."
easyread-text-27-7,27,text-27-7,"Algo que brilla o da luz, como una lamparita o el sol.",es,"The text is about a body or object that gives off light, which can be explained in simpler terms using everyday examples like a light bulb or the sun."
easyread-text-27-8,27,text-27-8,El Sol es una estrella brillante.,es,"The text is about the Sun being a star, and it's important to convey this information simply for children."
easyread-text-27-17,27,text-27-17,Revisa los puntos y las comas.,es,"The original text asks to check punctuation, which might be complex for some children. It's important to make it simple and clear."
easyread-text-27-16,27,text-27-16,Usa paréntesis (como estos) o palabras como 'o sea' para añadir más información.,es,The original text is about using parentheses or connectors to add more information. I need to simplify this to make it understandable for children.
easyread-text-27-10,27,text-27-10,"Las luces que hacemos los humanos, como las lamparitas eléctricas y las velas, son artificiales.",es,"The text mentions artificial light sources like electric lamps and candles, which can be simplified by explaining they are made by humans."
easyread-text-27-1,27,text-27-1,Pon la información en el artículo para tener más detalles.,es,The text is instructing to insert certain pieces of information into an article to provide more details. I need to simplify the language to make it more understandable for children with cognitive and learning disabilities.
easyread-text-27-0,27,text-27-0,Lee las notas que explican algunas palabras del artículo «La luz y la sombra».,es,The text is requesting to read notes with definitions about some words found in an article titled 'La luz y la sombra'. I need to simplify this by using direct and simple language.
easyread-text-27-2,27,text-27-2,Es importante dar crédito a las personas que crean modelos de IA.,es,The text is about giving recognition to the original creators of AI models.
easyread-text-27-3,27,text-27-3,Hecho por humanos.,es,The text is about something that has been made by humans. I will simplify this by using a more direct expression so children can understand it easily.
easyread-text-28-11,28,text-28-11,"Los rayos son luces en el cielo durante una tormenta. Pueden dar miedo, pero son parte de la naturaleza.",es,"The word 'rayos' can refer to 'lightning' or 'rays.' In context, it may mean different things depending on its use. Here, I assume 'rayos' refers to 'lightning.' Lightning is a natural electric discharge during a storm that can be exciting or scary for children."
easyread-text-28-5,28,text-28-5,sol,es,"The text provided only contains a single word 'sol', which in Spanish translates to 'sun'. The context or complexity cannot be further simplified since it's already a simple, commonly used word."
