id,page_index,text_id,text,language_code,reasoning
easyread-text-28-15,28,text-28-15,"Características son cosas que podemos ver o saber sobre algo. Por ejemplo, un perro puede ser grande o pequeño. Esas son características.",es,I need to explain what 'características' means in a simple way so that children can understand it easily without using technical words.
easyread-text-28-2,28,text-28-2,"Cosas que dan luz, como el sol, bombillas y velas.",es,"The text is about 'light sources', referring to things that give us light. I should make it easy by listing common things that provide light."
easyread-text-28-19,28,text-28-19,"Vidrio que no se ve claro, pero deja pasar la luz para dar privacidad.",es,The text refers to a type of glass that is not clear and is used to provide privacy while still allowing light to pass through.
easyread-text-28-0,28,text-28-0,"Lee otra vez el artículo ""La luz y la sombra"".",es,"The text is asking the reader to read an article named ""La luz y la sombra"". This is a simple instruction that can be conveyed straightforwardly."
easyread-text-28-18,28,text-28-18,Son cosas que dejan pasar la luz y podemos ver a través de ellas claramente.,es,The sentence is describing objects that allow light to pass through and are easy to see through clearly. The key concept is that these objects are transparent.
easyread-text-28-4,28,text-28-4,"Artificial significa algo que las personas hacen, no algo natural.",es,"Artificial means something made by people, not natural. It's important to explain this concept using simple and familiar words for children with cognitive disabilities."
easyread-text-28-20,28,text-28-20,Veintisiete,es,"The text appears to be numerical, specifically the number twenty-seven, which does not require simplification in terms of language or phrasing but can be presented in words."
easyread-text-28-7,28,text-28-7,La vela es una cosa que usamos para dar luz o para mover un barco con el viento.,es,"The word 'vela' can mean sail, candle or vigil light, but in the context of simple explanation for children, understanding it as 'vela' of a candle or sail makes it relatable."
easyread-text-28-9,28,text-28-9,"Fuego es una palabra que significa ""fuego"".",es,This is a single word in Spanish that means 'fire'.
easyread-text-28-8,28,text-28-8,Una linterna es una pequeña luz portátil que funciona con baterías.,es,The word 'linterna' is Spanish and means 'flashlight' in English. A flashlight is a portable electric lamp powered usually by batteries.
easyread-text-28-1,28,text-28-1,Llena el cuadro usando las palabras de la lista.,es,The original text is a simple instruction asking to fill in a chart using a list of words. Children need clear and direct instructions without additional complexity.
easyread-text-28-6,28,text-28-6,Las estrellas son luces en el cielo nocturno.,es,"The text is simply a word 'estrellas', which means 'stars' in Spanish. It does not need further simplification as it is already a simple term that can be readily understood by school children."
easyread-text-28-14,28,text-28-14,Forma del cuerpo,es,I should simplify the term to make it easy for children to understand while still maintaining the meaning.
easyread-text-28-10,28,text-28-10,Las luciérnagas son insectos pequeños que se iluminan por la noche.,es,"The word 'luciérnagas' refers to fireflies, magical glowing insects often seen at night, which is a concept children can understand easily. To make it more relatable, we explain that they are little bugs that light up."
easyread-text-28-13,28,text-28-13,Completa el cuadro que tiene información sobre el tema.,es,The sentence asks to complete a table summarizing information about a topic. My task is to simplify this instruction for children.
easyread-text-28-3,28,text-28-3,Se refiere a cosas que no son hechas ni cambiadas por las personas. Son cosas de la naturaleza.,es,The term 'natural' might refer to something that is not made or changed by people. It's about things found in nature that come from the environment.
easyread-text-28-16,28,text-28-16,Ejemplos,es,"The text is providing examples, so it should be presented in a clear and straightforward manner."
easyread-text-28-17,28,text-28-17,Algo opaco no deja pasar mucha luz.,es,The word 'opaco' is in Spanish and it means something that does not let light pass through easily. It's important for it to be understood in simple terms.
easyread-text-28-12,28,text-28-12,Una lámpara eléctrica es algo que da luz cuando la enciendes.,es,Listen.
easyread-text-29-8,29,text-29-8,Pon tus manos a un metro de la luz y a un metro y medio de la pared.,es,The instruction is for a person to place their hands a certain distance from a source of light and a wall. It's important to make the measurement described in simple everyday terms so they understand how to position their hands.
easyread-text-29-7,29,text-29-7,Apaga todas las luces de la habitación. Enciende una lámpara. Colócala para que alumbre una pared.,es,"The text gives instructions on how to light up a room by turning off all lights and using a lamp to light a wall. To simplify, I will use shorter sentences and familiar words."
easyread-text-29-4,29,text-29-4,Pon la letra grande al inicio de las oraciones y en los nombres de personas y lugares.,es,Colocar mayúsculas es importante para los principios básicos de gramática.
easyread-text-29-6,29,text-29-6,Las sombras chinescas son figuras que se hacen con las manos y una luz. Pon una luz detrás de tus manos. Haz formas con las manos y mira las sombras. Puedes hacer formas de animales o cosas.,es,Shadows from hand gestures can create fun shapes that mimic animals or objects. The text is about providing instructions to make these 'Chinese shadows' in a simple and easy way for children to understand.
easyread-text-29-3,29,text-29-3,Separar significa poner espacio entre palabras que están juntas.,es,"The text asks to separate words that are close together or joined. For a simple understanding, I will explain it in Spanish using simple terms."
easyread-text-29-9,29,text-29-9,"Cuando estás cerca de la luz, las sombras se ven más grandes.",es,"The text uses a metaphor to describe how being close to light can create bigger shadows. It's about contrasts, but it needs simplification for better understanding."
easyread-text-29-2,29,text-29-2,Asegúrate de haber hecho todo bien.,es,The text instructs the reader to verify whether they have completed certain tasks. This should be expressed in simpler language for better understanding.
easyread-text-29-12,29,text-29-12,Veintiocho.,es,The number '28' is simple and doesn't need reasoning. It's a basic numeral that can be understood easily by children as it refers to a quantity.
easyread-text-29-1,29,text-29-1,Haz los cambios.,es,"The text is giving an instruction to make corrections. It's simple and direct, but needs to be simplified for better understanding."
easyread-text-29-0,29,text-29-0,La computadora no andaba bien e hizo cosas mal.,es,The text mentions that a computer had issues and made some mistakes. I should simplify it by explaining that the computer didn't work well and did things incorrectly.
easyread-text-29-10,29,text-29-10,Usa los brazos desnudos y practica hasta que lo logres.,es,"The original text is an instruction to practice using bare arms until achieving a goal. To make it simpler, we can break down the instruction into easier steps for better understanding."
easyread-text-29-11,29,text-29-11,"Por favor, escribe el texto aquí.",es,"The text asks for a corrected version in Spanish, which should be a simple and clear sentence directed towards the instruction given. An ""escribe aquí el texto corregido"" literally means 'write the corrected text here', indicating a request for a simpler interaction or task to perform. I will guide directly towards providing a simple and straightforward version relatable to school children."
easyread-text-29-5,29,text-29-5,Usamos signos de puntuación para entender mejor las oraciones al leer.,es,The text requests to place the punctuation marks. I should simplify by explaining that we use punctuation to help understand writing better.
easyread-text-30-12,30,text-30-12,Escríbelas como borrador en el mismo papel.,es,The text is about writing something in draft form. I should use simple words and keep the content straightforward and easy to understand.
easyread-text-30-6,30,text-30-6,Figuras de sombras en la pared con forma de conejos.,es,"The text is about a simple concept of Chinese shadow puppetry, involving shapes like rabbits. This calls for using simple language about shadow play and familiar animals like rabbits."
easyread-text-30-5,30,text-30-5,Puedes hacer sombras con las manos que parecen patitos.,es,"The text mentions the ability to create shadow puppets of ducks, which should be simplified into something relatable for kids. Shadow puppets are a fun and engaging concept that children might be familiar with."
easyread-text-30-7,30,text-30-7,figuras de sombras chinas que parecen serpientes,es,"The text is talking about Chinese shadow puppets that resemble snakes. It's a simple and visual concept, so the translation should keep the original meaning without using complex words."
easyread-text-30-8,30,text-30-8,Entre muchas otras sombras que se ven como figuras.,es,"The text mentions shadows or silhouettes, often related to shadow puppetry or art using light and shadow to create shapes. It needs to be simplified to ensure understanding for children."
easyread-text-30-0,30,text-30-0,Lee con atención este texto.,es,"The instruction asks to read the text carefully, which implies understanding or focusing on the content."
easyread-text-30-11,30,text-30-11,Lee otra vez el texto y habla con tus amigos sobre cómo mejorarlo.,es,The text is directing the reader to read the text again and discuss with friends what changes should be made to improve it. The simplified version should focus on the basic actions of rereading and discussing with friends about making better changes.
easyread-text-30-1,30,text-30-1,Tacha las palabras que se repiten.,es,The text instructs to cross out repeated words. I should simplify it by using familiar language and make sure it is clear and concise for better understanding.
easyread-text-30-3,30,text-30-3,Puedes hacer sombras con tus manos moviéndolas de diferentes formas frente a una luz.,es,The text explains how to create shadow puppets by using your hands in different ways in front of a light source to make shadows.
easyread-text-30-4,30,text-30-4,Hacer dibujos o formas en una pared.,es,"The text mentions making shapes on a wall, which can be simplified to convey the action of drawing or creating shapes to make it easier for children to understand."
easyread-text-30-10,30,text-30-10,Puedes hacer formas divertidas moviendo los dedos.,es,"The text discusses creating dynamic shapes by moving fingers, which may be difficult for some children to understand. The simplified version should mention fingers moving to create shapes, using simple language."
easyread-text-30-14,30,text-30-14,Veintinueve,es,"The original text is a single number, so my task is to make sure it is represented simply and clearly for children with learning disabilities, by converting the numerical representation into words."
easyread-text-30-13,30,text-30-13,"Por favor, corrige o cambia el texto que tienes aquí.",es,"The text is asking to correct or edit some existing text, but in this simplified version I will use words that are easier to understand."
easyread-text-30-2,30,text-30-2,Las sombras chinescas son un juego viejo y bonito.,es,"The text discusses shadow puppetry, which is an old and beautiful game. I should simplify the language and keep the meaning."
easyread-text-30-9,30,text-30-9,Puedes hacer figuras cuando dejas las manos quietas.,es,The text suggests that static figures can be achieved by keeping hands still. I need to simplify this concept for better understanding by children.
