id,page_index,text_id,text,language_code,reasoning
easyread-text-16-4,16,text-16-4,Piernas rápidas.,es,"The text is about something moving fast, specifically legs. It uses simple words that are already familiar to children who experience cognitive and learning challenges."
easyread-text-16-5,16,text-16-5,Las rodillas duelen.,es,"This text is simple and mentions an injury to the knees. To make it even more clear for children, I should use simple words and say that the knees hurt."
easyread-text-16-1,16,text-16-1,Llena los cuadros vacíos con información sobre ella.,es,"The original text instructs someone to fill in empty squares with information about someone, presumably a female. I should simplify it for children by using simpler words and maintaining the female gender."
easyread-text-16-3,16,text-16-3,El corazón late rápido cuando corres.,es,The sentence describes a heart beating fast during running. I will keep the concept simple and straightforward.
easyread-text-16-6,16,text-16-6,La palabra 'Championes' significa campeones. Habla de personas o equipos que han ganado un campeonato.,es,"The text is simply stating the word 'Championes', which is a colloquial term used to refer to champions, typically athletes or sports teams that have won a championship."
easyread-text-16-0,16,text-16-0,Esta es Elena.,es,The text introduces a person named Elena. It is straightforward and requires no simplification.
easyread-text-16-9,16,text-16-9,Tiene,es,"The text is very simple, it just means 'has' or 'possesses' in Spanish."
easyread-text-16-7,16,text-16-7,Elena es una persona amable y le gusta ayudar a los demás. Tiene el pelo largo y le gusta leer cuentos.,es,"To write a simple description of Elena, I need to focus on key characteristics about her from the story and the outline mentioned."
easyread-text-16-13,16,text-16-13,Quince,es,"The number 15 needs no simplification for school children as it is already in its simplest form. However, I would express it in Spanish terms."
easyread-text-16-11,16,text-16-11,Cuando alguien está corriendo.,es,The text is about an action related to running. I should explain it in a simple way that is easy for children to understand.
easyread-text-16-10,16,text-16-10,No se puede simplificar sin más información.,es,"The text does not provide complete information or context, hence it's not possible to simplify it meaningfully. However, the word 'Usa' could refer to the United States if it was part of a larger text. To provide a meaningful simplified version, more context is needed."
easyread-text-16-12,16,text-16-12,A María le gusta la música.,es,"The phrase 'Le gusta' often refers to someone liking something, but it is not clear what or who the subject is. To make it relatable and clear, I specify who likes what or provide context."
easyread-text-16-2,16,text-16-2,Pelo desordenado por correr.,es,The text talks about a hair that is messy because the person has been running. The key concepts are 'disheveled hair' and 'running'.
easyread-text-17-7,17,text-17-7,El abuelo contó un secreto.,es,This sentence talks about a grandfather teaching someone a secret. It's simple and doesn't require complex restructuring for easier understanding.
easyread-text-17-5,17,text-17-5,¿Por qué no intentas correr junto a tu sombra?,es,"The text is asking why someone doesn't run against their shadow. The concept of running against a shadow might be confusing, so it needs to be explained in simpler terms."
easyread-text-17-0,17,text-17-0,¿Qué dijeron?,es,"The text is a question asking 'What did they say?' It is a simple inquiry into what someone else has said, and there is no need to simplify further as it already uses commonly known words."
easyread-text-17-8,17,text-17-8,Ahora estás lista para ganar.,es,"The sentence is an encouraging and motivating phrase, often used to boost someone's confidence."
easyread-text-17-6,17,text-17-6,"Pero no siempre ganaba, entonces se quejaba:",es,The text is about someone who doesn't always succeed and then grumbles about it. It uses words like 'refunfuñó' which might be hard to understand for children. So we use simpler words for clarity.
easyread-text-17-2,17,text-17-2,"Un día, Elena fue a visitar a su abuelo.",es,"The sentence is simple and straightforward, indicating that Elena went to her grandfather's house on a certain day. It uses everyday language, suitable for children."
easyread-text-17-9,17,text-17-9,Dieciséis,es,"The input text is a number written as '16'. It likely represents a numerical value. For easy-read purposes, we should explain it in simpler terms."
easyread-text-17-1,17,text-17-1,Llena los globos con lo que dice el cuento.,es,The text asks to fill the balloons according to the story. I need to simplify it using simple language.
easyread-text-17-3,17,text-17-3,El abuelo le dio una idea a alguien.,es,The text is a simple statement about a grandfather giving an idea. It involves two characters: 'el abuelo' (the grandfather) and 'una idea' (an idea). The sentence structure should remain simple for better understanding.
easyread-text-17-4,17,text-17-4,Estoy aburrido porque no tengo a nadie para correr conmigo.,es,I need to explain that the person feels bored because they don't have anyone to run with.
easyread-text-18-2,18,text-18-2,"Un día, Elena durmió en la casa de su abuelo Enrique.",es,"The text is about Elena staying overnight at her grandfather Enrique's house. It contains simple events suitable for young readers, so the simplification should maintain the characters while rephrasing the sentence into shorter and familiar terms."
easyread-text-18-4,18,text-18-4,El abuelo le dio una idea para divertirse.,es,The text is about the grandfather giving a suggestion to a child to prevent boredom. This simple idea can be translated directly as it's already quite easy.
easyread-text-18-5,18,text-18-5,Elena corrió con una sombra.,es,"The text is about Elena participating in a race against a shadow. The sentence is simple, but I can make it even clearer for children."
easyread-text-18-8,18,text-18-8,El número 17 es un número entre 16 y 18.,es,"The number 17 is a simple numeric value that indicates a quantity or position between 16 and 18 in a sequence. In this context, no significant simplification is necessary as it's already simple."
easyread-text-18-6,18,text-18-6,"En un momento, el abuelo vio que alguien estaba enojado.",es,"The text is about a grandfather noticing that someone is in a bad mood. I will rewrite it so it is easier to understand for children, using simple words."
easyread-text-18-7,18,text-18-7,"Elena sabía el secreto para ganar a la sombra, por eso nunca más perdió.",es,The sentence is about Elena who now knows a secret that helps her win and never lose again against the shadow.
easyread-text-18-1,18,text-18-1,Leer el cuento de nuevo puede ayudarte.,es,The sentence encourages someone to reread a story because it might help them. The sentence is simple and gives advice in an encouraging tone.
easyread-text-18-0,18,text-18-0,Cuenta lo que pasa en la historia con palabras sencillas.,es,The task involves summarizing the main points of the story in simpler Spanish. The goal is to make it easier for children with learning disabilities to understand the story.
easyread-text-18-3,18,text-18-3,Estamos en la casa del abuelo.,es,"The text is very short and is just indicating a location or setting. It mentions being at the grandfather's house. The sentence is already simple, but I can slightly enhance its clarity for young children."
easyread-text-19-14,19,text-19-14,Fue a ver.,es,The word 'visitó' refers to someone who went to see a place or person. I need to simplify it for children.
easyread-text-19-17,19,text-19-17,Esto te puede ayudar.,es,"The text 'Te puede ser útil' suggests that something could be useful to someone. It's a simple expression indicating helpfulness or benefit. In making it easy for young children to understand, I can use simpler words to convey the same meaning."
easyread-text-19-9,19,text-19-9,Él o ella aprendió algo.,es,"The text 'aprendió' means 'learned' or 'he/she learned' in Spanish. It is in the past tense, indicating an action. I should keep it straightforward for children."
easyread-text-19-11,19,text-19-11,El abuelo Enrique,es,"The text is simply a name, 'Abuelo Enrique', which means 'Grandpa Enrique'. It does not contain complex information, so the simplified version would be the same."
easyread-text-19-12,19,text-19-12,Dijo algo a alguien.,es,"The input 'contó' translates to 'told' in English, which is a basic action verb with a direct meaning. I need to create a simple explanation based on the verb 'told,' making it accessible and easy to understand for children."
easyread-text-19-16,19,text-19-16,Escribe con las letras inclinadas hacia un lado.,es,"The task is to help students understand what it means to write in italics, by explaining it in simple terms without using the phrase 'italics'."
easyread-text-19-18,19,text-19-18,El abuelo Enrique ganó ochenta y siete veces.,es,The text mentions that Grandpa Enrique achieved or counted 87 victories.
easyread-text-19-10,19,text-19-10,"Muy rápido, más que los conejos en el campo.",es,The text uses a simile to describe something or someone being faster than hares in a field. This can be simplified to emphasize the concept of speed using familiar language.
easyread-text-19-13,19,text-19-13,al abuelo Enrique.,es,"The text refers to a person named Enrique who is likely someone's grandfather. To make it simple for children, it should be clear and relate directly to who Enrique is in easy words."
easyread-text-19-15,19,text-19-15,Ochenta y siete veces ganaron.,es,"The text mentions 'eighty-seven victories', which is a simple statement. It doesn't require much simplification but should be made clear and easy to understand."
easyread-text-19-19,19,text-19-19,18,es,The number is stated as an integer and is already simple and clear. No further simplification is required.
easyread-text-19-5,19,text-19-5,Preparó comida.,es,"The word 'cocinó' is the past tense of 'cocinar', meaning 'to cook'. It's used to indicate someone cooked something in the past."
easyread-text-19-1,19,text-19-1,Une con una línea las frases de cada columna para hacer oraciones.,es,The text is about matching expressions from different columns to form sentences. It should be easy for children to understand what they are supposed to do.
easyread-text-19-0,19,text-19-0,El abuelito Enrique.,es,"The text is about a person, specifically 'grandfather Enrique'. This implies the need to address the person using familiar and straightforward terms."
easyread-text-19-2,19,text-19-2,Escribe oraciones que tú has creado.,es,The text asks for writing sentences that have been formed. I should aim to simplify this request for children.
easyread-text-19-3,19,text-19-3,Escribe los números siguiendo el orden de los sucesos en la historia.,es,The task is to number the events in order. The text indicates a need for simple language to explain how to arrange things sequentially.
easyread-text-19-8,19,text-19-8,Una tortilla de papas muy grande.,es,The text describes a very large potato omelette. I will simplify this by using familiar words and keeping the focus on the size and the dish itself.
easyread-text-19-6,19,text-19-6,El secreto para vencer las sombras.,es,The text is about knowing how to defeat or overcome shadows.
easyread-text-19-7,19,text-19-7,La persona corrió.,es,"The word 'corrió' is simple and refers to the action of running, which is a familiar activity for children."
easyread-text-19-4,19,text-19-4,Elena es un nombre.,es,"The text is simply 'Elena', which refers to a name, likely a person's name. There's no further context or information to simplify further."
easyread-text-20-9,20,text-20-9,El abuelo enseñó un secreto para vencer la sombra.,es,"The text talks about a grandparent teaching a secret to overcome a shadow, but the phrasing might be complex for some children. I need to simplify it to be more direct and clear."
easyread-text-20-3,20,text-20-3,Elena es una niña a la que le gusta correr. Sus padres la llevan a la casa de su abuelo.,es,The text is about a girl named Elena who likes to race and is taken to her grandfather's house by her parents. Simplifying involves using clear and direct language.
easyread-text-20-8,20,text-20-8,A veces ganaba y a veces perdía.,es,The text is about a person's experience with winning and losing. It uses simple language to convey the idea that sometimes they lose and other times they win.
easyread-text-20-16,20,text-20-16,Elena corre en competencias.,es,"The text must be simplified so that it is easy for school children with learning disabilities to understand. The input text simply mentions 'Elena's races', which could possibly refer to the activities she participates in. Since we don't have much detail, I can create a simple, imaginative description that is easily understood."
easyread-text-20-10,20,text-20-10,Elena lo recordó en su mente.,es,"The sentence says that Elena memorized something, so I should keep that idea but use simpler words."
easyread-text-20-7,20,text-20-7,Elena dijo que sí a hacer algo difícil.,es,"The text is about Elena accepting a challenge. The key concept here is to make sure to use simple terms so that children with cognitive and learning difficulties can understand it. In this case, using basic and familiar words is important."
easyread-text-20-5,20,text-20-5,"En la casa de su abuelo, Elena se aburría porque no tenía con quién jugar.",es,The text is about Elena feeling bored at her grandfather's house because she had no one to run with. I should rephrase it in simple terms that are easy to understand for children.
easyread-text-20-6,20,text-20-6,El abuelo le dijo que corriera más rápido que su sombra.,es,"The original text is telling a story where a grandfather challenges his granddaughter to do something fun. Simplifying this for kids, I need to use simple words and keep the same idea."
easyread-text-20-12,20,text-20-12,Elena viaja con sus padres.,es,This sentence is about a girl named Elena who travels with her parents. The text is simple and doesn't need much change to make it easy to read.
easyread-text-20-13,20,text-20-13,Elena tiene un disfraz.,es,"The text is simply referring to Elena's costume, so I will simplify it by saying that Elena has a costume."
easyread-text-20-14,20,text-20-14,Los juegos que tiene Elena.,es,"The text is about games that belong to Elena, so I keep it simple by indicating that they are hers."
easyread-text-20-17,20,text-20-17,Elena está enojada.,es,"The text is simple already but might not convey a full context, such as 'Elena is angry' which is very straightforward. We stick to the context of emotions, suitable for children."
easyread-text-20-15,20,text-20-15,Elena se siente aburrida.,es,The original text is a short phrase indicating that Elena feels bored. I should keep the focus on Elena's feelings and actions.
easyread-text-20-2,20,text-20-2,Cuenta la historia del episodio en una oración fácil de entender.,es,The instruction asks to simplify the task of summarizing an episode. I need to provide a simple instruction understandable for children with cognitive and learning disabilities.
easyread-text-20-11,20,text-20-11,Elena llegó a la casa del abuelo.,es,The text should be simplified to describe Elena arriving at her grandfather's house in a way that's easy to understand for school children.
easyread-text-20-18,20,text-20-18,El abuelo tiene que hacer algo difícil.,es,"This is a short sentence, so we need to add a bit more context to help understand it. 'Abuelo' is grandfather, and 'desafío' can mean a challenge or task, often used to describe a situation. We simply need to make it understandable for kids, focusing on the idea of a situation involving their grandfather."
easyread-text-20-19,20,text-20-19,Los triunfos de Elena.,es,The text is very short and straightforward; it's about someone's victories. I should maintain the gender of the name 'Elena' and the simplicity of the phrase.
easyread-text-20-20,20,text-20-20,19,es,The number 19 is a simple piece of information and doesn't need to be simplified further. The concept of numbers is universal and familiar to children.
easyread-text-20-1,20,text-20-1,Elige la oración de la derecha que mejor lo explique.,es,The task is about selecting a statement from the right side that summarizes something best. I should focus on simplifying the task description for better understanding.
easyread-text-20-4,20,text-20-4,Ella estaba triste.,es,"The text is simple, expressing that she was upset, but I will simplify it further by choosing more everyday vocabulary."
easyread-text-20-0,20,text-20-0,Lee lo que dice cada libretita sobre el cuento.,es,"The text in the little notebooks presents moments from a story, and it's about reading what each notebook says about the story."
easyread-text-21-11,21,text-21-11,La palabra 'desprolijo' significa que algo está desordenado o no está limpio.,es,"The word 'desprolijo' means messy or untidy. To simplify it for school children, it is important to describe it in simple words that they encounter in everyday life."
easyread-text-21-1,21,text-21-1,"Cuando miras al sol,",es,The original text is a poetic line implying something related to facing the sun.
easyread-text-21-10,21,text-21-10,Dibuja ordenado / dibuja,es,"I need to simplify the expression 'pinta prolijo / pinta' for children with cognitive and learning disabilities in Spanish, using simple and concise language."
easyread-text-21-12,21,text-21-12,"Un perro puede ladrar suave o normal, que significa hacer sonidos con su boca.",es,"The text provides basic phrases referring to a dog's barking, implying sound intensity or general action."
easyread-text-21-8,21,text-21-8,Los antónimos son palabras que significan lo contrario.,es,Antonyms are words that mean the opposite of each other. The words have opposing ideas or meanings.
easyread-text-21-5,21,text-21-5,Lento significa despacio y ligero puede significar rápido. Son opuestos porque lento es ir despacio y ligero puede ser ir rápido.,es,"The original text is asking about the relationship between the words 'lento' and 'ligero'. 'Lento' means slow and 'ligero' means light or fast. They are often used to describe speed, so they are opposite to each other in context of speed."
easyread-text-21-15,21,text-21-15,Leer es bueno. Ayuda a aprender.,es,"I need to simplify the text and ensure it is easy to understand. It should be clear, use simple words, and retain the intended meaning."
easyread-text-21-19,21,text-21-19,20,es,The text '20' is just a number and does not need further simplification for comprehension.
easyread-text-21-17,21,text-21-17,Habla despacio.,es,The text uses an imperative form to give an instruction to someone to speak in a certain way. Simplifying it means using easy words to communicate the same instruction clearly.
easyread-text-21-13,21,text-21-13,"El sonido que hace un perro: ¡guau, guau!",es,"The text '¡Arf, arf!' is likely the sound that a dog makes."
easyread-text-21-18,21,text-21-18,"El texto dice bla, bla, bla, que es como decir muchas palabras sin decir nada importante.",es,"The text is about making sounds like 'bla, bla, bla'. It typically refers to saying a lot without meaningful content. We need to simplify it for children."
easyread-text-21-0,21,text-21-0,Lee la primera parte de un mensaje especial para vencer a las sombras.,es,The text wants the reader to read the first part of a special message about defeating shadows. It should be simple and clear to understand for children.
easyread-text-21-14,21,text-21-14,Corre rápido.,es,"The phrase is instructing someone to run lightly or simply to run. It's a simple command to move quickly, focusing either on the manner or the action itself."
easyread-text-21-16,21,text-21-16,Salta bajito.,es,"The phrase 'salta bajo / salta' suggests jumping low. To make it simple and easy for school children, we can use simple, everyday words and concise sentences."
easyread-text-21-9,21,text-21-9,Los sinónimos son palabras que significan lo mismo o casi lo mismo.,es,"The text explains what synonyms are, which are words with similar meanings. It uses simple words that can be easily understood by children."
easyread-text-21-3,21,text-21-3,Da igual si corres despacio o rápido.,es,The text addresses different ways of running. I should simplify it to be easily understood by children.
easyread-text-21-2,21,text-21-2,La sombra te sigue muy cerca.,es,"The text uses a metaphorical expression. The sentence means that the shadow is metaphorically biting at one's heels, implying urgency or a constant presence. The goal is to simplify this metaphor so children can understand it as simply someone or something following closely."
easyread-text-21-4,21,text-21-4,Siempre estarás adelante.,es,"The text means that the person or thing will always come first, indicating a priority or a sequence."
easyread-text-21-6,21,text-21-6,Llena los espacios con palabras al contrario.,es,The task is about using opposite words to complete the blanks. This can help children practice their understanding of antonyms.
easyread-text-21-7,21,text-21-7,Recuerda que debes prestar atención y seguir instrucciones para aprender bien.,es,"I need to keep the text simple and clear, using familiar words for children who may have cognitive and learning disabilities."
easyread-text-22-10,22,text-22-10,La palabra 'como' se usa para preguntas o unir ideas. Necesitamos más información para ayudar mejor.,es,"The word 'como' is in Spanish and could be used in different contexts, such as a conjunction or question. Not enough context to simplify except to recognize its versatility."
easyread-text-22-16,22,text-22-16,"Por ejemplo, feliz, nervioso, paciente, gruñón, gritón.",es,The text lists different types of personalities and emotions a person can have. It mentions both positive and negative traits. These words are emotions and characteristics that kids can easily recognize and relate to.
easyread-text-22-9,22,text-22-9,Manos,es,"The text 'Manos' is very short and refers to the hands, which is a common and simple word."
easyread-text-22-7,22,text-22-7,Labios son las partes suaves de la cara que usamos para hablar y comer.,es,"The word 'labios' refers to 'lips,' a part of the human body. Children are familiar with this term as it relates to parts of the face."
easyread-text-22-5,22,text-22-5,Ojos,es,"You asked for simplification, but since the text is just a single word 'Ojos', which means 'Eyes' in English, it is already simple and direct."
easyread-text-22-18,22,text-22-18,Utiliza las comparaciones que escribiste antes.,es,The text is instructing the user to use comparisons they wrote previously. It's a simple command and needs to be clearer for children with cognitive and learning disabilities.
easyread-text-22-6,22,text-22-6,¿Cómo?,es,"To assist with a simpler version, we need to rewrite the sentence using familiar words, simple structure, and active voice so that it becomes more understandable for young children with cognitive and learning disabilities."
easyread-text-22-26,22,text-22-26,"A veces, la gente...",es,"This text is about simplifying the phrase 'A veces se' but requires adding context to transform it into a meaningful, simplified message. This simplification involves turning passive 'se' phrases into active verbs with a clear subject if possible."
easyread-text-22-27,22,text-22-27,El número es veintiuno.,es,"The text is simply a numeric value. For an easy-read version for children with learning disabilities, we can provide a context or simple explanation of the number."
easyread-text-22-17,22,text-22-17,El abuelo es un señor mayor con una sonrisa amable y ojos brillantes. A menudo lleva un sombrero y le encanta contar cuentos divertidos.,es,"The text asks for a description of a grandfather, which should be simple and relatable for children, using familiar language."
easyread-text-22-21,22,text-22-21,Los ojos son para ver.,es,"The text 'Los ojos' is short and does not include any complex language or structure. It directly translates to 'The eyes'. However, for school children, I should explain it in simpler terms so they can understand what eyes are used for."
easyread-text-22-3,22,text-22-3,"La palabra 'como' puede significar varias cosas, como 'cómo se hace esto', 'como amigo' o 'como ejemplo'.",es,"The word 'como' can have multiple meanings or uses, such as 'how,' 'as,' or 'like,' depending on the context. Without additional context, a simple description in Spanish is provided."
easyread-text-22-19,22,text-22-19,El abuelo de Elena es el papá de su mamá o de su papá.,es,"The text is a simple phrase introducing 'Elena's grandfather'. I need to ensure it's easy to understand, and the words are familiar to children."
easyread-text-22-22,22,text-22-22,Los labios son similares a cosas suaves.,es,The text is likely describing an analogy or comparison involving lips. We should focus on using simple terms to describe the idea clearly for children.
easyread-text-22-12,22,text-22-12,'Como' significa 'de qué manera' o 'de qué forma'. Es una palabra que pregunta cómo sucede algo.,es,"The word 'como' can be complex in different contexts. It stands alone here, so I'll assume it's a request for clarification or emphasis on its usage."
easyread-text-22-14,22,text-22-14,como,es,El texto es una sola palabra en español y no necesita simplificación. La palabra 'como' se puede entender fácilmente por los niños.
