id,page_index,text_id,text,language_code,reasoning
easyread-text-11-13,11,text-11-13,"Things are made of matter. Matter can be solid, liquid, or gas. Matter has properties. Properties are things like color, size, and shape. Matter can change. A solid can melt into a liquid. A liquid can freeze into a solid. A liquid can also evaporate into a gas. Changes can happen when we heat or cool things.",en,"Children need to understand the basics of how things work around them. In this chapter, they will learn what things are made of (properties) and how they can change (changes). This will help them understand science in everyday life."
easyread-text-11-26,11,text-11-26,87,es,"The text is just the number 87, which is a simple concept."
easyread-text-11-21,11,text-11-21,"La materia no se puede crear ni destruir. Todo lo que hay en el mundo siempre está, solo cambia de forma. Por ejemplo, el agua puede ser líquida, hielo o vapor, pero siempre está ahí.",es,"The text is about understanding a scientific concept that says matter cannot be created or destroyed. In order to simplify it for children, I should use everyday examples that they can relate to and understand easily."
easyread-text-23-3,23,text-23-3,"Saltwater has salt in it, like the water in the ocean. Freshwater does not have salt, like the water in lakes and rivers.",en,"We are comparing two types of water, which are saltwater and freshwater. It is important to explain them in simple terms that highlight the main difference."
easyread-text-23-4,23,text-23-4,"La Tierra tiene mucha agua. Hay agua en los océanos, ríos, lagos y hielo. Es importante saber dónde está el agua para usarla bien.",es,"The water on Earth includes oceans, rivers, lakes, and ice. It's important to know where water is because it helps us understand and use water wisely."
easyread-text-23-6,23,text-23-6,El agua del mar es salada.,es,"The text is about water from the ocean which is salty. To simplify, we tell kids that sea water has salt and that it is similar to the water in the ocean."
easyread-text-11-25,11,text-11-25,Construir fábricas o plantas de energía.,es,"The text 'Building Plants' likely refers to the process or construction of plant structures, such as factories or power plants. For simplicity, I will consider it as the initial creation or setup of large structures where manufacturing or energy generation happens. Simplifying it for children with cognitive disabilities would require using familiar, everyday terms and focusing on the main idea."
easyread-text-23-3,23,text-23-3,El agua salada está en el mar y sabe salada. El agua dulce está en ríos y lagos y no sabe salada.,es,"The text is about the difference between saltwater and freshwater. When simplifying for children with cognitive and learning disabilities, it's important to explain that saltwater is found in the ocean and tastes salty, while freshwater is found in rivers and lakes and does not taste salty."
easyread-text-11-21,11,text-11-21,"The idea of Conservation of Matter says we can't make more matter or make it disappear. If you start with some stuff, you will always have the same amount, even if it changes shape or form.",en,"Conservation of Matter is a science principle that states matter cannot be created or destroyed in an isolated system. This means, in simple terms, that if you start with a certain amount of stuff (matter), you will always have the same amount, no matter what changes happen to it. It's important for understanding how things work in science, like in chemical reactions where substances change into new substances, but the total amount of matter remains the same."
easyread-text-23-4,23,text-23-4,Earth has a lot of water. Most of it is salty ocean water. Only a little bit is fresh water that we can use.,en,"The Earth has a lot of water, but most of it is in the oceans and is salty, making it unsuitable for drinking. Only a small amount is fresh water, which we can use for drinking, farming, and other needs."
easyread-text-23-6,23,text-23-6,The ocean water is salty.,en,"The text mentions saline water and relates it to oceans. For children, it's important to explain that saline means salty, as this is a simpler concept to grasp."
easyread-text-23-5,23,text-23-5,97% significa que es 97 de cada 100.,es,"The number 97% can be related to different contexts, such as percentages in math or statistics. To simplify for children, it can be presented as a simple numerical concept, focusing on understanding that it represents a portion of 100."
easyread-text-23-5,23,text-23-5,"97% is a big number, which means almost everything. If something is 97%, it means only a little bit is missing.",en,"The text '97%' lacks context, so I will describe it as a very high percentage, indicating almost all of something."
easyread-text-11-25,11,text-11-25,This section is about making or growing plants. It is part of a bigger guide.,en,"The text title 'Building Plants' suggests that the text is about making or growing plants in some way. The text section number '(5.3.1)' likely indicates it's a subsection of a larger document, like a book or guide. This text might contain technical details about plant construction or development, which we need to simplify for school children."
easyread-text-11-26,11,text-11-26,eighty-seven,en,"The input '87' is a number without context, so there's no simplification needed. If it represented something specific, like a year or age, I would rewrite it in simple terms, such as 'eighty-seven'."
easyread-text-11-27,11,text-11-27,"Eating means we put food in our mouths, chew it, and swallow it.",en,"The text likely discusses the method or process of consuming food, which can be simplified to emphasize that eating means putting food in your mouth, chewing, and swallowing."
easyread-text-11-28,11,text-11-28,The number 95.,en,The input '95' is a number and doesn't provide any additional information to simplify or explain in an easy-read format.
easyread-text-11-23,11,text-11-23,"En la Tierra, la materia se mueve y cambia. El agua, las rocas y el carbono cambian, moviéndose en ciclos.",es,"The text is about how matter cycles through Earth's systems, likely referring to processes such as the water cycle, rock cycle, and carbon cycle, which involve movement and transformation of substances like water, rocks, and carbon."
easyread-text-25-0,25,text-25-0,Earth has a lot of water. The ocean has salty water. Rivers and lakes have fresh water. We drink fresh water.,en,The text is about the different types of water on Earth and where they are found. It's important to explain this in simple terms to ensure understanding by all children.
easyread-text-11-15,11,text-11-15,Some things are so tiny that we cannot see them with our eyes.,en,"The text seems to be about something that is very small, so small that it cannot be seen with naked eyes. I should use simple and clear language to explain that."
easyread-text-11-29,11,text-11-29,"Aprendemos sobre cómo se mueven las cosas de un lugar a otro. Esto incluye cómo viajan cosas como agua, aire o alimentos.",es,"The section likely explains how different materials or substances move from one place to another, but I'll keep it simple as per your requirements."
easyread-text-23-9,23,text-23-9,68.7 out of every 100 is about icecaps and glaciers.,en,"The text shows that 68.7% of something is related to icecaps and glaciers, which can be a bit complicated for children to understand directly."
easyread-text-11-29,11,text-11-29,"Matter is everything around us. It can be solid, liquid, or gas. Matter can move from one place to another.",en,"The section is about understanding how matter, which includes all solid, liquid, and gas things, moves around us in nature."
easyread-text-23-8,23,text-23-8,"El agua dulce es agua que no tiene sal. Está en ríos, lagos y bajo tierra. Es importante para beber y para que las plantas y los animales vivan.",es,"Fresh water is water that is not salty. We find fresh water in rivers, lakes, and some underground places. It is important for drinking and for plants and animals to live. This text is for children, so it needs to be simple and clear."
easyread-text-23-10,23,text-23-10,El 30.1% del agua es agua subterránea.,es,"The text states a percentage related to groundwater, which might be confusing for young students. I need to explain what groundwater is in simple terms."
easyread-text-23-7,23,text-23-7,3 percent means 3 out of every 100.,en,"The text is very minimal and straightforward, mentioning only a percentage. There's no additional complexity to simplify for understanding."
easyread-text-11-31,11,text-11-31,Es importante ahorrar cosas como agua y electricidad para no desperdiciarlas.,es,This text likely explains about saving resources and making sure we don't waste them because they are important. This is an important topic that children should understand using simple and clear terms.
easyread-text-25-0,25,text-25-0,"El agua de la Tierra está en los océanos, ríos, y lagos. El agua es muy importante para plantas, animales y personas.",es,The text might be referring to water on Earth and its various types or uses. A simplified version should use familiar words related to water and highlight its importance or where it is found.
easyread-text-25-1,25,text-25-1,"Podemos usar matemáticas para ver cuánta agua salada y dulce hay en la Tierra. Así, sabemos dónde hay más agua salada y dónde hay más agua dulce.",es,The text is about using math to understand how much saltwater and freshwater is on Earth. It aims to show where we find different types of water on our planet.
easyread-text-23-10,23,text-23-10,About 30% of the water found under the ground.,en,"The text implies that ground water accounts for 30.1% of a specific resource or context, but it lacks clear explanation or context."
easyread-text-23-8,23,text-23-8,"Fresh water is water that we can drink. It is found in lakes and rivers. Animals, plants, and people need fresh water to live.",en,"The text is about fresh water which is a type of water that is not salty and is used by humans, animals, and plants. Simplifying it, fresh water can be found in rivers, lakes, and is essential to life."
easyread-text-25-1,25,text-25-1,We use counting and computers to see how much saltwater and freshwater there are in different places on Earth. This helps us know where most of the water is.,en,"The text involves complicated terms like 'mathematics and computational thinking' and 'reservoirs' which can be difficult for children with cognitive disabilities to understand. By simplifying, I will use the concepts of counting and comparing, and I will explain that reservoirs mean places where water is stored."
easyread-text-11-32,11,text-11-32,109,es,"The original text says the number 109, which is in numeric form. I will keep it as a numeric representation to maintain its simplicity and avoid unnecessary complexity."
easyread-text-11-30,11,text-11-30,The number one hundred one.,en,"The request is asking to simplify the number '101' into an easy read version. '101' is already a simple numeric expression and even preschool-level children are expected to understand basic numbers. However, it may benefit from a word form representation for absolute clarity."
easyread-text-11-30,11,text-11-30,No puedo simplificar el número 101 para niños. Es un número y ya está lo más sencillo posible.,es,"The text should be simplified in a way that it conveys the meaning clearly to children with learning difficulties, using simple language and avoiding complex vocabulary or structures."
easyread-text-23-11,23,text-23-11,Almost 1%.,en,"The text represents a percentage value, so I need to phrase it in a way that is easily understandable without using technical terms."
easyread-text-23-9,23,text-23-9,"Los casquetes de hielo y los glaciares contienen la mayor parte del agua dulce de la Tierra, un 68,7%.",es,"The text is about a fact related to icecaps and glaciers, specifically that they constitute 68.7% of a particular element or resource, likely referring to freshwater on Earth. To simplify, it is necessary to focus on explaining what icecaps and glaciers are and their significance in an easy-to-understand manner."
easyread-text-23-14,23,text-23-14,11% son pantanos.,es,The text talks about a certain area being made up of swamps by a small percentage.
easyread-text-11-32,11,text-11-32,There is no text given to simplify. Please provide text for simplification.,en,"The prompt does not provide any text to simplify, it only contains the number '109'."
easyread-text-11-31,11,text-11-31,Conserving resources means using things like water and electricity carefully so we don't waste them.,en,"The section likely discusses ways to save or use resources wisely to protect the environment. The key idea is to make sure we don't waste things like water, electricity, and materials. By conserving resources, we help make sure there is enough for future generations."
easyread-text-25-3,25,text-25-3,"People use math by measuring, estimating, making graphs, or finding percentages.",en,"The text provides examples of how people can use math and computing methods to solve problems, like measuring and graphing."
easyread-text-25-2,25,text-25-2,"Think about big water places we know about: oceans, lakes, rivers, glaciers are like frozen rivers, water in the ground called groundwater, and really cold places with lots of ice called polar ice caps.",en,"The text lists different types of reservoirs like oceans, lakes, rivers, glaciers, groundwater, and polar ice caps. It is important to ensure that each type is understandable by using simple words and examples that children can relate to, such as objects or places they may have seen in real life."
easyread-text-11-33,11,text-11-33,11,es,"The text contains only the number 11, which is already simple and doesn't need further simplification. It is a number that represents the quantity or order."
easyread-text-23-12,23,text-23-12,"Surface water is the water we see in rivers, lakes, and oceans.",en,"Surface water means the water we can see on top of the earth, like rivers, lakes, and oceans. It's the water that collects on the surface of the land."
easyread-text-23-11,23,text-23-11,"Es una cantidad muy pequeña, 0.9%.",es,"The text is about a very small percentage, 0.9%, but it doesn't give much context. In a simplified version, I would just focus on mentioning this small amount directly."
easyread-text-23-13,23,text-23-13,87 de cada 100 lagos.,es,The text refers to a high percentage related to lakes. I need to express this in a simplified way using basic Spanish vocabulary and concepts.
easyread-text-25-5,25,text-25-5,This is about how much saltwater and freshwater is on Earth. Saltwater is much more than freshwater.,en,The text is about comparing how much saltwater and freshwater there is on Earth.
easyread-text-23-12,23,text-23-12,"El agua superficial es agua que vemos en ríos, lagos y océanos.",es,"The term 'surface water' refers to water that is found on the surface of the Earth, such as in rivers, lakes, and oceans. It is easily accessible and part of the natural environment."
easyread-text-25-4,25,text-25-4,"This text is a code for something important in school subjects, like science or geography.",en,This text needs to be simplified for children. It should focus on making the content clear and easy to understand by using everyday language.
easyread-text-11-33,11,text-11-33,Eleven,en,"Since '11' is a number, the simplified version for school children would be to clearly represent it in English words as it appears in contexts like simple mathematics or counting exercises."
easyread-text-23-7,23,text-23-7,El 3% significa 3 partes de cada 100.,es,"The text '3%' is just a number representing a percentage. There is not much context to simplify, but to explain percentages, one can say it is like a small part of something out of 100."
easyread-text-25-3,25,text-25-3,"Podemos usar matemáticas para medir cosas, hacer estimaciones, dibujar gráficos o encontrar porcentajes.",es,"The text lists ways we use math, like measuring and making estimates, drawing graphs, or working out percentages. I need to use simple Spanish words for these actions."
easyread-text-23-15,23,text-23-15,El 2% de lo que se habla son ríos.,es,The text contains a number '2%' with the word 'Rivers'. The simplified version should clarify the number and retain the focus on rivers. It should use simple language for understanding.
easyread-text-25-2,25,text-25-2,"Los océanos, lagos, ríos, glaciares, agua subterránea, y casquetes polares son grandes lugares que tienen mucha agua.",es,"The text talks about different places that hold large amounts of water, called reservoirs, like oceans, lakes, rivers, glaciers, groundwater, and polar ice caps. To make it easier for children, I should use simple words and familiar concepts that describe these places."
easyread-text-25-6,25,text-25-6,"Most of Earth's water is in the oceans. Some water is in rivers, lakes, and underground. Water is also in the air and in living things like plants and animals.",en,"Water is found in oceans, rivers, lakes, underground, in the atmosphere, and in living organisms. Most of Earth's water is in the oceans."
easyread-text-25-6,25,text-25-6,"La mayor parte del agua está en los océanos. También hay agua en los ríos, lagos, hielo y en el aire.",es,"This question is about where the water on Earth can be found. It's important to note that most of Earth's water is in the oceans, and a smaller amount is found on land and in the air."
easyread-text-23-13,23,text-23-13,About 87% of something is connected to lakes.,en,"The text '87% Lakes' is unclear without context, but it implies a percentage related to lakes. To simplify for school children, we should use concrete and complete sentences."
easyread-text-25-7,25,text-25-7,"El agua está en casi todos lados en la Tierra: en océanos, ríos, lagos, y en el aire.",es,"Water on Earth can be found in oceans, rivers, lakes, and even in the atmosphere. There's water all around us, but not all of it is drinkable."
easyread-text-25-4,25,text-25-4,"El agua está en todas partes. Podemos encontrarla en los océanos, ríos, lluvia y hasta en el aire. Es muy importante para la vida en la Tierra.",es,"The topic (ESS2.C) is about water and its movement, distribution, and physical properties on Earth. For school children, it’s essential to explain this concept in simple terms, emphasizing how water is found in different places and its role in the environment."
easyread-text-23-15,23,text-23-15,"Rivers are only a small part, like 2%, of something bigger.",en,"The text seems to refer to a concept where 2% is related to rivers but it is too vague to fully comprehend. I assume it is saying that rivers represent only a small percentage of something important. For simplification, I will explain it as a small part of something bigger."
easyread-text-25-7,25,text-25-7,Water is almost everywhere on Earth.,en,The text is telling us that water is found in most places all over Earth. This means water is very common and present in a lot of different areas on our planet.
easyread-text-23-17,23,text-23-17,Mariana Ruiz Villarreal hizo un dibujo para la Fundación CK-12. Puedes usar este dibujo pero no para ganar dinero.,es,The text credits Mariana Ruiz Villarreal for creating an image for the CK-12 Foundation and mentions the Creative Commons license under which it is shared.
easyread-text-23-16,23,text-23-16,Almost all water on Earth is salty. Only a little bit of water is not salty and is called freshwater.,en,"The text explains how most of Earth's water is saltwater, while only a tiny part is freshwater. This can be simplified to make it easier for children to understand the difference in quantities."
easyread-text-17-0,17,text-17-0,"Aprendemos sobre las formas de la Tierra, como montañas y ríos, y cómo se repiten en muchos lugares.",es,The original phrase is about observing and understanding different shapes and formations on Earth's surface.
easyread-text-25-10,25,text-25-10,Plants are living things that grow on Earth.,en,The text talks about plants as living things within the biosphere or the part of Earth where life exists.
easyread-text-23-16,23,text-23-16,"La mayoría del agua en la Tierra es salada (97%), y solo un poco es dulce (3%).",es,"The sentence contains a comparison between saltwater and freshwater amounts on Earth. It gives percentages for each type of water, showing that saltwater vastly outnumbers freshwater."
easyread-text-25-9,25,text-25-9,"El agua está en los ríos, océanos y hielo en la Tierra.",es,"The text is describing where water can be found on Earth's surface, specifically mentioning rivers, oceans, and ice, which are parts of the hydrosphere. It's important to simplify and clarify the concept for children."
easyread-text-23-19,23,text-23-19,¿Qué estás viendo sobre esto?,es,The sentence asks about someone's observations of a phenomenon. This can be simplified by making it more direct and understandable for children.
easyread-text-25-8,25,text-25-8,"Above us, there is air and clouds.",en,"The text refers to the Earth's atmosphere, which includes the air and clouds above us. It uses a complex term, 'atmosphere,' that might not be easily understandable for young children or those with cognitive and learning disabilities."
easyread-text-25-10,25,text-25-10,Las plantas son cosas vivas que viven en la naturaleza.,es,"The original text mentions plants as part of living organisms in the biosphere. To simplify it for children, I will explain that plants are living things that exist in nature."
easyread-text-23-18,23,text-23-18,Things I see and things I think about.,en,"I need to simplify the phrase to make it easier for a school child to understand, focusing on everyday words and short sentences."
easyread-text-23-19,23,text-23-19,What do you see happening here?,en,The sentence is asking for someone's observation or view on a particular phenomenon.
easyread-text-10-5,10,text-10-5,Engineers think of ideas and work with others to solve problems and make plans.,en,"The sentence explains how engineers create new designs and solutions by researching, thinking of ideas, and working with others. I need to keep the explanation simple and show how engineers go through a process to solve problems or design things."
easyread-text-17-1,17,text-17-1,"Look at the pictures and find patterns of Earth's features, like mountains and rivers.",en,"The original text is about looking at data to find patterns and understand different features on Earth. For children, it is important to use simple concepts like 'looking at pictures' or 'finding regularities' to make it relatable and easier to understand."
easyread-text-23-18,23,text-23-18,Observaciones son cosas que vemos o escuchamos. Preguntas son cosas que pensamos sobre lo que vemos.,es,The title 'Observations & Wonderings' suggests that the text may be about looking at things and thinking about them. Observations are things we notice with our senses like seeing or hearing. Wonderings are questions or thoughts we have about what we notice.
easyread-text-23-20,23,text-23-20,¿Qué preguntas tienes sobre este evento?,es,"The question asks what someone might be curious about regarding a specific event or occurrence. To simplify this, we can ask what they are thinking or questioning about it."
easyread-text-25-9,25,text-25-9,"Water on Earth is in rivers, oceans, and ice.",en,"The text is listing different places on Earth where you can find water. It mentions rivers, oceans, ice, and uses the term hydrosphere to describe all the water on Earth. I will simplify it by using familiar words and dropping the term hydrosphere, which might be difficult for children to understand."
easyread-text-23-21,23,text-23-21,Veintitrés,es,This number is a simple whole number with no complex context needed.
easyread-text-25-11,25,text-25-11,Dentro de la Tierra hay capas y se llama geosfera.,es,"The text discusses the inside part of the Earth, using the term 'geosphere.' In simpler terms, we can refer to it as the layers or the ground."
easyread-text-25-11,25,text-25-11,"Inside the Earth, there are rocks and dirt, and this part is called the geosphere.",en,"The text mentions part of the Earth known as the geosphere, which refers to the solid parts of the Earth like rocks and mountains. It is important to use simple words to explain this to children with cognitive and learning disabilities."
easyread-text-25-12,25,text-25-12,This is the number twenty-five.,en,"This text contains only a number, which is already simple and understandable for school children, including those with cognitive and learning disabilities. Numbers are universal and do not need further simplification in this context."
easyread-text-17-2,17,text-17-2,Los terremotos y volcanes ocurren a menudo donde los continentes y océanos se encuentran. Las grandes cadenas de montañas se pueden encontrar dentro de los continentes o cerca de sus bordes.,es,"The text explains where earthquakes, volcanoes, and mountain chains commonly occur. Simplifying helps children understand that these natural events and formations often happen in specific areas."
easyread-text-17-5,17,text-17-5,"In this chapter, you will learn about different shapes and things we see on Earth's surface.",en,The statement is about learning patterns in Earth's features which might be difficult for some to understand if they have learning disabilities. Simplifying it makes it more accessible.
