id,page_index,text_id,text,language_code,reasoning
easyread-text-10-12,10,text-10-12,"El proceso de diseño tiene pasos. Primero, encontramos el problema. Después, averiguamos qué necesitamos y qué limitaciones hay. Por último, mejoramos la solución.",es,"The original text talks about a process of design that involves evaluating, defining problems, identifying criteria and constraints, and optimizing solutions. The goal is to explain in simple terms each part of this process to make it easier to understand."
easyread-text-10-14,10,text-10-14,Elegir la mejor solución quiere decir encontrar la que mejor cumple con las reglas y límites dados.,es,The text is about choosing the best solution by looking at how it fits the rules and limits. The goal is to make the idea easy to understand for children by using simple language and active voice.
easyread-text-18-2,18,text-18-2,El magma cerca de la superficie de la Tierra causa que los volcanes hagan erupción.,es,"The text talks about how magma, which is hot liquid rock under the Earth's surface, causes volcanoes to erupt or have activity on the Earth's surface."
easyread-text-18-2,18,text-18-2,Hot melted rock under the ground makes volcanoes erupt.,en,"The original sentence uses terms like 'magma' and 'volcanic activity', which might be difficult for children with cognitive and learning disabilities. To make it easy to understand, I will use simpler terms that still convey the same idea."
easyread-text-18-0,18,text-18-0,En el Anillo de Fuego hay muchos volcanes y terremotos porque las placas tectónicas se mueven mucho.,es,The text explains that many volcanoes and earthquakes in the Ring of Fire are caused by tectonic plates moving.
easyread-text-18-5,18,text-18-5,Big pieces of the Earth's crust can slowly move apart from each other on land.,en,"I need to simplify the concept of tectonic plates moving apart, using simple language and examples that are easy to understand."
easyread-text-18-4,18,text-18-4,Este tipo de límite causa muchos terremotos porque la Tierra se mueve y se libera tensión.,es,The sentence is about a type of boundary that causes many earthquakes due to tension in the Earth's crust. I need to simplify it by using familiar words and keeping it concise.
easyread-text-18-5,18,text-18-5,Las placas pueden separarse dentro de un continente.,es,"The text explains that plates can move in different directions, including moving apart, and this can happen on land within a continent."
easyread-text-10-4,10,text-10-4,Pensar en diferentes maneras de arreglar el problema.,es,"Generating ideas means thinking of different ways to fix a problem. It should be easy to understand for children, using words they know."
easyread-text-18-1,18,text-18-1,Las capas de la Tierra se juntan en el Cinturón de Fuego.,es,"The text describes a geological phenomenon where tectonic plates meet along the Ring of Fire, which is a zone prone to frequent earthquakes and volcanoes. We want to simplify this idea so that children can understand it easily."
easyread-text-18-3,18,text-18-3,The Pacific Plate and North American Plate move sideways past each other.,en,"The text explains how two huge pieces of the Earth's surface, called plates, move against each other at the border between the Pacific and North American Plates. It uses some technical terms which may not be easily understood by children."
easyread-text-18-7,18,text-18-7,"When this happens, the crust gets thinner, cracks, and then separates.",en,"The sentence describes a process where something happens to the Earth's crust, causing it to become thinner, break, and then split. To simplify for children, it's important to use more familiar terms and break it down into simple actions."
easyread-text-18-7,18,text-18-7,"La corteza se hace más delgada, se rompe y se divide en partes.",es,"The text describes a process where the Earth's crust becomes thinner, breaks, and splits apart. It's important to use simple language and maintain the sequence of actions in an easy-to-understand way."
easyread-text-18-3,18,text-18-3,La línea entre las placas del Pacífico y Norteamérica es donde las placas se mueven de lado una al lado de la otra.,es,"The text explains how two large plates on Earth's surface move sideways next to each other at their border. This involves some science terms like 'transform boundary' related to Earth's geological activity, which may confuse school children, so simplifying these terms and focusing on the easy-to-understand aspects is beneficial."
easyread-text-11-0,11,text-11-0,List Inside the Book,en,"The term 'Table of Contents' can be simplified to something like 'List Inside the Book,' which helps children understand it means what they will find in a book."
easyread-text-11-2,11,text-11-2,Thirteen,en,"The text is a simple number, which requires no further simplification for understanding."
easyread-text-10-12,10,text-10-12,"When you make a plan, first you have to know what the problem is, what you need, and what you can't do. Then you find the best way to fix it.",en,"The original text is about creating a plan or solution, and involves figuring out what the problem is, what you need to do to fix it, and then making the best solution you can. This needs to be put in simple terms for kids."
easyread-text-11-2,11,text-11-2,13,es,The input needs to be simplified for children with cognitive and learning disabilities.
easyread-text-18-8,18,text-18-8,Un terremoto es cuando la tierra tiembla. Esto pasa porque las rocas debajo del suelo se mueven.,es,"The text is about earthquakes and how they occur. It might include details about tectonic plates and the shaking of the ground, but we need to make it understandable and relatable for kids."
easyread-text-18-4,18,text-18-4,Some places in the ground shake a lot because the ground moves and then stops.,en,"The sentence explains how certain boundaries in Earth's crust cause earthquakes. It uses complex terms like 'tension' and 'crust' which may not be familiar to all children, so we simplify it."
easyread-text-18-6,18,text-18-6,Esto es cuando un continente se parte un poco.,es,"The term 'continental rifting' might be difficult for children to understand because it's a technical phrase. Instead, it's better to describe it in simpler words that explain it as a process happening in continents."
easyread-text-11-1,11,text-11-1,Capítulo 1: Los Sistemas de la Tierra,es,"The text probably is about the different systems that make up the Earth and how they function together, which can be complex. It is important to simplify the subject to make it accessible for young children."
easyread-text-18-9,18,text-18-9,Earthquakes happen when big pieces of the Earth's surface move suddenly. This makes the ground shake.,en,"Earthquakes happen when tectonic plates, which are big pieces of the Earth's surface, move suddenly. This movement makes energy waves that shake the ground."
easyread-text-18-6,18,text-18-6,Continental rifting is when a big piece of land splits apart slowly.,en,"The term 'continental rifting' is a technical term used in geology to describe a process where a continent breaks apart, forming new land features. By simplifying, we are explaining the basic idea behind the term without using complex vocabulary."
easyread-text-18-8,18,text-18-8,Earthquakes are when the ground shakes because the Earth's pieces move.,en,Earthquakes are natural events that happen when the ground shakes due to the Earth's plates moving. I need to explain this in a simple manner for children.
easyread-text-11-1,11,text-11-1,"This section is about the different parts of Earth. Like the air, land, water, and living things that all work together.",en,"The chapter title indicates the content is about the systems functioning on Earth, which might include topics like the atmosphere, lithosphere, hydrosphere, and biosphere. However, some students might not understand complex terms like these."
easyread-text-11-0,11,text-11-0,Índice,es,The text 'Table of Contents' refers to a list that shows what is inside a book. It tells where you can find different parts of the book.
easyread-text-18-9,18,text-18-9,Los terremotos son fuertes vibraciones que se sienten en la Tierra cuando las grandes placas del suelo se mueven de repente.,es,"The text talks about earthquakes, which happen when tectonic plates, big pieces of Earth's surface, move suddenly. It uses terms like 'waves of energy' and 'fault lines' that may be difficult for children with cognitive and learning disabilities to understand. The goal is to simplify these concepts using familiar words."
easyread-text-11-4,11,text-11-4,fifteen,en,"The text is a number, and there are no complexities to simplify. The focus is on presenting the number in an understandable format for children with cognitive and learning disabilities."
easyread-text-18-12,18,text-18-12,The ground moves and makes waves.,en,I need to simplify the concept of Earth's crust moving and creating waves into simple language suitable for children.
easyread-text-18-11,18,text-18-11,Big pressures build up under the Earth's surface. These pressures are released in waves along a crack.,en,The sentence talks about how pressure builds up beneath the surface of the Earth and is then released as waves along a fault. The scientific jargon is simplified for better understanding.
easyread-text-11-3,11,text-11-3,"Earth has different shapes on its surface like mountains, rivers, and valleys. These shapes have patterns that we can see and learn about.",en,"The text is about patterns found in Earth's natural features. For easy reading, I simplify the concept by focusing on the shapes and arrangements found in these features."
easyread-text-18-10,18,text-18-10,Los terremotos hacen que la tierra se mueva de repente y cambian mucho el paisaje.,es,Earthquakes are natural events that shake the ground and can change how land looks by creating big cracks or moving things around.
easyread-text-11-4,11,text-11-4,15,es,The number 15 is already simple and does not require any simplification. It is a numeral used to represent a quantity or value.
easyread-text-11-6,11,text-11-6,Twenty-three,en,"The original text states a number, which needs to be conveyed in simple words for clarity."
easyread-text-18-11,18,text-18-11,Bajo la Tierra hay fuerzas muy fuertes que crean presión. Esta presión se libera en ondas a través de una grieta en la tierra.,es,"The text explains that strong forces underground create pressure, which is released in waves along a crack in the Earth. This explanation helps to simplify the concept for children by using more common words and a straightforward explanation."
easyread-text-11-5,11,text-11-5,"La Tierra tiene mucha agua. Esta agua está en océanos, ríos y lagos.",es,"The text refers to the section about Earth's water, likely focusing on its importance, distribution, or properties. I should simplify the concept to make it more understandable for school children."
easyread-text-18-12,18,text-18-12,Partes de la tierra se mueven y crean olas.,es,"The text describes how parts of Earth's surface move and make waves, a concept related to tectonic plates and earthquakes. We should simplify this to a basic cause-and-effect sentence that young children can easily understand."
easyread-text-18-13,18,text-18-13,Some waves move along the ground. We call these surface waves.,en,The sentence explains that certain waves called surface waves move on the Earth's surface. We need to simplify it by using simple words and concepts.
easyread-text-18-10,18,text-18-10,"When big shakes happen, they can change the land quickly and a lot.",en,"The original sentence says that earthquakes can change how the Earth looks very quickly and by a lot. To make it easier, I can use words like 'big shakes' for earthquakes and 'change the land' for altering the landscape."
easyread-text-18-13,18,text-18-13,Algunas olas se mueven por la tierra porque viajan por la superficie del suelo.,es,The text explains that certain types of waves move along Earth's surface. I need to use simple words to describe this to children and include the key idea that some waves travel on the ground.
easyread-text-11-6,11,text-11-6,Veintitrés,es,The text '23' is just a number with no specific gender or complex meaning. I will translate the number into Spanish as it appears as a standalone number.
easyread-text-11-5,11,text-11-5,"Earth has a lot of water. We find water in oceans, rivers, lakes, and even in the ground.",en,"The text likely refers to section 5.1.2 of a chapter about Earth’s water, suggesting the section describes different aspects of water on Earth in an academic context. The task is to simplify this for easier understanding."
easyread-text-11-8,11,text-11-8,31,es,"There is no complex sentence or idea provided in the input, so no need for simplification. The number remains the same."
easyread-text-18-14,18,text-18-14,Body waves are special waves that move inside the Earth.,en,"The original text talks about how some waves, known as body waves, move through the inside of the Earth. The aim is to simplify this for easier understanding by emphasizing that these waves move through the Earth."
easyread-text-18-14,18,text-18-14,Algunas ondas viajan por dentro de la Tierra.,es,"The original text explains that some waves, known as body waves, move inside the Earth. For simplification, we focus on using words that describe movement and being inside the Earth, without technical terms."
easyread-text-18-15,18,text-18-15,"In an earthquake, special waves make the ground shake hard.",en,"The text talks about how certain waves in an earthquake cause sudden, strong shaking. Children need simple words like 'waves' and 'shaking' to understand the concept."
easyread-text-11-8,11,text-11-8,The number is 31.,en,The text '31' is a number and does not have complex vocabulary or structure that requires simplification for comprehension.
easyread-text-11-7,11,text-11-7,"El desgaste es cuando las rocas se rompen en pedazos pequeños con el tiempo. La erosión es cuando el agua, el viento o el hielo se llevan esos pedazos. Ambos ocurren naturalmente y cambian el paisaje de la tierra.",es,"Weathering is when rocks break down into smaller pieces over time. Erosion is when water, wind, or ice carry away those small pieces. Both happen naturally and change the earth's landscape."
easyread-text-18-16,18,text-18-16,Surface waves cause changes we can see on the ground.,en,"The text suggests that surface waves are linked to some events or activities, but it doesn't complete the sentence. Without full context, the focus is on surface waves being the cause of something."
easyread-text-11-3,11,text-11-3,"Podemos ver que la Tierra tiene diferentes patrones, como montañas, ríos y océanos.",es,"The text is about understanding patterns in the Earth's features, which can be a complex topic. School children with cognitive and learning disabilities need simple, direct language."
easyread-text-11-10,11,text-11-10,This is about the number 41.,en,The text is about the number 41 being provided. I will acknowledge it simply as a number.
easyread-text-18-16,18,text-18-16,Las olas en la superficie del agua causan movimientos grandes y visibles.,es,"The text is about surface waves and their impact. It is important to simplify and explain it in a way that is easy for children to understand, using simple words."
easyread-text-11-7,11,text-11-7,"Weathering is when rocks break into smaller pieces. Erosion is when water, wind, or ice moves the pieces away.",en,"Weathering and erosion are processes that change the Earth's surface. Weathering breaks down rocks into smaller pieces, and erosion moves these pieces to new places. The text needs to explain these concepts in simple words for better understanding by children."
easyread-text-18-15,18,text-18-15,"En un terremoto, las ondas hacen que la tierra se sacuda fuerte.",es,"The original sentence explains that body waves make the earth shake hard during an earthquake. For children, it's important to use simpler words. I will say that body waves cause shaking or jumping during an earthquake."
easyread-text-18-18,18,text-18-18,18,es,The input '18' is a numerical representation which does not need further simplification for basic understanding. It is a simple number that is universally understood.
easyread-text-18-18,18,text-18-18,Eighteen is a number. It is 18.,en,"The text '18' represents a number, specifically eighteen. It's already in its simplest form as a numeral."
easyread-text-11-11,11,text-11-11,Habla de cómo algo cambia o afecta la vida de las personas.,es,"The text section indicates that it discusses how something affects or impacts humans. To simplify, we focus on explaining how something can change or influence people's lives, using simple language."
easyread-text-18-17,18,text-18-17,There is a map of the Pacific Ring of Fire on Wikipedia. Anyone can use it because it is in the public domain.,en,"The text is about a map of the Pacific Ring of Fire available on Wikipedia. The map is in the public domain, which means it is free to use."
easyread-text-11-12,11,text-11-12,49,es,"The number 49 is a simple numeric value, and it doesn't contain complex information that needs to be transformed into simpler language for easier understanding."
easyread-text-11-9,11,text-11-9,"Las partes de una máquina, un ecosistema o una comunidad trabajan juntas. Esto significa que esos sistemas se ayudan mutuamente para funcionar bien.",es,"The text likely refers to how different systems interact with each other. This could mean how different parts of a machine, ecosystem, or even community work together. It's essential to explain it in a way that children can understand using simple terms."
easyread-text-11-11,11,text-11-11,How it affects people.,en,"The original text is a heading referring to the impacts of something (likely an event or policy) on humans. For an easy-read adaptation, I need to use simple and clear language that communicates that people are affected, without any technical details."
easyread-text-11-14,11,text-11-14,57,es,"The original text is a number, and it is already simple and easy to understand. In Spanish, numbers are often used in their numerical form in writing, especially when dealing with whole numbers or common figures, so no simplification or translation is needed."
easyread-text-11-16,11,text-11-16,Es el número 59.,es,"The number 59 is a simple numerical value. To make it accessible for children, I can provide a description or context that relates to everyday experiences or objects."
easyread-text-18-17,18,text-18-17,"El ""Anillo de Fuego del Pacífico"" es un lugar alrededor del océano Pacífico donde hay muchos volcanes y terremotos.",es,"The text is referring to the Pacific Ring of Fire, which is a path around the Pacific Ocean where there are many active volcanoes and earthquakes. It's important to make sure the explanation is simple and easy to understand for children."
easyread-text-11-12,11,text-11-12,49 is a number.,en,"I need to interpret what the number 49 might refer to based on common knowledge. It could represent an age, a quantity, or a general number reference. Thus, I will describe it simply as a number used to count something."
easyread-text-11-9,11,text-11-9,Different systems help each other work. They are like friends who play together to finish a game.,en,The text is about how different parts or systems work together. I need to simplify this idea by using simpler terms and explaining in a way that children can easily understand.
easyread-text-11-14,11,text-11-14,I need some text or a sentence to simplify. Please provide more information that you want me to work on.,en,The request '57' doesn't provide any context or text to simplify for school children with cognitive and learning disabilities. I need more information or context to provide an easy-read version.
easyread-text-11-17,11,text-11-17,2.2 Identificando Sustancias (5.2.2),es,"The text is about identifying different substances, likely focusing on their basic properties or how they can be recognized easily."
easyread-text-11-13,11,text-11-13,"En este capítulo, aprenderemos sobre las propiedades de la materia, que es de lo que están hechas las cosas, y cómo estas propiedades pueden cambiar. Por ejemplo, el agua puede ser líquida, sólida como hielo o vapor en el aire. Esto muestra cómo cambia la materia.",es,"The text is about properties and changes in matter, explaining their role and examples in a way that children with cognitive or learning disabilities can easily understand."
easyread-text-18-0,18,text-18-0,There are many volcanoes and earthquakes in the Ring of Fire because the ground moves a lot there.,en,The text is explaining why there are so many volcanoes and earthquakes in the area called the Ring of Fire. It mentions that the movement of the tectonic plates is the cause.
easyread-text-11-10,11,text-11-10,41,es,"There is no text provided in the task other than '41'. Since no complex or instructional content is given for simplification in the target language, it is assumed to represent a number that doesn't need translation."
easyread-text-11-16,11,text-11-16,The number is fifty-nine.,en,The task is to simplify the given text to make it easy for children with cognitive and learning disabilities to understand. The text '59' is a number and doesn't need simplification as numbers are often understood by school children.
easyread-text-11-20,11,text-11-20,setenta y tres,es,The text is a numerical value '73' which is already simple and does not require further simplification in words since numbers are universally understood.
easyread-text-11-19,11,text-11-19,Aprendemos a mezclar diferentes cosas de forma segura y entender qué ocurre al hacer esto.,es,The text is likely discussing how different substances can be combined. It's important to simplify this by using familiar examples of combining things.
easyread-text-11-19,11,text-11-19,"When we mix things together, like different ingredients, we can make new stuff.",en,"The text is likely about mixing different substances together. For school children, it's important to use simple language explaining that when we combine substances, we might get new things."
easyread-text-11-18,11,text-11-18,Sesenta y siete,es,The number 67 is already a simple concept and doesn't require simplification into a more accessible text.
easyread-text-11-15,11,text-11-15,Las cosas muy pequeñas no se pueden ver fácilmente.,es,The text might discuss small objects that are hard to see. A simplified version should use simple words about things that are tiny and cannot be seen easily.
easyread-text-11-20,11,text-11-20,The number is 73.,en,The text '73' doesn't contain any complex vocabulary or sentence structure that needs simplification. It already is a numeric value and simple enough for easy understanding.
easyread-text-11-18,11,text-11-18,67 is a number.,en,I cannot simplify the number 67 because it is already a simple concept and not a complex sentence or idea to reinterpret for understanding purposes.
easyread-text-23-0,23,text-23-0,"El agua de la Tierra está en los océanos, ríos, lagos y también bajo la tierra.",es,"The text is likely referring to Earth's water composition or distribution. I will simplify it to talk about where we find water on Earth in basic terms, using easy language."
easyread-text-23-1,23,text-23-1,Phenomenon means something amazing that you can see or feel.,en,"The word 'phenomenon' can be challenging to understand. It refers to something impressive that can be seen or experienced, so simplifying it helps make the concept clearer for children."
easyread-text-11-22,11,text-11-22,Setenta y nueve,es,"The text '79' represents a number and there is no further context or content to simplify. In this case, the easy-read response simply provides the number in words in Spanish."
easyread-text-11-24,11,text-11-24,85 is a number. It comes after 84 and before 86.,en,85 is a simple number that children should be able to recognize as part of counting or basic arithmetic.
easyread-text-23-2,23,text-23-2,Most of the water on Earth is salty. It is not fresh.,en,"The text explains that most water on Earth is salty, not fresh. The key idea is to simplify this information so it is easy to understand for children."
easyread-text-11-23,11,text-11-23,Chapter 3 is about how important stuff moves around in Earth's systems.,en,The text is a chapter title that talks about how important materials move around in Earth's systems.
easyread-text-11-24,11,text-11-24,Ochenta y cinco,es,This is the number 85. We need to present it in a way that children with cognitive and learning disabilities can understand.
easyread-text-11-22,11,text-11-22,79,en,The number 79 is a simple numerical representation that does not require any complex interpretation. It should remain the same in the simplified text.
easyread-text-23-2,23,text-23-2,"La mayor parte del agua en la Tierra es salada, no dulce.",es,"Earth has a lot of water, but most of it is salty. Freshwater is less common."
easyread-text-11-17,11,text-11-17,Let's learn how to find out what different things are made of.,en,The text may refer to identifying what substances or materials are by using simple methods or tools. It should be simplified for easier understanding by children.
easyread-text-23-0,23,text-23-0,"Earth has a lot of water. Water is in oceans, rivers, lakes, and even in the ground. We need water to drink, wash, and grow food. Water is very important for life.",en,This section likely describes how water exists on Earth and its importance. The facts can be vital for children to understand our planet's water resources.
