id,page_index,text_id,text,language_code,reasoning
easyread-text-17-3,17,text-17-3,"Maps can show where mountains are, where the ocean floor is, and where volcanoes and earthquakes happen.",en,"The text talks about different types of information. These include maps that show where mountains, volcanoes, earthquakes, and ocean floors are on the Earth."
easyread-text-23-21,23,text-23-21,23 is a number that comes after 22 and before 24.,en,"The input number is 23, which can be considered if needed for providing specific easy-read text related to the number itself in any hypothetical context."
easyread-text-17-4,17,text-17-4,"ESS2.B refers to Earth Science studies, which include volcanoes, earthquakes, and mountains. Scientists study how these things work.",en,"The text seems to refer to a scientific resource code which is often complex, so it's best to convey solutions as humans can understand complex code references and if simplified correctly, offering clarity and understanding to individuals."
easyread-text-17-6,17,text-17-6,"Volcanoes, Earthquakes, and Ocean Floor: How Earth Changes",en,"The original text is a title that mentions volcanoes, earthquakes, and the ocean floor, suggesting a focus on natural Earth processes. To make it more accessible, we need to use simple words to describe these topics and how they connect to each other."
easyread-text-17-0,17,text-17-0,"We see patterns like mountains, rivers, and valleys on Earth. These patterns show us how the land is shaped.",en,"The content is likely about recognizing and understanding the repeating shapes or formations found on Earth's surface, such as mountains, valleys, or rivers. It's important to explain this in simple terms so that children can understand the concept of patterns in nature."
easyread-text-17-1,17,text-17-1,"Mira datos para entender y explicar cómo son cosas en la Tierra, como las montañas y ríos. Explica qué ves de manera sencilla.",es,"The text is about understanding and explaining the different shapes and forms found on Earth, like mountains or rivers, by looking at information or data. The goal is to make it simple for children to understand what Earth's features are like."
easyread-text-17-7,17,text-17-7,"Los volcanes son montañas que pueden explotar. A veces son peligrosos, pero también son interesantes para los científicos.",es,"Volcanoes are mountains that can sometimes have explosions. They can be dangerous, but they are also very interesting for science."
easyread-text-17-3,17,text-17-3,"Ejemplos de datos pueden ser mapas que muestran dónde están las montañas y el suelo del océano, o dónde están los volcanes y terremotos.",es,"The text talks about maps showing where certain natural features like mountains, the ocean floor, volcanoes, and earthquakes are located. The idea is to explain that these maps can help us learn about where these things are in the world."
easyread-text-17-7,17,text-17-7,A volcano is a mountain that can blow out hot rocks and lava from inside the earth.,en,Volcanoes are mountains that spew hot rocks and lava. I need to use simple words and make it easy to understand for children.
easyread-text-17-6,17,text-17-6,"Los volcanes, los terremotos y el suelo del océano son cosas que pasan en la Tierra.",es,"The sentence is about three natural phenomena: volcanoes, earthquakes, and the ocean floor. I need to use simple words and keep the concepts clear and direct for children with cognitive and learning disabilities."
easyread-text-17-2,17,text-17-2,Earthquakes and volcanoes usually happen where land meets the ocean. Big mountains are inside continents or near the edges.,en,"The text explains where earthquakes, volcanoes, and mountain chains often occur on Earth. It uses terms like 'boundaries' and 'bands' to describe locations, and suggests positions such as 'inside continents' and 'near edges'. Simplifying the text, we should focus on saying that earthquakes and volcanoes mostly happen where lands and oceans meet, while mountains can be found within continents or near the edges."
easyread-text-23-17,23,text-23-17,"The picture was made by Mariana Ruiz Villarreal, also known as LadyofHats, for the CK-12 Foundation. You can use it, but not to sell things.",en,"The text credits an image to the artist Mariana Ruiz Villarreal, known as LadyofHats, created for the CK-12 Foundation under a specific non-commercial license. I need to simplify it while keeping important details like names and license information."
easyread-text-17-9,17,text-17-9,Los volcanes cambian la superficie de la Tierra rápidamente.,es,The text explains that volcanoes can quickly change how the Earth's surface looks. I should use simple and everyday words to make this idea clear.
easyread-text-17-10,17,text-17-10,Más de la mitad de la tierra está hecha de rocas volcánicas.,es,The text says that most of Earth's surface is covered in volcanic rock. I need to explain what volcanic rock is and present the information in a simple manner.
easyread-text-17-10,17,text-17-10,More than half of Earth's ground has volcanic rock.,en,"Many parts of the Earth's surface are covered in volcanic rock, which forms after lava cools and hardens. It's a common type of rock on our planet."
easyread-text-25-5,25,text-25-5,Hay más agua salada que agua dulce en la Tierra.,es,"The text asks to compare the amount of salt water and fresh water on Earth, using simple and everyday language for better understanding."
easyread-text-17-11,17,text-17-11,Los volcanes nos muestran que la Tierra se mueve y cambia.,es,The text explains that volcanoes show us that the Earth is not still but always moving and changing. We need to use simple words to convey this meaning to children.
easyread-text-25-8,25,text-25-8,El aire y las nubes que están arriba de la Tierra.,es,The term 'atmosphere' refers to the air and clouds above the Earth. I should use simple words and describe what the atmosphere is without using scientific terms.
easyread-text-17-11,17,text-17-11,Volcanoes show us that the Earth is alive and always changing.,en,"The sentence explains that volcanoes show us that the Earth is active and can change. It uses simple ideas, but I can make it easier by using even more familiar words."
easyread-text-17-8,17,text-17-8,Los volcanes son agujeros en la tierra por donde sale roca caliente y gases.,es,"The text explains what a volcano is and what it does. It contains technical terms like 'crust,' 'magma,' and 'erupt'. To simplify it, I should use everyday words that convey the idea of a volcano releasing hot liquid rock, ash, and gases."
easyread-text-17-9,17,text-17-9,Volcanoes can quickly change the Earth's surface.,en,Volcanoes can erupt suddenly and cause big changes to the land around them very quickly.
easyread-text-23-14,23,text-23-14,"11% of the area is covered with swampy, wet land.",en,The text is about a place that has swamps covering 11% of its area. Swamps are wet and muddy areas where water collects.
easyread-text-17-12,17,text-17-12,Un volcán se forma cuando la roca derretida del centro de la Tierra sube y sale por la superficie.,es,I need to explain how a volcano forms using simple language that children can understand.
easyread-text-28-1,28,text-28-1,El agua salada es el agua del mar. El agua dulce es la que bebemos y usamos en casa.,es,The text needs to be simplified to explain what saltwater and freshwater mean in an easy way for children with cognitive and learning disabilities.
easyread-text-17-13,17,text-17-13,"Deep underground, it is so hot that rocks can melt.",en,"The original sentence explains that beneath Earth's surface, the temperature is very high, which could cause rocks to melt. This needs to be conveyed in simple terms for children."
easyread-text-17-13,17,text-17-13,"Debajo de la superficie de la Tierra, hace tanto calor que las rocas se derriten.",es,"I need to explain that inside the Earth, it is so hot that rocks can turn into liquid."
easyread-text-17-12,17,text-17-12,"A volcano forms when hot, melted rock called magma pushes up from deep inside the Earth and comes out through holes in the ground.",en,The text asks if the reader knows what happens when a volcano forms without any explanation. My goal is to simplify and provide a brief explanation that is easy for children to understand. I will use simple and clear language to describe how a volcano forms.
easyread-text-28-3,28,text-28-3,97%,es,The text '97%' is a simple percentage. It represents a quantity and does not need simplification for understanding.
easyread-text-25-12,25,text-25-12,Veinticinco,es,I must convert the number '25' into a simple expression in Spanish that can be easily understood by children.
easyread-text-28-2,28,text-28-2,"Toda el agua en la Tierra incluye océanos, ríos, lagos y agua subterránea.",es,"The text refers to the total amount of water available on the planet, which includes all types of water sources such as oceans, rivers, lakes, and groundwater."
easyread-text-17-14,17,text-17-14,La roca derretida sale de la Tierra y forma un volcán.,es,"The text explains how melted rock leads to a volcano, which is a lot of information. It uses more complex language like 'cracks in the Earth's crust.' My task is to make this information more accessible by using simpler language that children might understand more easily."
easyread-text-17-15,17,text-17-15,Some volcanoes send out rivers of lava. Other volcanoes erupt even bigger.,en,"The sentence talks about different types of volcanic eruptions, comparing those that produce rivers of lava with others that are larger."
easyread-text-27-2,27,text-27-2,Hay más agua dulce debajo de la tierra que la que vemos en la superficie.,es,The text explains that there is more fresh water stored underground than the water we see on the Earth's surface.
easyread-text-27-0,27,text-27-0,"El agua está en el aire, ríos, lagos, hielo, en la tierra y bajo la tierra.",es,"The text lists different places where water is found in nature. Instead of difficult terms like 'aquifers' and 'soil moisture,' I will use simple words like 'air,' 'rivers,' 'lakes,' 'ice,' 'ground,' and 'underground.'"
easyread-text-28-4,28,text-28-4,"El agua salina significa que el agua está salada, como el agua del océano.",es,"The text is about describing what saline water means, specifically referring to the water in the oceans, which is salty."
easyread-text-17-14,17,text-17-14,"Hot, melted rock comes out from cracks in the ground and makes a volcano.",en,"The text describes how melted rock, or magma, coming out from cracks in the earth's surface can result in a volcano. I need to convey this process in simpler terms using familiar words."
easyread-text-17-4,17,text-17-4,"Este es un código de referencia, pero no nos dice nada sin más información.",es,"The text is a reference code, likely from an educational framework or standard related to Earth systems, typically used to categorize educational content. However, this does not give meaningful information by itself without context."
easyread-text-27-2,27,text-27-2,"There is a lot of water underground, more than what you see on Earth's surface.",en,The sentence talks about where freshwater is located on Earth. It says more freshwater is underground than above ground.
easyread-text-28-2,28,text-28-2,"Water covers most of the Earth. We have oceans, rivers, and lakes. Ice on mountains and the North and South Poles holds a lot of water, too.",en,"The concept of 'Total Water on Earth' refers to all the water found on our planet, including oceans, rivers, lakes, and ice caps. It's a broad topic that highlights how much water exists and is distributed around the Earth."
easyread-text-17-15,17,text-17-15,"Algunas erupciones sacan lava como ríos, pero otros volcanes tienen erupciones más grandes.",es,The sentence talks about two types of volcanic eruptions: some that produce lava flows and others that are larger. The goal is to use simple words and explain this in a way that's easily understandable for children.
easyread-text-27-1,27,text-27-1,"Freshwater is clean water that we find in rivers, lakes, and streams. It is not salty like the ocean.",en,"This text is about explaining what freshwater is. Freshwater is water that is not salty, unlike seawater. I need to explain this in simple and clear language for children."
easyread-text-28-4,28,text-28-4,Ocean water is salty.,en,"The text refers to saline water, specifically in the context of oceans, which is too complex for children with cognitive and learning disabilities. Using broad, straightforward concepts and omitting unnecessary details makes it more comprehensible."
easyread-text-27-3,27,text-27-3,Some of the water in rivers comes from the ground.,en,I should simplify the text by using familiar words and a straightforward structure so that children can understand it easily.
easyread-text-28-5,28,text-28-5,3 de cada 100,es,"The text '3%' is a percentage value, but it could be too abstract for some children. Instead, I explain it in a simpler, more relatable context: '3 out of 100'."
easyread-text-17-16,17,text-17-16,Los volcanes pueden hacer erupción bajo el agua y formar grandes montañas en el fondo del océano.,es,The text is about volcanoes erupting underwater and creating mountains on the ocean floor. The idea is to explain this concept using simple words that children with cognitive and learning disabilities can easily understand.
easyread-text-28-0,28,text-28-0,Putting It Together means making all the parts fit or organizing everything to work.,en,The text 'Putting It Together' is likely referring to assembling or organizing something. I need to simplify it so children understand what it means without using complex language.
easyread-text-17-17,17,text-17-17,El Cinturón de Fuego del Pacífico es un lugar donde hay muchos volcanes y terremotos.,es,The Pacific Ring of Fire is an area where a lot of volcanoes and earthquakes happen. It's important to explain it in simple terms because it's related to natural events that can be complex.
easyread-text-27-3,27,text-27-3,Parte del agua de los ríos viene del agua que se mete en la tierra y se convierte en agua subterránea.,es,"The text explains that some river water comes from underground water, which is groundwater that seeps into the Earth's surface."
easyread-text-17-16,17,text-17-16,Volcanoes can explode under the sea and make big mountains called volcanic mountains on the ocean floor.,en,I need to simplify the text about underwater volcanoes so it's easy to understand for children.
easyread-text-17-5,17,text-17-5,"En este capítulo, verás diferentes patrones en las características de la Tierra.",es,"The text introduces the topic of studying patterns in Earth's features, focusing on a simple introduction that children can understand."
easyread-text-27-4,27,text-27-4,Rainwater goes into the ground and fills places underground where we keep water.,en,"The text explains how rainwater goes into the ground and fills underground water storage areas called aquifers. By using simple words like 'rain' and 'underground water places,' children can better understand the concept without technical terminology."
easyread-text-28-5,28,text-28-5,3% is like having 3 pieces out of 100 pieces of a pie.,en,"The given text '3%' is a percentage with no context or details provided. For simplification, I should explain it in a way that children can understand the concept of percentage using familiar terms."
easyread-text-23-20,23,text-23-20,2. What do you want to know about this thing?,en,"I should make the question simpler and use words that are easy to understand for children. Instead of 'phenomenon', which is a complex word, I should ask directly what they are curious or interested in knowing about it."
easyread-text-27-4,27,text-27-4,El agua de la lluvia entra en la tierra y llena los depósitos de agua subterráneos.,es,"The text describes how rainwater goes into the ground and fills underground spaces that store water. Simplifying this for children, we use everyday language to explain the process."
easyread-text-27-1,27,text-27-1,"El agua dulce es el agua que no tiene sal, como la de los ríos, lagos y arroyos. La usamos para beber, para cultivar, y en nuestras casas.",es,"Freshwater refers to water that is not salty, like the water in rivers, lakes, and streams. It is used for drinking, farming, and in homes and industries."
easyread-text-28-6,28,text-28-6,El agua dulce es el agua que podemos beber. No es salada como el agua del mar.,es,"Here, the focus is on simplifying the concept of fresh water for kids. It's important to use simple, everyday language and keep sentences short while explaining that fresh water is for drinking and not salty like seawater."
easyread-text-28-6,28,text-28-6,"Fresh water is clean water we can drink. It does not have salt, like sea water.",en,"The text 'Fresh water' refers to water that is not salty and is suitable for drinking and irrigation. To simplify for children, we need to explain what fresh water is and its importance in simple words."
easyread-text-28-1,28,text-28-1,Saltwater is in the ocean and has salt. Freshwater is in rivers and lakes and has no salt.,en,"The text needs to simplify the concept of saltwater and freshwater for a child. Saltwater is found in oceans and seas and has salt in it, whereas freshwater is found in rivers and lakes and has very little or no salt. This explanation is brief and uses simple language."
easyread-text-17-18,17,text-17-18,La mayoría de los terremotos y erupciones volcánicas pasan alrededor del océano Pacífico.,es,"The text talks about where most earthquakes and volcanic eruptions happen. The main idea is that they usually occur around the Pacific Ocean's edges, called the ""Ring of Fire"". I should express this idea in simple words so children can understand the concept easily."
easyread-text-17-8,17,text-17-8,"Volcanoes are holes in the ground. They let out hot, melted rocks, ash, and gases.",en,"I need to explain what a volcano is in simple terms, describing it as an opening in the Earth that lets out magma, ash, and gases."
easyread-text-17-19,17,text-17-19,"La superficie de la Tierra se divide en piezas grandes, como un rompecabezas, llamadas placas.",es,The text explains that the Earth's surface is divided into big pieces called plates. I should use simple words and explain that Earth's surface is like a puzzle with big pieces.
easyread-text-17-19,17,text-17-19,The Earth's outer layer is made of big pieces that fit together like a puzzle.,en,I need to explain that the Earth's surface is made of big pieces without using complex terms like 'crust' or 'plates'.
easyread-text-17-17,17,text-17-17,"The Pacific Ring of Fire is an area around the edges of the Pacific Ocean. Here, there are many volcanoes and earthquakes that happen often.",en,"The Pacific Ring of Fire is a path along the Pacific Ocean where active volcanoes and frequent earthquakes occur. This concept may be difficult for young children to understand, so the text should focus on its main features using simple and familiar language."
easyread-text-28-8,28,text-28-8,Sesenta y ocho punto siete por ciento.,es,The percentage value 68.7% represents a part of a whole or total value out of 100.
easyread-text-27-6,27,text-27-6,"People use water from rivers and lakes, and also water from under the ground.",en,"The sentence is about how people use different sources of water, which can be explained in simpler terms for better understanding."
easyread-text-28-7,28,text-28-7,"Los casquetes polares y los glaciares son grandes bloques de hielo en la Tierra. Se encuentran en lugares fríos, como los polos y las montañas altas.",es,"Icecaps and glaciers are large areas of ice on Earth, usually found in cold regions like the poles or high mountains. They hold most of the world's freshwater and can affect the global climate and sea levels."
easyread-text-17-18,17,text-17-18,Most earthquakes and volcanoes happen near the Pacific Ocean's edges.,en,The text is about where most earthquakes and volcanic eruptions happen. It says they happen around the Pacific Ocean's edges. I will simplify it using simple words and sentence structure for better understanding.
easyread-text-28-3,28,text-28-3,97% means almost all of something.,en,"97% is a numerical expression representing a quantity or proportion, often challenging to simplify directly without context. The aim is to convey understanding of the percentage in simple terms, though the original text lacks specific context or details to simplify it effectively. In a general sense, 97% refers to a substantial portion, almost the entirety, of something."
easyread-text-17-21,17,text-17-21,Esta sección está adaptada de información en:,es,"The text is an acknowledgment of the source of adapted information, indicating that the upcoming content is derived from another source."
easyread-text-27-6,27,text-27-6,Las personas usan agua de ríos y agua de pozos.,es,The sentence states that humans use two types of water: surface water and groundwater. We need to simplify it by using common words.
easyread-text-17-20,17,text-17-20,"El movimiento de estas placas en la Tierra puede causar terremotos, erupciones volcánicas y crear montañas.",es,"The text explains how the movement of Earth's plates causes changes like earthquakes, volcanic eruptions, and mountain formation. Simplifying it helps children understand these natural processes."
easyread-text-28-0,28,text-28-0,Juntar las partes para hacer algo completo.,es,The phrase 'Putting It Together' might indicate assembling various parts or ideas to form a complete whole. This can be simplified by explaining it in terms of combining things to make something complete.
easyread-text-17-20,17,text-17-20,"Moving plates can cause big changes like earthquakes, volcanoes, and mountains.",en,"The text explains that moving plates cause earthquakes, volcanic eruptions, and mountains. I need to make it simple and direct for children."
easyread-text-27-7,27,text-27-7,"En 2010, en Estados Unidos, usamos unos 275 mil millones de galones de agua de superficie cada día.",es,"The sentence provides information on how much surface water was used daily in the United States in 2010, presented in gallons and liters. For simplification, I will keep the essential details and use simpler terms, focusing on 2010 water usage in the USA, using quantities that are easier to understand for children."
easyread-text-28-7,28,text-28-7,Icecaps are big ice on the top of the Earth and the bottom. Glaciers are like rivers made of ice found on mountains.,en,"The text refers to large masses of ice found in cold regions, which might be difficult for children to understand if explained with technical terms or complex descriptions. The simplified text should convey that these are big pieces of ice found at the poles and mountains."
easyread-text-28-9,28,text-28-9,El agua subterránea es el agua que está debajo de la tierra.,es,The text 'Ground Water' refers to water under the ground. Giving more context or a simplified explanation helps children understand where this water can be found and why it is important.
easyread-text-28-8,28,text-28-8,This number is part of something. It means almost 69 out of every 100 parts. But we don't know what this number is actually talking about.,en,"The text is about providing a percentage, 68.7%, but it does not explain what this percentage refers to. It might be confusing, so I need to simplify it by adding some explanation."
easyread-text-27-5,27,text-27-5,Water in the ground slowly moves into rivers.,en,"The sentence explains that water in the ground moves into rivers. ""Seepage"" might be confusing, so I replaced it with ""moves into"" for clarity."
easyread-text-27-5,27,text-27-5,El agua del suelo llena los ríos poco a poco.,es,Water from the ground goes into rivers slowly and continuously.
easyread-text-17-21,17,text-17-21,This text comes from some information.,en,"I should simplify the text, making it easier to understand for children with cognitive and learning disabilities."
easyread-text-27-7,27,text-27-7,"In 2010, people in the United States used a lot of water every day from lakes and rivers.",en,The sentence provides data about water usage in the United States specifically for the year 2010. It gives a large number in both gallons and liters which may be difficult for young children to grasp. The main idea is the large quantity of water used every day.
easyread-text-28-10,28,text-28-10,"Es una parte de 100, como si tuvieras 30 de 100 caramelos.",es,"The text '30.1%' indicates a percentage, which can be seen as a complex concept for children. Simplifying it involves explaining that it is a part of something, using words related to everyday experiences, like parts of things they know."
easyread-text-28-9,28,text-28-9,"Ground water is the water that is under the ground, just like the water in the soil or under rocks.",en,"The concept of ground water refers to the water present beneath the Earth's surface, typically in soil or rock formations. This is a more accessible form of water that can be used for various needs but the technical term 'ground water' may not be easily understood. We need to simplify it using more familiar terms."
easyread-text-28-10,28,text-28-10,Imagine you have 100 candies. 30.1% means you have a little more than 30 candies.,en,"The number 30.1% might be about a part of something. For example, 30.1% could be the amount of people or things out of 100 people or things."
