id,page_index,text_id,text,language_code,reasoning
easyread-text-12-0,12,text-12-0,12,en,The number 12 does not need simplification as it is already a simple number.
easyread-text-14-0,14,text-14-0,Catorce,es,"I am supposed to simplify text. However, '14' is simply a number and does not require simplification."
easyread-text-14-0,14,text-14-0,Fourteen,en,I need to simplify number representations in a way that is suitable for children. A simple way to present numbers to young children is by representing them with words.
easyread-text-12-0,12,text-12-0,Doce,es,"This is a vague statement without context, but generally, simplifying '12' involves just describing it as the number twelve in Spanish."
easyread-text-21-2,21,text-21-2,21,en,The text is a number and does not carry any significant context or instruction. It simply represents the number 21.
easyread-text-21-0,21,text-21-0,El lobo asustó a los animales del bosque. Todos corrieron a sus casas y se escondieron.,es,"To simplify the text for children with cognitive and learning disabilities, I need to use simple words and short sentences. The text should be direct and avoid complex ideas."
easyread-text-16-3,16,text-16-3,Hay pocos volcanes en Australia.,es,The question asks about places with few volcanoes.
easyread-text-21-2,21,text-21-2,21,es,"The text '21' is already simple and does not need further simplification. It's a basic numeral mostly used in counting, which is understandable for children."
easyread-text-16-4,16,text-16-4,Hay menos volcanes en el Océano Atlántico.,es,The text asks where there are fewest or no volcanoes. A simple way to convey this is to mention the ocean.
easyread-text-16-0,16,text-16-0,Preguntas importantes,es,"To simplify the term 'Focus Questions,' we should use words that explain what questions do and how they help. We should ensure that the simplified version is easily understandable for school children with cognitive and learning disabilities."
easyread-text-21-0,21,text-21-0,I need the text to simplify for children with learning disabilities.,en,I need to make the complex text easier for school children to understand by using simple words and active voice. The main idea should still be clear.
easyread-text-16-2,16,text-16-2,You can see the most volcanoes near the ocean and in some mountains.,en,"The text asks about where the most volcanoes are found, which can be simplified for children by stating where they can see many volcanoes."
easyread-text-21-1,21,text-21-1,"Wind and rain wear down rocks to make mountains smaller. This is called erosion. In other places, the ground shakes and can crack. This is an earthquake.",en,"Earth has many features like mountains and rivers. These features change over time due to processes like erosion and earthquakes, which alter the Earth's surface in different ways."
easyread-text-16-1,16,text-16-1,"You see the most volcanoes in places where the Earth's plates meet, like the Ring of Fire around the Pacific Ocean.",en,The sentence asks about where one can find the most volcanoes. It needs to be simplified by explaining that volcanoes are found in certain areas.
easyread-text-16-2,16,text-16-2,"Puedes ver muchos volcanes en la ""Zona de Fuego del Pacífico"".",es,"The text asks about places where you can find a lot of volcanoes. Instead of using complex explanations, it's best to say the answer directly and simply."
easyread-text-16-3,16,text-16-3,"You don't see many volcanoes in places that are not near the edges of Earth's plates, like in the middle of big continents.",en,The original text asks where you find the least number of volcanoes. The response should explain this idea simply for children.
easyread-text-16-1,16,text-16-1,"Vemos más volcanes en una zona llamada ""Cinturón de Fuego"" alrededor del Océano Pacífico.",es,"The sentence is asking about the location where most volcanoes are found. Children might be familiar with places like the Ring of Fire, which is known for having a lot of volcanoes. We should use simple and familiar terms to explain this."
easyread-text-16-5,16,text-16-5,Los volcanes activos están cerca de los bordes de las placas de la Tierra. Se forman donde las placas chocan o se separan.,es,"Volcanoes are often found along the edges of Earth's tectonic plates where they push against each other or pull apart. This creates heat that melts rock into magma, which erupts as volcanoes."
easyread-text-16-6,16,text-16-6,Active volcanoes are often near the edges of large pieces of the Earth's surface. They are usually where these pieces meet.,en,Active volcanoes are usually found along the edges of large plates in the earth's crust. They often occur near the boundaries where these plates meet.
easyread-text-16-4,16,text-16-4,"We see the least volcanoes far from the edges of Earth's plates, like in central parts of continents or the middle of the ocean.",en,"I understand that the question is about finding places with very few volcanoes. Most volcanoes are found near tectonic plate boundaries, so areas far from such boundaries would have fewer volcanoes."
easyread-text-21-1,21,text-21-1,La Tierra cambia de dos maneras. Una son los volcanes que tiran lava. Esto hace que la Tierra tenga nuevas montañas. La otra son los terremotos. Hacen que el suelo se sacuda y que a veces se rompa.,es,The text is about two different ways Earth's features can change and how these changes happen. I should use simple words and short sentences to explain these changes.
easyread-text-16-7,16,text-16-7,Dieciséis,es,"The text does not contain any specific context, story, or information to retain or simplify. It's a simple number, which doesn't require simplification or transformation."
easyread-text-16-6,16,text-16-6,"Muchos volcanes están cerca de los bordes de las placas tectónicas. Allí, las placas se mueven y permiten que salga magma, formando volcanes.",es,"Active volcanoes are often located along the edges of tectonic plates. This is because the movement and interaction of these plates create conditions that allow magma to rise to the surface, forming volcanoes."
easyread-text-15-1,15,text-15-1,Suceso,es,The word 'phenomenon' might be difficult for children with cognitive and learning disabilities to understand because it is abstract and less used in daily conversations. Replacing it with more familiar words like 'event' or 'happening' makes it simpler.
easyread-text-15-0,15,text-15-0,"We look for patterns on Earth's surface, like mountains, rivers, and plains, to learn more about them.",en,"The text is about identifying and understanding patterns in Earth's physical features, which can be difficult for children to understand without simpler language."
easyread-text-16-5,16,text-16-5,"Active volcanoes are often in groups or lines near the edges of continents, along mountain ranges, or on islands. They are usually found in places where the Earth's plates meet.",en,"Active volcanoes often appear in similar places, like near the edges of tectonic plates or in regions called 'volcanic arcs'. These patterns happen where the Earth's plates push against each other, pull apart, or slide. Understanding these patterns can help identify geologically active and potentially hazardous areas."
easyread-text-15-3,15,text-15-3,The dots show where active volcanoes are.,en,"The sentence talks about what the dots symbolize, which in this case, signifies active volcanoes. It uses straightforward vocabulary."
easyread-text-15-1,15,text-15-1,A phenomenon is something that happens and people notice it.,en,"The word 'phenomenon' is a complex word, and simplifying it involves using more common and easily understood terms that effectively convey its meaning without losing context."
easyread-text-15-2,15,text-15-2,En el Océano Pacífico hay un camino con muchos volcanes y terremotos. Se llama el Anillo de Fuego.,es,The text describes a place in the Pacific Ocean where there are many volcanoes that erupt and where earthquakes happen often. This place is called the Ring of Fire.
easyread-text-16-7,16,text-16-7,The number is 16.,en,The input does not provide enough context. I can only assume it requires simplification for clarity or explanation for young children.
easyread-text-15-7,15,text-15-7,¿Qué ves sobre este fenómeno?,es,The text asks what someone notices about a specific event or occurrence.
easyread-text-15-0,15,text-15-0,"Aprendemos sobre las formas en la Tierra, como montañas, ríos y océanos, que tienen patrones o formas que se repiten.",es,"The text seems to be from an educational source discussing patterns seen in Earth's features, which could involve geographic or natural formations. Simplifying for school children involves using simple language related to Earth's parts like mountains, rivers, and other land features, focusing on basic understanding without using complex terminology."
easyread-text-15-3,15,text-15-3,Los puntos muestran volcanes activos.,es,I need to simplify the sentence so that children can easily understand it. Use simple words and maintain the meaning that the dots show where volcanoes are active.
easyread-text-15-7,15,text-15-7,What can you see happening? Tell me what you notice about what is going on.,en,The text is about a phenomenon being observed. I should use simple language to explain that observing means looking at something closely to learn more about it.
easyread-text-15-4,15,text-15-4,"The Ring of Fire is a place with lots of volcanoes. Volcanoes happen because the earth's plates move. When plates touch and push, volcanoes and earthquakes can happen here.",en,"The text is about active volcanoes, the movement of the earth's plates, and the Ring of Fire area where many volcanoes and earthquakes happen."
easyread-text-15-8,15,text-15-8,¿Qué preguntas tienes sobre esto?,es,The text is asking what questions or thoughts someone has about a certain event or situation. The goal is to encourage curiosity and inquiry.
easyread-text-15-5,15,text-15-5,"This is a map of Earth's plate tectonics. The USGS made it, and you can see it online at Wikimedia Commons.",en,"The provided text is a citation for an image that depicts a map of plate tectonics on Earth. It includes information about the source, which is the USGS (United States Geological Survey), and provides a link to the Wikimedia Commons repository where the image is located."
easyread-text-15-2,15,text-15-2,"In the Pacific Ocean, there is a place called the Ring of Fire. This place has a lot of volcanoes and many earthquakes happen there.",en,The original text describes a geographic area with many volcanoes and earthquakes. It uses some complex terms like 'pathway of active volcanoes' and 'frequent earthquakes.' I need to simplify it using simpler language and easier sentence structures so that children can understand.
easyread-text-15-6,15,text-15-6,Observations are things you see or notice. Wonderings are things you think about or are curious about.,en,"Observations mean things you notice, and wonderings mean things you are curious about. It's important to simplify this so children can understand easily."
easyread-text-15-8,15,text-15-8,What do you want to know about this thing?,en,"The original question uses the word 'phenomenon,' which may be difficult for children to understand. I should use simpler words like 'thing' to make it more accessible."
easyread-text-15-9,15,text-15-9,El número es quince.,es,"The task requires simplifying text for better understanding by children with cognitive or learning disabilities, using clear and everyday language in Spanish."
easyread-text-22-0,22,text-22-0,Veintidós,es,The text is a sequence of numbers presented in numerical format. It should be represented as plain text in an easy-to-understand manner for young children.
easyread-text-15-9,15,text-15-9,There is no text provided to simplify.,en,"The input doesn't contain a text to simplify, so no conversion is required, but if it were a part of a text, it would need to be simplified based on context."
easyread-text-15-6,15,text-15-6,Cosas que vemos y cosas sobre las que pensamos.,es,"The phrase 'Observations & Wonderings' can be broken down into two simple parts: 'Observations' refers to things we see or notice, and 'Wonderings' refers to things we think about or are curious about. The aim is to understand each word separately using simpler words."
easyread-text-16-0,16,text-16-0,Focus questions are special questions that help you find important details.,en,"The text is about focus questions, which are specific questions that help guide attention to important details. It's important to make the explanation clear and straightforward for easier understanding."
easyread-text-24-0,24,text-24-0,Preguntas que ayudan a concentrarse o entender mejor.,es,The term 'focus questions' might be too formal and abstract for young children. I need to break it down into simpler words that explain the concept of asking questions that help you pay attention or understand something better.
easyread-text-22-0,22,text-22-0,22 is the number two repeated. It's a double of 11.,en,"The number '22' is already simple and clear. It represents a numerical value or quantity, which doesn't require further simplification for school children with cognitive and learning disabilities."
easyread-text-15-4,15,text-15-4,"Hay volcanes activos que pueden explotar. La Tierra tiene placas que se mueven. En un área llamada el ""Anillo de Fuego"" hay muchos volcanes.",es,"The text mentions active volcanoes, the movement of Earth's plates, and a special area with many volcanoes. I should use simple words and explain these concepts in a clear way."
easyread-text-24-0,24,text-24-0,These are important questions to think about.,en,"The task is to create an easy-to-understand text suitable for children with cognitive and learning disabilities. I need to simplify the text by using simpler words and making the sentences easier to understand, while keeping the original meaning."
easyread-text-24-1,24,text-24-1,Most of the water on Earth is salty. It is in the oceans.,en,The text is asking about the amount of salt water on Earth. Most water on Earth is in the oceans and is salty. The task is to explain this in simple words.
easyread-text-24-2,24,text-24-2,"Muy poca agua de la Tierra está en la superficie, como en lagos, ciénagas y ríos.",es,"The question asks about the amount of water on Earth that is not underground or in the ocean, but is instead found in places like lakes, swamps, or rivers. Surface water is a small part of all the water on Earth."
easyread-text-24-3,24,text-24-3,"This question might be hard because it asks for complex thinking. We can simplify by asking, 'Did you see anything unexpected in the data?'",en,"To simplify complex questions or data, we need to break it down into simple concepts and avoid abstract ideas."
easyread-text-13-0,13,text-13-0,Inicio del libro,es,The text indicates it's the beginning of a book. We need to describe it in simpler words for better understanding.
easyread-text-24-3,24,text-24-3,La pregunta quiere saber qué cosas te sorprenden de la información.,es,"The text asks about surprising things in the data, indicating it's a question that requires a response about observations."
easyread-text-13-1,13,text-13-1,Aprendemos sobre cómo las diferentes partes de la Tierra trabajan y se afectan entre sí.,es,The text is about understanding the features and how different parts of Earth interact with each other without using complex terms.
easyread-text-13-1,13,text-13-1,We will learn how different parts of Earth work and talk to each other.,en,The original text is a heading for a science topic about Earth. It discusses different characteristics and how Earth's systems work together.
easyread-text-24-2,24,text-24-2,"Only a small amount of the water on Earth is in lakes, swamps, or rivers.",en,"The question is asking about the amount of water on Earth that is on the surface, like in lakes, swamps, and rivers. I should explain what surface water is in a simple way."
easyread-text-20-0,20,text-20-0,Juntar cosas.,es,The text seems to relate to the idea of combining or assembling things.
easyread-text-24-4,24,text-24-4,Veinticuatro,es,"The text simply presents a number which does not require simplification; however, for a complete response, we can mention it counts something simple like coins, apples, or candies to align with the theme of simplification for children."
easyread-text-13-0,13,text-13-0,CHAPTER 1,en,"The text 'CHAPTER 1' refers to the beginning of a book or a specific section. Since it does not contain complex language, simplifying it means maintaining its simple structure without adding unnecessary information."
easyread-text-13-2,13,text-13-2,A chapter outline is like a list of main ideas or parts in a chapter. It helps you see what the chapter talks about.,en,The text is asking for a simple breakdown of the topics covered in a chapter so that someone can easily understand what the chapter is about.
easyread-text-20-0,20,text-20-0,Combining things.,en,The text is about combining or assembling things in a simple way.
easyread-text-24-4,24,text-24-4,24 is a number that people use for different reasons. Sometimes they use it to show they want help or to ask a question.,en,The original text states that 24 is used often as a placeholder or prompt for simplification tasks. The goal is to simplify or maintain clarity for individuals with cognitive and learning disabilities.
easyread-text-13-2,13,text-13-2,"Un esquema de capítulo es como un plan que muestra lo que pasa en el capítulo. Muestra los puntos principales uno por uno, así es fácil entender de qué hablará el capítulo.",es,"A chapter outline is like a plan showing what happens in the chapter. It gives the main points or sections one by one, so it's easy to understand what the chapter will talk about."
easyread-text-15-5,15,text-15-5,El mapa muestra las placas tectónicas del mundo.,es,"The image described is likely a map showing the tectonic plates of the world, created by the US Geological Survey (USGS). Since this is a description of an image and mentions the source as USGS, we don't have a narrative or story to simplify linguistically."
easyread-text-13-3,13,text-13-3,"We see patterns in Earth's features like mountains, rivers, and valleys. These patterns help us understand the land better.",en,"Earth's features like mountains, rivers, and valleys have patterns. It's important to use simple language to explain this concept to children with cognitive and learning disabilities."
easyread-text-19-0,19,text-19-0,Los movimientos que ruedan causan mucho daño.,es,"The text refers to rolling motions, which are movements that shake things a lot and can break or damage objects."
easyread-text-19-0,19,text-19-0,Rolling movements cause a lot of harm.,en,"The text talks about rolling motions which usually cause a lot of damage. To make it simpler, we focus on the main idea of rolling movements causing harm."
easyread-text-13-4,13,text-13-4,Earth has a lot of water. Water is very important for everything on Earth.,en,"Information about Earth's water might be complex, but to simplify, we should describe the main concept: Earth has a lot of water and we should highlight the importance of water for our planet."
easyread-text-24-1,24,text-24-1,La mayoría del agua en la Tierra es agua salada de los océanos.,es,"The question is asking about the amount of salt water on Earth. Most of Earth's water is in the oceans, and ocean water is salty."
easyread-text-20-2,20,text-20-2,La imagen es un mapa hecho por USGS que muestra tectónica de placas del mundo y está en el dominio público en Wikimedia Commons.,es,"The text refers to a map image created by the United States Geological Survey (USGS) showing global plate tectonics, available on Wikimedia Commons. My goal is to explain that image license status and its source in simple words."
easyread-text-13-4,13,text-13-4,"La Tierra tiene agua en océanos, ríos y lagos. También hay agua en el cielo, en las nubes y en la nieve.",es,"The text is meant to introduce children to Earth's water sources, so I need to use simple terms that describe where water can be found on Earth."
easyread-text-13-3,13,text-13-3,"A los niños les gusta buscar patrones en las cosas. La Tierra tiene patrones especiales. Podemos verlos en las montañas, ríos y valles. Es divertido aprender sobre ellos.",es,"The text refers to identifying and understanding patterns in the natural features of Earth, like mountains, rivers, and valleys, to make it easier for children to understand, using simple language and examples is important."
easyread-text-19-1,19,text-19-1,Los terremotos pueden formar montañas y valles en la tierra.,es,"The text explains that earthquakes have the power to shape the land by creating new landforms, which are natural features on the Earth's surface."
easyread-text-29-0,29,text-29-0,Tarea final.,es,"The text is about a task that needs to be done. It is a simple statement without details, which makes it hard to simplify further. However, I can use simpler and clearer language for better understanding."
easyread-text-13-5,13,text-13-5,El clima y la erosión rompen las rocas y el suelo. Esto ocurre en la superficie de la Tierra.,es,Weathering and erosion are processes that break down rocks and soil on Earth's surface. I need to explain these basic concepts using simple words for better understanding.
easyread-text-20-2,20,text-20-2,This is an image made by the USGS. You can use it because it is free to share and use.,en,"The original text gives credit for an image by specifying the author and states the license as public domain. For simplification, we need to keep the basic idea that it is an image and owned by the USGS, and it is free to use since it is in the public domain."
easyread-text-20-1,20,text-20-1,"Los volcanes activos pueden explotar en cualquier momento. Estos volcanes están en lugares donde las placas de la Tierra se juntan. Esto se llama tectónica de placas. El ""Anillo de Fuego"" es una zona famosa donde hay muchos volcanes alrededor del océano Pacífico.",es,"Active volcanoes are volcanoes that can still erupt. They are often found in places where Earth's surface plates meet, which is called plate tectonics. The ""Ring of Fire"" is a very famous area where many volcanoes are located around the edges of the Pacific Ocean. It has lots of active volcanoes and earthquakes."
easyread-text-20-1,20,text-20-1,Volcanoes are mountains that can blow up with fire and rocks. They are in places where the ground plates move a lot. The 'Ring of Fire' is a special area in the ocean where many volcanoes are found.,en,"The title is about active volcanoes, the movement of Earth's plates, and a region called the 'Ring of Fire'. I need to use simple words to explain that volcanoes erupt when plates move and the 'Ring of Fire' is a place with many volcanoes around the ocean."
easyread-text-30-0,30,text-30-0,Treinta es un número. Es más que veinte y menos que cuarenta.,es,"The provided input is a number. To simplify for easier understanding, I will describe the number in words for children with cognitive and learning disabilities, while ensuring to use simple language."
easyread-text-30-0,30,text-30-0,30 is a number that comes after 29 and before 31.,en,The number '30' is already simple and easy to understand for school children. It's a basic numerical value that does not need further simplification in terms of language.
easyread-text-19-1,19,text-19-1,Earthquakes can change the shape of the land.,en,The text is about how earthquakes can change the Earth's surface by making new shapes or landforms. I need to use simple words to explain this process.
easyread-text-13-6,13,text-13-6,Los sistemas trabajan juntos y se afectan unos a otros.,es,"The text likely discusses how different systems work together or affect each other. For an easy-read version, I need to simplify it and make it more relatable for children."
easyread-text-13-5,13,text-13-5,Weathering means rocks break into small pieces. Erosion means wind and water carry those pieces away.,en,"The text is about understanding two natural processes that affect the Earth's surface, which are weathering and erosion. These geological processes, often taught at an early education level, can be simplified by explaining what each term means and how they differ from each other while retaining necessary details."
easyread-text-29-0,29,text-29-0,Finish the last step.,en,"The original text seems to involve a final task or step, which implies something to be completed or accomplished. For school children, it's better to use simple and direct language to convey the idea of finishing a task."
easyread-text-20-3,20,text-20-3,Focus questions help you learn by pointing the way.,en,"Focus questions are typically questions that help to guide someone in their learning or understanding. Simplifying this, I can explain that focus questions are important questions that point you in the right direction when you are learning something new."
easyread-text-29-1,29,text-29-1,No puedo dibujar. Pero puedo decirte que hay mucha más agua salada que agua dulce en la Tierra.,es,Creating a bar graph is a visual way to show differences between saltwater and freshwater on Earth. Saltwater is much more abundant than freshwater on the planet.
easyread-text-13-6,13,text-13-6,Different systems can work together and affect each other.,en,The text seems to be discussing a topic related to how different systems work together or interact with each other.
easyread-text-19-2,19,text-19-2,"When an earthquake happens, the ground shakes, and the land can rise up to make mountains.",en,"When tectonic plates move, they sometimes push against each other during an earthquake. This pushing can lift the ground and form mountains."
