page_index,id,origin_language_code,language_code,text,reasoning
23,sectioneli5-23-0,en,es,"Imagina que toda el agua en la Tierra es como un balde gigante. La mayor parte de esta agua, casi todo el balde, es salada como el océano. Si tuvieras 100 gotas de agua, 97 de ellas sabrían saladas. Solo 3 gotas de cada 100 son agua dulce, que es lo que necesitamos para beber y usar todos los días. Esta agua dulce está mayormente atrapada en hielo o bajo tierra, así que no hay mucha disponible para que la usemos fácilmente.","The text compares the Earth's water to a bucket, explaining the distribution of saltwater and freshwater. Important to maintain the quantitative comparisons and describe their availability. The translation needs to reflect the same analogy and figures in Spanish."
16,sectioneli5-16-0,en,es,"Cuando pensamos en dónde se encuentran la mayoría de los volcanes, podemos imaginar mirando un mapa o una imagen del mundo. La mayoría de los volcanes se encuentran en lugares llamados el ""Anillo de Fuego"", que es un gran círculo alrededor del Océano Pacífico. Aquí es donde las placas de la Tierra se encuentran y se mueven, causando que aparezcan muchos volcanes. ¡Es como buscar dónde están la mayoría de las burbujas cuando agitas el agua de la bañera!","The task requires translating the passage about volcanoes, particularly the 'Ring of Fire', into Spanish, while ensuring proper translation of metaphors and imagery used in the explanation."
27,sectioneli5-27-1,en,es,"En 2010, las personas en los EE.UU. usaron mucha agua tanto de lagos y ríos (agua superficial) como de bajo tierra (agua subterránea). Mientras que usualmente usamos agua superficial para beber y regar plantas, el agua subterránea también es muy importante. Ayuda a mantener llenos los lagos y ríos y proporciona agua a áreas como los desiertos, donde es difícil encontrar agua.","The passage discusses water usage, distinguishing between surface water and groundwater. It emphasizes the importance of both, indicating their respective roles. The reasoning is to ensure correct contextual translation of terms concerning water use."
20,sectioneli5-20-1,en,es,"El mapa muestra muchos puntos coloridos que son volcanes. La mayoría de estos puntos están en lugares donde se ven líneas oscuras, que son como grietas en la superficie de la Tierra llamadas límites de placas. Esto significa que los volcanes generalmente ocurren donde están estas grandes grietas, como alrededor del borde del Océano Pacífico en algo llamado el 'Anillo de Fuego'.","I need to translate all text elements, including nouns like 'the map,' 'dots,' 'volcanoes,' and 'Ring of Fire,' into Spanish. However, any specific names such as 'Ring of Fire' should be treated as proper nouns and not translated."
18,sectioneli5-18-1,en,es,"Imagina que la Tierra es como un gran rompecabezas hecho de piezas gigantes llamadas placas tectónicas. A veces, estas piezas se mueven y chocan entre sí a lo largo de grietas llamadas fallas. Cuando lo hacen de repente, es como sacudir una caja muy fuerte, haciendo que todo el suelo a nuestro alrededor tiemble, ¡y a eso lo llamamos un terremoto!

Ahora, cuando golpeas una mesa, sientes y ves las vibraciones. De manera similar, durante un terremoto, algunas ondas viajan a lo largo del suelo (estas se llaman ondas superficiales). Otras van más profundamente dentro de la Tierra (estas se llaman ondas de cuerpo). Las de adentro hacen grandes movimientos bruscos, mientras que las de arriba hacen movimientos ondulatorios. ¡Por eso tiembla el suelo!","To accurately translate the given text into Spanish, it is important to preserve the meaning and essence of the original text while converting all English words into their correct Spanish equivalents. This includes translating nouns, verbs, and adjectives while maintaining the same structure and flow of the paragraph. It is crucial not to translate scientific terms such as 'tectonic plates,' 'surface waves,' and 'body waves' literally but rather to use their scientifically accepted Spanish counterparts if they exist."
28,sectioneli5-28-2,en,es,"Cuando miramos el agua en la superficie de la Tierra, es como un vaso gigante mayormente lleno de agua salada del océano. Pero una pequeña parte de esa agua es dulce, y proviene de lagos, ríos y pantanos. Estos son lugares donde podemos encontrar agua dulce utilizable.","The text discusses the composition of water on Earth's surface, differentiating between salty ocean water and fresh water from sources like lakes, rivers, and swamps. The nouns such as 'water', 'Earth's surface', 'ocean', 'lakes', 'rivers', and 'swamps' must be translated to Spanish accordingly."
17,sectioneli5-17-3,en,es,"Los volcanes son como grandes botellas de gaseosa efervescente dentro de la Tierra. Cuando agitas una gaseosa y la abres, todas las burbujas intentan salir rápidamente. En un volcán, la roca derretida caliente dentro de la Tierra, como las burbujas de la gaseosa, quiere salir. Así que empujan a través de las grietas en el suelo. Cuando salen, pueden cambiar rápidamente la apariencia del paisaje. Esto demuestra que la Tierra es como un lugar ocupado y en constante movimiento que nunca permanece igual.","The text explains a concept using an analogy. In translating, it is important to maintain the meaning and imagery. All nouns and the main idea should be accurately translated into Spanish."
25,sectioneli5-25-0,en,es,"Imagina que la Tierra es como una gran bola con agua por todas partes. Algo de agua es salada, como en los océanos, y algo es dulce, como en los ríos y lagos. Usamos matemáticas, como contar y medir, para averiguar cuánta agua salada y dulce hay. Esto nos ayuda a ver dónde está toda el agua en la Tierra, como en lugares helados y debajo del suelo. Es como averiguar cuánta cantidad de jugo versus leche hay en tu nevera.","To accurately translate the text into Spanish, I must ensure that both simple descriptive phrases and specific examples are correctly converted while maintaining the conceptual comparisons, like comparing water distribution to household liquids. Additionally, I need to ensure mathematical references are clear, as they play a key role in understanding context."
17,sectioneli5-17-4,en,es,"En las profundidades de la Tierra, hace mucho calor, lo suficiente como para derretir rocas. Estas rocas derretidas encuentran pequeñas grietas y salen a la superficie de la Tierra, creando un volcán. A veces, un volcán derrama lava como un río, ¡y a veces estalla con mucha fuerza! Los volcanes incluso pueden ocurrir bajo el agua, formando grandes montañas en el fondo del océano.","To accurately translate the narrative about volcanoes from English to Spanish, it's important to maintain the context and ensure technical terms like 'lava' and 'volcano' are translated properly as 'lava' and 'volcán' respectively, without losing the underlying descriptive imagery."
19,sectioneli5-19-0,en,es,"Imagina que el suelo es como un gran rompecabezas hecho de piezas gigantes llamadas placas tectónicas. A veces, estas piezas chocan entre sí debajo de la Tierra. Este choque puede empujar el suelo hacia arriba y formar montañas. Pero, a veces el suelo se desliza profundamente donde no podemos verlo. Y si ocurre un terremoto en el océano, puede crear una ola gigantesca llamada tsunami.","I will translate the provided English text into Spanish, ensuring that the concepts related to tectonic plates and natural phenomena are accurately conveyed in Spanish."
27,sectioneli5-27-0,en,es,"¿Sabes cómo cuando llueve, el agua entra en el suelo y parte de ella fluye hacia los ríos? Bueno, aunque vemos mucha agua en ríos y lagos, en realidad hay más agua dulce escondida bajo tierra. Esto se llama agua subterránea. Imagínate que es como cuando viertes jugo en tu caja de arena y desaparece en la arena. Ese jugo todavía está allí, al igual que el agua está en el suelo. Esta agua es realmente importante porque ayuda a mantener llenos los ríos y nos proporciona agua para usar, especialmente en lugares donde es difícil obtener agua de otra manera.","To translate this text, I need to convey the process of rainwater absorption and the significance of groundwater using appropriate Spanish terms. I will consider translating the analogy and ensure the sentence structure is preserved in Spanish."
18,sectioneli5-18-0,en,es,"Imagina que la Tierra es como un gran rompecabezas hecho de piezas gigantes llamadas placas tectónicas. El Anillo de Fuego es un lugar especial donde muchas de estas piezas se encuentran. A veces chocan entre sí, se deslizan unas frente a otras o se separan. Cuando esto sucede, pueden causar ruidos fuertes, que llamamos terremotos, o crear magma que hace que los volcanes entren en erupción. Es un poco como cuando mueves un gran bloque de piezas de Jenga y algunas partes tiemblan o caen.

La imagen muestra una línea roja como un collar delineando el Anillo de Fuego, donde ocurren muchos terremotos y volcanes debido a estas placas en movimiento. Cuando las placas se alejan unas de otras, es como rasgar papel; esto puede crear nuevas formas en la superficie de la Tierra.","The text is a simple explanation of tectonic activity related to the Earth's structure and the Ring of Fire. 'Tectonic plates,' 'Ring of Fire,' and 'Jenga' are all proper nouns or specific terms that should be translated appropriately. The rest of the text is straightforward and should be translated into Spanish."
28,sectioneli5-28-1,en,es,"La mayor parte del agua en la Tierra es salada, como en los océanos. Pero también hay agua dulce, que podemos beber. Se encuentra principalmente en tres lugares: en los casquetes polares y glaciares (como grandes montañas de hielo), en el suelo (como el agua almacenada bajo tierra) y en los ríos y lagos (como grandes estanques naturales). Estos lugares son importantes para proporcionarnos el agua que necesitamos cada día.",This text discusses different types of water on Earth and their locations. It's important to translate all parts coherently into Spanish.
17,sectioneli5-17-1,en,es,"Vamos a aprender sobre cómo la Tierra no está simplemente quieta y tranquila. Es como un rompecabezas gigante, y a veces las piezas se mueven. Cuando lo hacen, podemos ver cosas como volcanes y terremotos. Los volcanes son como montañas gigantes que pueden derramar roca fundida, y los terremotos ocurren cuando el suelo tiembla porque las piezas del rompecabezas chocan entre sí o se separan. Estos cambios ocurren mucho alrededor de grandes océanos como el Océano Pacífico, donde a las piezas del rompecabezas de la Tierra especialmente les gusta moverse y cambiar.","To translate this paragraph into Spanish, I will translate each sentence while maintaining the original meaning. The nouns and concepts such as Earth, volcanoes, and Pacific Ocean will be translated to their Spanish equivalents, and the explanation will be adjusted to fit natural Spanish expression."
17,sectioneli5-17-2,en,es,"Imagina la Tierra como un gran cascarón de huevo agrietado. Estas grietas se llaman placas, y se mueven muy lentamente. Cuando estas placas se mueven mucho, el suelo tiembla y tenemos un terremoto. Ahora, dentro de la Tierra, hace muchísimo calor, como un horno gigante. A veces, la roca derretida caliente llamada magma encuentra una salida a través de las grietas y se convierte en un volcán. ¡Cuando un volcán entra en erupción, es como una gran montaña de roca derretida y ceniza que sale! Esto también ocurre mucho alrededor del Océano Pacífico, que se llama el 'Anillo de Fuego' debido a todos los volcanes y terremotos que hay allí.","To deliver an accurate translation, I need to maintain the analogies and descriptions accurately while translating the nouns and general sentences into Spanish, keeping the original meaning clear."
26,sectioneli5-26-1,en,es,"La Tierra tiene mucha agua, ¡como una gran manta acuosa! Si imaginas la Tierra cubierta por una manta de agua, 71 partes de cada 100 son agua. La mayor parte de esta agua, aproximadamente 96 partes de cada 100, está en los océanos, que son salados y no aptos para beber. Hay una pequeña cantidad de agua que es dulce, y esa es la que necesitamos para beber y que usen las plantas y los animales para vivir. Así que, la Tierra tiene mucha agua, pero solo una pequeña parte es del tipo que realmente podemos usar.","The text describes the distribution of water on Earth. To translate this accurately, I should ensure that the numerical data and context remain clear and unchanged in Spanish."
28,sectioneli5-28-0,en,es,"Imagina que toda el agua de la Tierra cabe en un gran cubo. La mayor parte de esta agua, alrededor de 97 de cada 100 partes, es salada como el océano. Solo una pequeñísima parte, 3 de cada 100 partes, es agua dulce. Esta agua dulce se encuentra principalmente en el hielo y los glaciares, bajo tierra, y una cantidad diminuta en lagos y ríos. Así que, aunque hay mucha agua en la Tierra, muy poca es dulce y puede ser utilizada para beber.","To translate this text into Spanish accurately, consider that we're dealing with descriptive information about water distribution on Earth. Terms like 'freshwater', 'glaciers', and 'underground' have direct Spanish translations. Also, maintain the numerical expressions as they are universal."
26,sectioneli5-26-0,en,es,"Imagina que la Tierra es como una gran canica azul, cubierta principalmente de agua. Pero la mayor parte de esta agua, alrededor del 96%, es salada, como la que está en el océano, y no podemos beberla.

Solo una pequeña parte, alrededor del 2.5%, es agua dulce, lo que todos los seres vivos necesitan para sobrevivir. La mayor parte de esta agua dulce está atrapada en hielo o en el subsuelo. Solo una pequeña parte, el 1.2%, es fácil de acceder, como el agua en ríos y lagos. Aunque no hay mucha de esta agua dulce fácil de alcanzar, los ríos son realmente importantes porque nos dan agua que podemos usar todos los días.","To accurately translate the given text into Spanish, identify the key ideas and concepts regarding the proportion of water on Earth and translate these ideas using appropriate Spanish equivalents, ensuring that units and percentages are kept intact."
20,sectioneli5-20-0,en,es,"Imagina que la Tierra es como un gigantesco rompecabezas. Cada pieza es una gran losa de roca llamada placa. Estas placas flotan muy lentamente sobre una capa de roca viscosa, como icebergs en el océano. A veces, chocan entre sí o se separan, y esto ocurre a lo largo de líneas llamadas límites.

Ahora, cuando estas placas se mueven, pueden causar la formación de volcanes. Se encuentran muchos volcanes en un área especial llamada el ""Cinturón de Fuego"", que tiene forma de herradura alrededor de los bordes del Océano Pacífico. Esto se debe a que allí se encuentran los bordes de muchas placas.

A veces, cuando las placas se desplazan, también pueden causar que el suelo tiemble, a lo que llamamos un terremoto. Así que, al observar dónde están los bordes de estas placas, podemos suponer dónde podríamos ver volcanes o terremotos.

Al igual que las piezas del rompecabezas cambian cuando las mueves, la superficie de la Tierra también cambia, y es por eso que hacer predicciones al respecto es como adivinar qué pieza se moverá a continuación.","To translate this text into Spanish accurately, I will carefully consider each sentence to ensure that both the nouns and concepts are translated correctly into Spanish, while keeping the sensible structure of the statements and their explanations."
13,sectioneli5-13-0,en,es,"Imagina la Tierra como un parque infantil muy concurrido donde cuatro grupos juegan juntos. Está la geósfera (rocas y tierra), la hidrosfera (agua y hielo), la atmósfera (todo el aire) y la biosfera (plantas, animales y personas). A estos grupos les gusta mezclarse y, a veces, cambian las cosas, como el desgaste y la erosión que dan forma a la tierra. A veces chocan entre sí, provocando grandes cambios como deslizamientos de tierra o volcanes. Aunque no podemos detener estos eventos naturales, podemos encontrar formas de mantenernos a salvo y evitar que nos dañen demasiado.","The passage describes Earth as a playground with four main components: geosphere, hydrosphere, atmosphere, and biosphere. Each part has specific functions and interacts with the others, causing natural changes that sometimes result in hazardous events. The translation involves conveying this idea accurately while keeping all mentioned terms and concepts intact to form a cohesive understanding in Spanish."
16,sectioneli5-16-1,en,es,"Imagina que la Tierra es como una gran bola con baches y algunos puntos ásperos y puntiagudos llamados volcanes. Estos volcanes se encuentran por todas partes, pero en algunas partes del mundo, hay menos de ellos. Piense en ello como un parque de juegos en el que algunas áreas tienen muchos toboganes (volcanes) y otros lugares con pocos o ninguno. Entonces, los lugares con menos volcanes son como esas partes del parque de juegos que están más vacías.","When translating the provided text into Spanish, I need to ensure that all terms and concepts are accurately represented while maintaining the original context. The concept of volcanoes as features of the Earth's surface should remain clear, and terms like 'volcanoes,' 'playground,' and 'slides' need to be correctly translated into their Spanish equivalents."
19,sectioneli5-19-1,en,es,"Imagina que el fondo del océano es como un rompecabezas gigante hecho de enormes piezas llamadas placas. Estas placas se mueven y pueden separarse en ciertos lugares, como en las dorsales oceánicas. Cuando se separan, dejan espacio para que suba roca caliente y derretida llamada lava, que al enfriarse, forma nuevas partes del fondo oceánico como bloques de Lego. Cuando esto ocurre, también puede causar montañas submarinas e incluso terremotos. La isla de Islandia se encuentra justo sobre una de estas grandes dorsales, llamada la Dorsal Mesoatlántica, como si estuviera sentada sobre una enorme cordillera bajo el mar.","To translate this text accurately, it's essential to convey the analogy of the ocean floor being like a puzzle and to explicitly translate the geological terms like 'plates', 'mid-ocean ridges', 'lava', and 'Mid-Atlantic Ridge'. The concept of geological activity resulting in new oceanic features such as mountains and earthquakes needs to be expressed clearly in Spanish."
17,sectioneli5-17-5,en,es,"Imagina la corteza terrestre, o capa superior, como un gran rompecabezas hecho de piezas enormes llamadas placas. Los bordes del Océano Pacífico son como donde se encuentran muchas de estas piezas del rompecabezas. Cuando estas piezas se mueven, a veces hacen temblar el suelo, lo que llamamos terremotos, o pueden hacer que la roca caliente y derretida estalle, lo que llamamos erupciones volcánicas. Esta área se conoce como el Cinturón de Fuego del Pacífico, y es donde estos emocionantes cambios suelen ocurrir, como la formación de montañas o la erupción de volcanes.",The given text describes geological concepts related to the Earth's crust and natural phenomena like earthquakes and volcanic eruptions. The translation into Spanish should capture these terms accurately.
13,sectioneli5-13-1,en,es,"La Tierra es como un gran y ocupado patio de recreo con diferentes partes que juegan juntas. Imagina el suelo sobre el que caminas (geosfera), el agua que bebes (hidrosfera), el aire que respiras (atmósfera) y todas las plantas y animales (biosfera) como los amigos en este patio de recreo. Estas partes hablan y juegan entre sí. Por ejemplo, la lluvia (parte de la atmósfera) puede desgastar las rocas (geosfera) con el tiempo, lo que se llama meteorización. A veces, estas interacciones pueden causar grandes eventos como los volcanes, que son como una gran montaña que explota su cima. No podemos detener estos grandes eventos, pero podemos encontrar formas de mantenernos seguros, como buscar refugio cuando llueve.","To translate the descriptive text about Earth's systems into Spanish, it is important to accurately convey the concepts of geosphere, hydrosphere, atmosphere, and biosphere, and their interactions. Proper translation of terms like 'weathering' and 'volcanoes' is crucial to maintain the context."
20,sectioneli5-20-3,en,es,"Cuando las placas de la Tierra se mueven, como piezas de un rompecabezas, pueden causar que los volcanes entren en erupción o que el suelo tiemble en terremotos. En el futuro, esto podría cambiar la forma del terreno, como hacer que las montañas sean más altas o formar nuevas islas.",The passage describes geographical phenomena such as the movement of the Earth's plates and its effects like volcanic eruptions and earthquakes. All components are translatable to Spanish as they are common concepts in both languages.
16,sectioneli5-16-2,en,es,"Los volcanes se encuentran generalmente en los mismos lugares donde la corteza terrestre tiene grietas o roturas, como un rompecabezas. Esto ocurre a menudo donde las grandes piezas de la Tierra, llamadas placas tectónicas, se encuentran o se separan. Entonces, si miras un mapa, verás volcanes en largas líneas o en círculos, como el ""Anillo de Fuego"" alrededor del Océano Pacífico.","The text describes natural phenomena related to geography, mentioning terms like 'volcanoes,' 'Earth's crust,' 'tectonic plates,' and 'Ring of Fire,' which should all be translated accurately. There are no math symbols or units to consider in this text."
