page_index,id,origin_language_code,language_code,text,reasoning
28,text-28-6,en,es,Agua dulce,The phrase 'Fresh water' should be translated into Spanish as it consists of common nouns.
17,text-17-11,en,es,Los volcanes son evidencia de que vivimos en un planeta activo y cambiante.,The sentence discusses volcanoes as evidence of the Earth's active nature. All parts of the sentence need to be translated into Spanish while keeping the scientific context intact.
17,text-17-6,en,es,"Volcanes, Terremotos, y Fondo del Océano","The words 'Volcanoes,' 'Earthquakes,' and 'Ocean Floor' are nouns and should be translated to the target language."
28,text-28-7,en,es,Casquetes de hielo y glaciares,"The words 'Icecaps' and 'Glaciers' are nouns and should be translated to the target language, Spanish, as they refer to natural geographical formations."
17,text-17-19,en,es,La corteza terrestre está dividida en una serie de secciones masivas llamadas placas.,The sentence includes a noun phrase 'plates' describing Earth's crust which needs to be translated accurately into Spanish.
17,text-17-18,en,es,La mayoría de los terremotos y erupciones volcánicas ocurren a lo largo de los bordes del Océano Pacífico (ver imagen abajo).,"The sentence identifies locations and a geographic feature called the 'Pacific Ocean,' which should be translated accurately into Spanish. Other parts of the sentence are straightforward to translate."
28,text-28-8,en,es,68.7%,The percentage symbol and numeric value should remain the same while the surrounding text would be translated if there was any.
27,text-27-6,en,es,Los humanos utilizan tanto el agua superficial como el agua subterránea.,"The sentence mentions humans, surface water, and groundwater. All these nouns should be translated into Spanish, maintaining the same meaning."
17,text-17-5,en,es,"En este capítulo, veremos los diferentes patrones que observamos en las características de la Tierra.","The phrase 'Earth's Features' refers to geophysical elements, so it should be translated to Spanish in the same way. The rest of the sentence should follow standard translation practices for converting English texts to Spanish."
28,text-28-9,en,es,Agua subterránea,"The term 'Ground Water' is a noun and should be translated to the target language, which is Spanish."
17,text-17-20,en,es,"Los movimientos de estas placas pueden explicar cambios notables en la Tierra, como terremotos, erupciones volcánicas y la formación de montañas.","In this sentence, the specific nouns such as 'Earth' and terms related to geology and plate tectonics need to be translated accurately to convey the proper meaning in Spanish."
27,text-27-5,en,es,mientras que al mismo tiempo el agua en el suelo llena continuamente los ríos a través de la filtración.,"To translate the sentence into Spanish, we need to ensure that all parts of the sentence maintain their meaning and structure in the target language."
28,text-28-10,en,es,30.1%,"The percentage symbol in the text should not be translated. The number should maintain the same format, but the word 'percent' is translated to the target language as 'por ciento'."
27,text-27-8,en,es,y alrededor de 79.3 mil millones de galones (300.2 mil millones de litros) de agua subterránea por día.,"The measurement units 'gallons' and 'liters' are included in the text, but the contextual words should be translated into Spanish. Ensure the numeric values and measurement units remain unaltered."
28,text-28-11,en,es,Otro,This is an English word 'Other' which needs to be translated into Spanish.
17,text-17-22,en,es,https://www.nationalgeographic.org/encyclopedia/ring-fire/,"The URL is an address, not a text that can be translated. URLs remain the same across languages as they are universal links."
27,text-27-7,en,es,"En los Estados Unidos en 2010, usamos alrededor de 275 mil millones de galones (1,041 mil millones de litros) de agua superficial por día.","When translating the text, units like 'gallons' and 'liters' are already in their Spanish form 'galones' and 'litros'. The numerical values should remain unchanged."
17,text-17-23,en,es,https://www.nationalgeographic.org/topics/resource-library-plate-tectonics/?q=&page=1&per_page=25,The input is a URL and URLs are universal identifiers that do not get translated between languages.
17,text-17-24,en,es,17,The input '17' is a numeral and should not be translated as it is universally understood as a number.
28,text-28-13,en,es,Agua Superficial,"The phrase 'Surface Water' is a noun and should be translated completely to the target language, Spanish."
28,text-28-12,en,es,0.9%,"The text '0.9%' is a numeric value followed by a percentage symbol. In Spanish, the percentage symbol and numeric values remain the same."
27,text-27-9,en,es,"Aunque el agua superficial se utiliza más a menudo para abastecer agua potable y regar cultivos,",Surface water and related terms are translated directly to their Spanish equivalents without altering meaning. The phrase structure is maintained to ensure clarity and consistency in the translation.
27,text-27-12,en,es,27,The input '27' is a numeral and numerals are typically the same across languages and do not need translation.
27,text-27-11,en,es,como en las ciudades desérticas del oeste de los Estados Unidos.,"The sentence describes a specific geographical location and the term 'western United States' is a proper noun and should be translated correctly into Spanish, maintaining its meaning."
17,text-17-21,en,es,Esta sección está adaptada de la información en:,"The provided text is an indication of source information, and should be translated fully into Spanish."
28,text-28-17,en,es,Pantanos,'Swamps' is a noun and should be translated to the target language.
28,text-28-14,en,es,0.3%,The percentage value '0.3%' is a numerical representation and should not be translated but remain the same in the translation.
28,text-28-16,en,es,87%,The percentage symbol '%' is not a language-specific symbol and should remain the same in the translation.
28,text-28-19,en,es,Ríos,The word 'Rivers' is a noun and should be translated to the target language.
28,text-28-20,en,es,2%,"Percentage symbols should not be translated, but percentages usually read as 'por ciento' in Spanish."
28,text-28-23,en,es,Preguntas de enfoque,Both words 'Focus' and 'Questions' are nouns and need to be directly translated into Spanish.
28,text-28-24,en,es,1. Enumera tres lugares donde se encuentra agua dulce en la Tierra.,'Freshwater' is a noun that refers to a category of water resources; the locations listed should also be translated into the target language for accuracy.
26,text-26-0,en,es,Aquí hay un gráfico que muestra la distribución del agua en la Tierra.,"The phrase 'Here is a chart showing the distribution of water on Earth' needs to be translated into Spanish, focusing on accurate translation of nouns and maintaining the general meaning of the sentence."
17,text-17-4,en,es,(ESS2.B),The references such as 'ESS2.B' are typically used as identifiers and should be kept intact without translation.
28,text-28-26,en,es,28,"The text '28' consists of a numeric value that does not change in translation. The context of the number will determine if it should be translated differently, such as a date or ordinal number, but without further context, '28' remains '28'."
28,text-28-25,en,es,¿Qué recursos hídricos contribuyen al agua superficial de la Tierra?,"To translate this question into Spanish, we need to consider the translation of subject-specific terms such as 'water resources' and 'surface water'. 'Water resources' translates to 'recursos hídricos', and 'Earth's surface water' translates to 'agua superficial de la Tierra'. It is important to maintain the meaning and context of the question."
28,text-28-15,en,es,Lagos,"The word 'Lakes' is a noun and should be translated to the target language, Spanish."
28,text-28-21,en,es,"La mayor parte del agua en la Tierra es agua salada (97%), y sólo una pequeña parte es agua dulce (3%).","The sentence contains information about water distribution on Earth, distinguishing between saltwater and freshwater. Both 'saltwater' and 'freshwater' are common nouns that require translation into Spanish, and the percentages remain numeric."
28,text-28-22,en,es,"Imagen de Mariana Ruiz Villarreal (LadyofHats) para la Fundación CK-12, CC BY-NC 3.0","The text contains a proper noun, the author's name, and an organization. These should be translated accordingly. The licensing information (CC BY-NC 3.0) should remain unchanged as it is a license code."
26,text-26-7,en,es,Océanos 96.5%,"The text contains a percentage that indicates a portion related to oceans. The word 'oceans' should be translated into Spanish as 'océanos', while the percentage remains unchanged as it is a numeral value."
26,text-26-4,en,es,Los ríos constituyen el 0.49% del agua dulce superficial.,"The sentence is providing a percentage related to rivers, which we need to translate to Spanish, ensuring the meaning remains the same."
26,text-26-3,en,es,• La columna derecha muestra la descomposición del agua dulce superficial. La mayor parte del agua dulce superficial se encuentra en hielo y otro 20.9% se encuentra en lagos.,"To translate the text accurately, identify key elements such as nouns and figures. Translate 'right column', 'breakdown', 'surface freshwater', 'ice', and 'lakes' to Spanish, and maintain the percentage figure as it is."
26,text-26-8,en,es,Agua dulce 2.5%,The phrase 'Freshwater' is a noun and should be translated to the target language. The percentage is a numerical value and remains the same.
26,text-26-11,en,es,Agua subterránea 30.1%,'Groundwater' is a noun and should be translated to the target language. Percentages are simply units and should be presented in the same manner.
26,text-26-10,en,es,Glaciares y casquetes polares 68.7%,"The phrase 'Glaciers and ice caps' refers to large bodies of ice and should be translated accordingly, while the percentage remains the same as it is a numerical value."
26,text-26-2,en,es,"La columna del medio muestra la descomposición del agua dulce. Casi toda se encuentra en el hielo y en el suelo. Solo un poco más del 1.2% de toda el agua dulce es agua superficial, que proporciona la mayor parte de las necesidades de la vida.","The text describes the distribution of freshwater, stating that most is in ice and the ground, with a small percentage as surface water. Each component of the sentence should be translated carefully with accurate preservation of the proportions described."
26,text-26-12,en,es,Superficie/otros de agua dulce 1.2%,The text contains numerical data and percentages along with the term 'freshwater' which is a noun that should be translated to Spanish.
26,text-26-17,en,es,Ríos 0.49%,"The word 'Rivers' is a noun and should be translated to the target language, while the numerical and percentage information remains unchanged."
26,text-26-9,en,es,Otra solución salina 0.9%,"Words like 'Other', 'saline' and 'water' should be translated into Spanish, while the percentage '0.9%' should remain the same."
26,text-26-15,en,es,Humedad del suelo 3.8%,"The term 'soil moisture' refers to the amount of water contained in the soil, which is a noun and should be translated. The numeric value and percentage symbol are consistent between languages and do not require translation."
26,text-26-14,en,es,Lagos 20.9%,"The word 'Lakes' should be translated as it is a noun, and the percentage should remain unchanged because it is numerical data."
26,text-26-1,en,es,"• En la primera columna, observe que el 2.5% del agua de la Tierra es agua dulce, la cantidad necesaria para que la vida sobreviva.",The sentence provides information about Earth's water distribution and mentions a percentage which should remain unchanged. The term 'Earth's water' can be translated directly to 'el agua de la Tierra'.
26,text-26-19,en,es,Atmósfera 3.0%,The term 'Atmosphere' is a noun and should be translated into Spanish. The percentage does not need any translation.
26,text-26-20,en,es,Total de agua global,"The phrase 'Total global water' is about the entirety of water available globally, where 'water' is a noun that should be translated to Spanish as 'agua'."
26,text-26-16,en,es,"Pantanos, marismas 2.6%",The terms 'Swamps' and 'marshes' are nouns and should be translated into Spanish as 'Pantanos' and 'marismas'. The percentage symbol should remain the same as it is universally used.
26,text-26-18,en,es,Seres vivos 0.26%,"The phrase 'Living things' refers to nouns such as animals, plants, or organisms and should be translated to Spanish. The percentage number is a numeric value and should remain unchanged."
26,text-26-13,en,es,Hielo del suelo y permafrost 69.0%,"The phrase 'Ground ice and permafrost' describes natural phenomena that should be translated into the target language, while '69.0%' remains the same as it is a numerical value."
26,text-26-22,en,es,Agua superficial y otros tipos de agua dulce,The phrase 'Surface water and other freshwater' contains nouns that are common and should be translated to their Spanish equivalents. 'Surface water' is translated to 'agua superficial' and 'other freshwater' is translated to 'otros tipos de agua dulce'.
28,text-28-18,en,es,11%,The text '11%' is a percentage and should remain as is because numbers and symbols should not be translated.
26,text-26-28,en,es,26,The number '26' is universally understood as a numeral and does not require translation.
26,text-26-21,en,es,Agua dulce,"The word 'Freshwater' is a noun in English and should be translated to the equivalent noun in Spanish, which is 'Agua Dulce'."
26,text-26-26,en,es,"Alrededor del 71 por ciento de la superficie de la Tierra está cubierta por agua, y los océanos contienen alrededor del 96 por ciento de toda el agua de la Tierra.","The passage includes percentages and units of measurement which do not need to be translated, but the contextual text needs to be translated into Spanish. Additionally, the noun 'Earth' should be translated."
26,text-26-24,en,es,"¿Cuánta agua hay en, sobre y por encima de la Tierra?","The phrase is asking for the amount of water present on, in, and above Earth, all terms which can be translated directly into Spanish without any specific nuances that need to be considered."
26,text-26-6,en,es,¿Dónde está el agua de la Tierra?,The phrase 'Where is Earth’s Water?' needs to be translated entirely. The noun 'Earth' should also be translated to 'Tierra' in Spanish for an accurate translation.
26,text-26-23,en,es,"Fuente: capítulo de Igor Shiklomanov “Recursos de agua dulce en el mundo” en Peter H. Gleick (editor), 1993, Agua en crisis: Una guía de los recursos de agua dulce del mundo. (Los números están redondeados).","The text contains bibliographical information, including the name of a book, chapter, author, and editor. Nouns and titles should be translated into Spanish, retaining their original semantic content."
26,text-26-25,en,es,"La Tierra es un lugar acuoso. Pero, ¿cuánta agua existe en nuestro planeta?",The nouns 'Earth' and 'water' should be translated into Spanish as 'Tierra' and 'agua' respectively. The rest of the text is straightforward and should be translated directly.
26,text-26-5,en,es,"Aunque los ríos representan solo una pequeña cantidad de agua dulce, los ríos son la fuente de la mayor parte del agua utilizable.","To accurately translate this sentence, I need to convey the idea that rivers, despite being a small percentage of the freshwater supply, provide most of the water that can be utilized."
26,text-26-27,en,es,El agua también existe en la,"In this sentence, we are referring to 'Water', which is a noun and should be translated along with the structure of the sentence."
27,text-27-10,en,es,El agua subterránea es vital porque llena ríos y lagos y proporciona agua a las personas en lugares donde el agua escasea.,"To translate this sentence into Spanish accurately, I need to recognize that key nouns such as 'groundwater', 'rivers', and 'lakes' need translation. Additionally, the phrasing and meaning should remain consistent with the original text."
24,sectioneli5-24-0,en,es,"Imagina la Tierra como una gran bola de agua. La mayor parte del agua en esta bola es salada, como el océano. Solo una pequeña parte de esta agua es la que realmente podemos usar para beber y regar las plantas. Si tuvieras un gran vaso de agua, casi todo sería salado, y solo una pequeña gota sería el agua dulce que necesitamos. ¡Por eso tenemos que ser cuidadosos e inteligentes al usar nuestra agua dulce!","To accurately translate the given text into Spanish, we need to focus on translating nouns, verbs, and descriptive phrases, ensuring the context remains intact. We do not need to translate mathematical expressions or proper units, but none appear here."
10,sectioneli5-10-0,en,es,"El diseño de ingeniería es como construir y arreglar un juguete. Primero, averiguas qué está mal con el juguete o qué quieres que haga mejor. Luego piensas en muchas ideas geniales sobre cómo arreglarlo o mejorarlo, quizás hablando con tus amigos. Después de eso, eliges la mejor idea basada en lo que realmente puedes hacer. A continuación, construyes un modelo o una versión 'fingida' de tu juguete. Lo pruebas para ver qué tan bien funciona. Finalmente, lo mejoras si encuentras algún problema. Así es como los ingenieros hacen que las cosas funcionen mejor paso a paso.","The passage discusses the process of engineering design using an analogy with fixing a toy, describing each step in simple terms. It should be translated by considering the equivalent Spanish terminology for each concept while preserving the nuance and simplicity of the language."
11,sectioneli5-11-0,en,es,"¡Este libro es como un mapa de cosas geniales de ciencia! Habla sobre los sistemas de la Tierra, como los patrones y el agua, y cómo cosas como el viento pueden cambiar las rocas. También explica cosas diminutas que no podemos ver, cómo se mezclan diferentes cosas y cómo podemos mantener la naturaleza equilibrada. Finalmente, muestra cómo crecen las plantas, qué sucede cuando comemos y cómo todo se mueve y se mantiene conectado.","The text provided describes aspects of a science book, mentioning Earth's systems, natural phenomena like wind and rocks, and biological processes. I will translate each part into Spanish, ensuring the essence and meaning are preserved while keeping technical terms like 'systems' within context."
25,sectioneli5-25-1,en,es,"¡El agua en la Tierra está prácticamente en todas partes! Está en el aire y las nubes por encima de nosotros, que es como una gran piscina invisible en el cielo. También está en lugares que podemos ver, como ríos, océanos y hielo. Además, el agua está dentro de las plantas y los animales, e incluso en las profundidades de la Tierra. ¡Así que se podría decir que la Tierra es un lugar muy acuático!","The provided text describes the presence of water on Earth. Each element, like air, clouds, rivers, oceans, and ice, as well as concepts such as plants, animals, and Earth's interior, should be translated into Spanish while maintaining the structure of the text."
29,sectioneli5-29-0,en,es,"Tu tarea es dibujar un gráfico de barras. Este gráfico nos ayudará a comparar cuánta agua salada y dulce hay en la Tierra. Imagina dos rectángulos altos. Uno muestra toda el agua salada del océano, y el otro muestra la menor cantidad de agua dulce, como en ríos y lagos. ¡Es una forma divertida de ver la diferencia!",The task description involves instructions for drawing a bar graph. The purpose is to visualize the comparison between saltwater and freshwater amounts on Earth. The translation should ensure that all elements and concepts are preserved in Spanish.
17,sectioneli5-17-0,en,es,La Tierra tiene patrones especiales que podemos ver en su superficie. Los terremotos y volcanes a menudo ocurren en largas líneas donde la tierra se encuentra con el océano. Las grandes montañas se encuentran principalmente dentro de los continentes o cerca de sus bordes. Podemos usar mapas para ver estos patrones y entender dónde ocurren.,"The text describes geographical features and patterns observed on the Earth's surface, including the occurrence of earthquakes, volcanoes, and mountains, and it discusses using maps for better understanding. The translation should convey these ideas accurately in Spanish."
15,sectioneli5-15-0,en,es,"Imagina un camino alrededor de los bordes del Océano Pacífico que es muy especial porque tiene muchas montañas ardientes llamadas volcanes. Estos volcanes están activos, lo que significa que pueden erupcionar y lanzar lava caliente. Este camino especial se llama el ""Cinturón de Fuego"" porque tiene tantos volcanes, y a menudo se siente tembloroso debido a muchos pequeños movimientos de tierra llamados terremotos. ¡Es como si la Tierra estuviera haciendo un pequeño baile justo aquí!","The passage describes the 'Ring of Fire,' which requires translation into Spanish. The term 'Ring of Fire' is specific and often recognized in Spanish as 'Cinturón de Fuego.' All other elements in the passage, including the description of volcanoes and earthquakes, are translated accordingly."
20,sectioneli5-20-2,en,es,"Las líneas oscuras en el mapa muestran dónde se encuentran las piezas gigantes del rompecabezas de la Tierra, llamadas placas. Estos lugares son como los bordes de las piezas del rompecabezas. Cuando las placas se mueven, pueden chocar entre sí, deslizarse una junto a la otra, o separarse, y es a menudo cuando ocurren terremotos. Por lo tanto, estos lugares con líneas son donde pueden ocurrir muchos terremotos.","The passage describes geological features and processes which should be directly translated while maintaining the meaning. All nouns such as 'plates' and 'lines' are to be translated, and no mathematical or symbolic content is present."
21,sectioneli5-21-0,en,es,"¡Bien, pensemos en dos formas en que cambia la Tierra!

Primero, está la erosión. Imagina castillos de arena en la playa siendo lentamente arrastrados por las olas, eso es como la erosión. El viento y el agua mueven pequeños pedazos de roca y suelo de un lugar a otro, cambiando montañas y valles a lo largo de mucho tiempo.

Segundo, piensa en los terremotos. Si alguna vez has apilado bloques y luego la mesa tiembla, los bloques pueden caer o moverse. ¡Los terremotos le hacen esto al suelo! Suceden cuando partes de la corteza terrestre se mueven repentinamente, cambiando el paisaje al instante.

Así que, la erosión ocurre lentamente y los terremotos pueden cambiar las cosas muy rápido.","The text is about natural processes, such as erosion and earthquakes, and their effects on Earth's landscape. This needs to be translated into Spanish while retaining the clarity and explanatory nature of the description."
23,sectioneli5-23-1,en,es,"La mayor parte del agua de la Tierra es salada, como la que se encuentra en el océano, y no sirve para beber. Solo una pequeña cantidad es dulce, como en lagos y ríos. Así que nos hace pensar en cómo usamos y ahorramos el agua que podemos beber. ¿Por qué crees que es importante saber esto? ¿Tienes curiosidad sobre cómo obtenemos agua dulce de toda esa agua salada?","The text contains information about the composition of Earth's water sources and a question regarding the importance of understanding where fresh water comes from. It should be translated accurately to retain the same meaning in Spanish, ensuring that key details like 'ocean,' 'fresh,' and 'saltwater' are translated appropriately."
15,sectioneli5-15-1,en,es,"En una parte del Océano Pacífico, hay un camino especial llamado el ""Anillo de Fuego"". Tiene muchos volcanes que son muy activos y sacuden el suelo con terremotos. La imagen con puntos muestra dónde están estos volcanes. ¡Es como un cinturón ardiente alrededor de esta parte del mundo! Esto nos hace pensar por qué hay tantos volcanes y qué los hace retumbar y gruñir tanto.","The provided text contains geographical terms, where 'Ring of Fire' is a proper noun and should be kept as is in the translation. The description needs to be accurately translated into Spanish while maintaining the context."
10,sectioneli5-10-1,en,es,"En ingeniería, existen reglas llamadas estándares que ayudan a que las cosas funcionen bien. Hay dos aspectos principales en los que se centran estas reglas:

1. **Diseño**: Esto es como dibujar un plan para un juguete nuevo al primero determinar qué debería hacer el juguete (como rebotar alto). Luego, piensas en muchas maneras de fabricarlo, pruebas la mejor opción y la mejoras aún más.

2. **Evaluación**: Esto es como tener un montón de juguetes diferentes ya hechos, y tienes que elegir el mejor. Verificas si todos hacen lo que se supone que deben hacer y eliges el mejor basado en esas reglas.

¡Estos pasos ayudan a los ingenieros a crear y mejorar cosas de manera inteligente!","The provided text discusses engineering standards, with emphasis on designing and evaluating processes. The translation should accurately convey these concepts and the comparison to toy design, ensuring that any technical or illustrative aspects are maintained in Spanish."
