page_index,id,origin_language_code,language_code,text,reasoning
18,text-18-5,en,es,Las placas también pueden alejarse unas de otras dentro de un continente.,"In this sentence, 'Plates' refers to tectonic plates on a continent. The sentence states that these plates can move away from each other. The key terms to translate are 'Plates', 'move away', and 'continent'. The concept should maintain its meaning in the context of geology."
11,text-11-0,en,es,Tabla de contenidos,"The phrase 'Table of Contents' is a common English phrase referring to a section at the beginning of a book or document that lists the chapters or sections with their respective page numbers. In Spanish, this phrase is typically translated to maintain the same meaning."
11,text-11-2,en,es,13,The text '13' is a number and should remain unchanged in translation.
18,text-18-7,en,es,"Cuando esto ocurre, la corteza se adelgaza, se rompe y luego se divide.","Each part of the sentence should be translated into Spanish while maintaining the original structure: 'When this happens' translates to 'Cuando esto ocurre', 'the crust thins' to 'la corteza se adelgaza', 'breaks, and then splits apart' to 'se rompe y luego se divide'."
11,text-11-1,en,es,CAPÍTULO 1-Sistemas de la Tierra,"The phrase 'CHAPTER 1-Earth’s Systems' includes a title and a possessive noun that should be translated into Spanish. 'CHAPTER 1' translates to 'CAPÍTULO 1', and 'Earth’s Systems' is translated to 'Sistemas de la Tierra'."
18,text-18-10,en,es,Los terremotos pueden causar cambios repentinos que alteran dramáticamente el paisaje de la Tierra.,"The sentence discusses the impact of earthquakes, which is a noun, on the Earth's landscape. Both the term 'earthquake' and 'Earth' are nouns in this context and should be translated accurately into Spanish."
11,text-11-4,en,es,15,"Since '15' is a number, it should appear the same in the Spanish translation."
18,text-18-12,en,es,"Las porciones de la corteza terrestre se mueven, creando ondas.","The text refers to a geological process involving Earth's crust, which should be translated into Spanish as it describes a scientific concept."
18,text-18-11,en,es,"Tremendas fuerzas bajo la superficie de la Tierra acumulan presión, que se libera en ondas a lo largo de una falla.","The sentence contains a scientific description of geological phenomena, specifically referring to forces and processes related to faults. All the words in the sentence are nouns and verbs that should be translated into Spanish."
11,text-11-8,en,es,31,The number '31' is a numerical value and does not need translation.
11,text-11-3,en,es,Patrones en las características de la Tierra (5.1.1),"The title 'Patterns in Earth’s Features' refers to a general description of patterns related to geological characteristics of the Earth. The addition '(5.1.1)' is likely to be a course or section code and should not be translated. Therefore, only the actual noun-based title 'Patterns in Earth’s Features' should be translated."
11,text-11-7,en,es,1.3 Meteorización y Erosión (5.1.3),The phrase 'Weathering and Erosion' is a noun phrase and should be translated entirely to Spanish as they are common processes studied in geology.
11,text-11-5,en,es,1.2 Agua de la Tierra (5.1.2),"The phrase 'Earth’s Water' is referring to a noun, specifically it is indicating the water found on the planet Earth, and should be translated accordingly, while 1.2 and (5.1.2) are section numbers and should remain unchanged."
18,text-18-15,en,es,"En un terremoto, las ondas internas son responsables de los golpes bruscos.",The sentence describes the role of body waves in earthquakes and should be translated while preserving the meaning and context.
18,text-18-13,en,es,Algunas de las ondas son ondas superficiales porque viajan a lo largo de la superficie de la Tierra.,"To accurately translate this sentence, we need to understand that 'surface waves' and 'Earth' are specific nouns referring to a type of wave and the planet respectively, and should be translated into their Spanish equivalents. Thus, 'surface waves' becomes 'ondas superficiales' and 'Earth' becomes 'Tierra'."
18,text-18-16,en,es,Las ondas superficiales son responsables de la,"The phrase does not contain any mathematical symbols or units, hence, it can be directly translated into Spanish by converting each word into its equivalent in the target language."
11,text-11-6,en,es,23,The text '23' is a number and does not require translation.
18,text-18-14,en,es,"Otras ondas, llamadas ondas de cuerpo, viajan a través del interior de la Tierra.","The phrase 'body waves' refers to a specific type of wave in geology, so it should be translated directly into Spanish as 'ondas de cuerpo'. The word 'Earth' should be translated with its noun form 'la Tierra'."
18,text-18-9,en,es,"Los terremotos son ondas de energía que atraviesan la Tierra causadas por un desplazamiento repentino de las placas tectónicas a lo largo de las líneas de falla, una larga grieta en la superficie de la Tierra.","To ensure accurate translation of the sentence about earthquakes, I must translate all descriptive and explanatory elements while keeping the scientific terminology intact and recognizing proper nouns."
18,text-18-18,en,es,18,The number '18' should remain unchanged as it is a numerical value.
11,text-11-11,en,es,1.5 Impacto en los Humanos (5.1.5),The phrase 'Impact on Humans' contains nouns and should be translated into Spanish while keeping its context accurate.
11,text-11-9,en,es,1.4 Interacciones entre Sistemas (5.1.4),"The section title 'Interactions between Systems' is a general phrase that describes a topic without specific technical terms, so it can be directly translated into Spanish."
11,text-11-13,en,es,CAPÍTULO 2-Propiedades y Cambios en la Materia,The text 'CHAPTER 2-Properties and Changes in Matter' should be translated in its entirety as it consists of a title with nouns that should be translated to Spanish.
11,text-11-14,en,es,57,The number '57' is a numeral and should not be translated as it represents a quantity.
18,text-18-17,en,es,"Cinturón de Fuego del Pacífico por Gringer, https://en.wikipedia.org/wiki/File:Pacific_Ring_of_Fire.svg, dominio público","The sentence contains a proper noun 'Pacific Ring of Fire' which should be directly translated into Spanish while keeping the importance of its geophysical significance intact. Additionally, the associated author's name 'Gringer' and the URL should remain unchanged. The term 'public domain' is a common term that can be adequately translated into Spanish to convey the same meaning."
11,text-11-12,en,es,49,The number does not need translation as it's the same in Spanish.
11,text-11-16,en,es,59,The number '59' does not need translation as it is a numeric figure.
11,text-11-10,en,es,41,The number 41 does not require translation as numbers are universal.
11,text-11-15,en,es,Demasiado pequeño para ver,"The text 'Too Small to See' needs to be translated into Spanish. It is a statement and does not contain any units or math symbols that would need to be left as is. Therefore, it should be fully translated."
11,text-11-18,en,es,67,The number '67' is a numeral and does not change with translation.
11,text-11-17,en,es,2.2 Identificación de Sustancias (5.2.2),"This text includes a header indicating a section title. It includes numeric identifiers and should be translated entirely, maintaining the format of section titles."
23,text-23-1,en,es,Fenómeno,"The word 'Phenomenon' is a noun and should be translated to the target language, which is Spanish."
11,text-11-20,en,es,73,The number '73' is not a language-specific term and does not need to be translated.
11,text-11-22,en,es,79,The number '79' is a numeral and should not be translated.
11,text-11-21,en,es,2.4 Conservación de la Materia (5.2.4),The phrase 'Conservation of Matter' is a scientific term and should be translated accurately into Spanish. The numerical identifiers should not be translated.
11,text-11-24,en,es,85,The number '85' is a numerical value and does not need translation.
23,text-23-3,en,es,Agua salada y agua dulce,The terms 'Saltwater and freshwater' consist of nouns that should be translated into Spanish.
23,text-23-0,en,es,1.2 Agua de la Tierra (5.1.2),"The title 'Earth’s Water' should be translated into Spanish as it is a noun, but numerical values such as '1.2' and '5.1.2' should remain unchanged because they are section identifiers."
11,text-11-19,en,es,2.3 Combinando Sustancias (5.2.3),"The text consists of a title with a numeric value, which should be converted to the same value in the target language, except for the numbers and the section code which remain unchanged."
23,text-23-4,en,es,Agua Total en la Tierra,"The phrase 'Total Water on Earth' refers to a noun, specifically the quantity of all water present on the planet, and should be translated appropriately into Spanish."
11,text-11-23,en,es,CAPÍTULO 3 - Ciclo de la Materia en los Sistemas de la Tierra,The provided text is a title indicating a chapter of a book. The nouns and context should be fully translated to convey the meaning of the chapter title in Spanish.
11,text-11-26,en,es,87,The text '87' is a number and should not be translated as it is a numeral.
23,text-23-5,en,es,97%,The percentage symbol and numbers should remain unchanged as they are standard mathematical notations.
23,text-23-2,en,es,"La mayoría del agua que se encuentra en la Tierra es agua salada, no agua dulce.","To translate the text accurately, it is important to identify that 'water', 'saltwater', and 'freshwater' are nouns that need to be translated into the target language."
11,text-11-25,en,es,3.1 Plantas de Construcción (5.3.1),The text 'Building Plants (5.3.1)' is a title and consists of nouns that should be translated. The number '5.3.1' remains unchanged as it is a reference or section number.
23,text-23-7,en,es,3%,"The percentage symbol '%' should not be translated, it should remain the same in Spanish."
10,text-10-11,en,es,"Si el estándar incluye la idea de diseñar, entonces el proceso de diseño contendrá componentes de definición del problema (junto con la identificación de los criterios y restricciones), desarrollando muchas soluciones posibles, y optimizando una solución (por ejemplo, determinando la mejor solución para la situación basada en los criterios y restricciones, probando la solución, refinando la solución).","To accurately translate the text, it's important to maintain the technical terms related to the design process, such as 'defining the problem,' 'criteria and constraints,' 'developing solutions,' and 'optimizing a solution.' These concepts are crucial to the context of the text and must be preserved in the translation."
23,text-23-6,en,es,agua salina (océanos),"The phrase 'saline water (oceans)' contains a noun which refers to ocean water, and should be translated into Spanish with the appropriate term for 'saline water' and 'oceans'."
11,text-11-28,en,es,95,The number '95' is a numeral and does not change with language translation. Numerals should be kept the same when translating.
11,text-11-29,en,es,Movimiento de la materia (5.3.3),The title 'Movement of Matter' refers to a subject and should be translated into Spanish as well.
25,text-25-0,en,es,5.1.2 Agua de la Tierra,"The phrase 'Earth's Water' should be translated into Spanish, with 'Earth' translated as 'Tierra' and 'Water' translated as 'Agua'."
23,text-23-9,en,es,Casquetes polares y glaciares 68.7%,"The text provided consists of nouns and a numeric value with a percentage sign. The nouns 'Icecaps' and 'Glaciers' should be translated into the target language, which is Spanish, while the numeric value and the percentage sign remain unchanged."
11,text-11-27,en,es,3.2 Consumiendo Alimentos (5.3.2),"The phrase 'Consuming Food' is a general phrase that needs to be accurately translated to communicate the idea of eating, while the numbers in '3.2' and '5.3.2' are likely referencing sections or chapters and should remain unchanged."
23,text-23-8,en,es,Agua dulce,The term 'Fresh water' is a noun and should be translated to Spanish. The appropriate translation is 'agua dulce'.
11,text-11-32,en,es,109,This is a numerical value that does not change when translating languages.
11,text-11-30,en,es,101,"The text '101' is a number, and numbers typically remain the same across different languages. Therefore, there is no need for translation."
23,text-23-10,en,es,Agua subterránea 30.1%,'Ground Water' is a noun phrase that should be translated to Spanish as 'Agua subterránea'. The percentage '30.1%' remains unchanged as it is a numerical value.
11,text-11-31,en,es,3.4 Conservación de recursos (5.3.4),'Conserving Resources' is a phrase that should be translated as it is relevant to the context of sustainability.
25,text-25-1,en,es,Usar las matemáticas y el pensamiento computacional para comparar la cantidad de agua salada y agua dulce en varios reservorios para proporcionar evidencia de la distribución del agua en la Tierra.,The task is to translate the provided English text into Spanish while maintaining the original meaning and context.
23,text-23-11,en,es,Otros 0.9%,"The text is a string that contains a numerical percentage, which should be kept as is. The word 'Other' is an English noun and should be translated to Spanish."
11,text-11-33,en,es,11,The number '11' is a numeral and should not be translated into Spanish; it remains the same.
23,text-23-13,en,es,87% Lagos,The percentage symbol and the word 'Lakes' need to be translated into Spanish while maintaining the numerical and symbol formatting.
23,text-23-12,en,es,Agua superficial,The phrase 'Surface Water' consists of two words: 'Surface' and 'Water'. Both are nouns and should be translated to their Spanish equivalents.
25,text-25-2,en,es,"Enfatizar reservorios como océanos, lagos, ríos, glaciares, aguas subterráneas y casquetes polares.","To translate the given sentence accurately, it's important to recognize specific geographical features such as 'oceans,' 'lakes,' 'rivers,' 'glaciers,' 'groundwater,' and 'polar ice caps,' which are common geographical terms and should be translated to their equivalent Spanish words."
23,text-23-14,en,es,11% Pantanos,The word 'Swamps' is a noun and should be translated to the target language.
25,text-25-3,en,es,"Los ejemplos de usar matemáticas y pensamiento computacional podrían incluir medir, estimar, graficar o encontrar porcentajes de cantidades.","The text discusses examples of using mathematics and computational thinking, which all need to be translated into Spanish appropriately. All the key concepts such as measuring, estimating, graphing, and finding percentages of quantities should be accurately represented in Spanish."
23,text-23-15,en,es,2% Ríos,"The phrase contains a percentage and a noun 'Rivers'. The percentage and noun should be translated into the target language, Spanish."
25,text-25-6,en,es,¿Dónde está el agua de la Tierra?,"The text is asking about the location of Earth's water, and every word here needs to be translated literally to Spanish."
25,text-25-4,en,es,(ESS2.C),"The text '(ESS2.C)' appears to be a code or label, possibly related to a scientific standard or classification system. Such codes are typically not language specific and should be kept as is in the translation."
25,text-25-5,en,es,"En esta sección, concéntrese en comparar la cantidad de agua salada con el agua dulce que se encuentra en la Tierra.","The task is to translate the provided English text into Spanish. The key nouns and concepts involve the comparison of 'saltwater' and 'freshwater', and an Earth context. These should be accurately represented in Spanish as 'agua salada', 'agua dulce', and 'la Tierra'."
23,text-23-16,en,es,"La mayor parte del agua en la Tierra es agua salada (97%), y solo una pequeña parte es agua dulce (3%).","This text describes the distribution of water on Earth, mentioning both 'saltwater' and 'freshwater.' These are key terms that need to be translated accurately to maintain the meaning in the context of Earth's hydrosphere."
25,text-25-8,en,es,"sobre la Tierra en el aire y las nubes (atmósfera),","The phrase describes a location related to Earth's atmosphere, which needs to be translated accurately into the target language, ensuring all nouns and contextual elements are properly translated."
25,text-25-7,en,es,El agua de la Tierra está (casi) en todas partes.,"The phrase 'Earth's water is (almost) everywhere' involves a simple translation from English to Spanish. The key term here is 'Earth,' which is a proper noun and should be translated into 'Tierra' in Spanish. The rest of the sentence can be translated word for word."
25,text-25-10,en,es,"plantas, en organismos vivos (biosfera),","The phrase 'plants, in living organisms (biosphere),' is a phrase identifying plants as part of the biosphere, which is comprised of living organisms. This should be translated maintaining the context and meaning."
17,text-17-0,en,es,5.1.1 Patrones en las características de la Tierra,"The text is a title referring to patterns in Earth's features. All parts, including 'Earth', should be translated into Spanish as they are nouns that have Spanish equivalents."
23,text-23-19,en,es,1. ¿Qué estás observando acerca de este fenómeno?,The question 'What are you observing about this phenomenon?' should be translated into Spanish while maintaining its inquisitive context. It is a complete question that requires a direct translation without losing the intent.
23,text-23-17,en,es,"Imagen de Mariana Ruiz Villarreal (LadyofHats) para la Fundación CK-12, CC BY-NC 3.0",The text provided is a credit line for an image created by Mariana Ruiz Villarreal (LadyofHats) and includes a licensing detail. The important elements to translate are nouns and any descriptive text while preserving names and licensing codes as they are universally recognized in English.
25,text-25-12,en,es,25,"The text '25' is a numerical value and does not require translation. Therefore, it is directly used as is in Spanish."
25,text-25-9,en,es,"en la superficie de la Tierra en ríos, océanos, hielo (hidrosfera)","The sentence contains geographical and scientific terms related to Earth's features, like 'rivers', 'oceans', 'ice', and 'hydrosphere', which should be translated accurately to convey the correct meaning in Spanish."
17,text-17-1,en,es,Analizar e interpretar datos para describir patrones de las características de la Tierra.,"To provide an accurate translation, I need to consider the meaning and context of each word in the text. The phrase ""Analyze and interpret data to describe patterns of Earth's features"" requires translating the verbs, nouns, and the possessive form accurately into Spanish."
23,text-23-20,en,es,2. ¿Qué te preguntas sobre este fenómeno?,"The sentence is straightforward and there are no special considerations such as names, units, or math symbols in this case. It should be fully translated into the target language."
25,text-25-11,en,es,y dentro de la Tierra (geosfera).,"The sentence contains the noun 'Earth' and the noun 'geosphere.' Both should be translated to their Spanish equivalents: 'Tierra' and 'geosfera', respectively."
23,text-23-21,en,es,23,The number '23' is not a word or phrase that requires translation; it remains the same in Spanish.
23,text-23-18,en,es,Observaciones y reflexiones,The phrase 'Observations & Wonderings' consists of nouns that should be translated to Spanish while keeping their sense intact.
17,text-17-2,en,es,"La mayoría de los terremotos y volcanes ocurren en bandas que a menudo se encuentran a lo largo de los límites entre continentes y océanos, mientras que las principales cadenas montañosas pueden encontrarse dentro de los continentes o cerca de sus bordes.","To accurately translate the provided text into Spanish, it is important to maintain the integrity of geographical terms such as 'earthquakes', 'volcanoes', 'continents', 'oceans', and 'mountain chains'. These terms have direct equivalents in Spanish and should be translated accordingly. Additionally, the structure of the sentence should be preserved to convey the same meaning in Spanish."
17,text-17-3,en,es,"Ejemplos de datos podrían incluir mapas que muestren las ubicaciones de montañas en los continentes y el fondo oceánico, o las ubicaciones de volcanes y terremotos.","This sentence includes a description of types of data, referring to geographic and geological features, which should be translated into Spanish."
17,text-17-10,en,es,Más de la mitad de la superficie de la Tierra está compuesta de roca volcánica.,"The sentence describes a fact about Earth's surface composition, mentioning 'volcanic rock' as a noun that needs to be translated accurately to Spanish."
28,text-28-0,en,es,Juntándolo Todo,"The phrase 'Putting It Together' can be translated directly into Spanish, maintaining the general meaning of combining elements or assembling parts."
28,text-28-1,en,es,Agua salada y agua dulce,"The text consists of English nouns 'Saltwater' and 'freshwater', which should be translated into Spanish nouns for an accurate translation."
17,text-17-9,en,es,Los volcanes cambian la superficie de la Tierra en un corto período de tiempo.,The sentence is stating a fact about how volcanoes affect the Earth's surface and needs to be translated into Spanish.
17,text-17-8,en,es,"Los volcanes son aberturas en la corteza terrestre que permiten que la roca caliente y derretida (magma), cenizas y gases erupcionen hacia afuera.","The sentence describes what volcanoes are, and all the components mentioned such as 'openings', 'crust', 'rock', 'magma', 'ash', and 'gases' are nouns that need to be translated into Spanish. The overall context is about natural phenomena."
17,text-17-7,en,es,Volcanes,The word 'Volcanoes' is a noun and should be translated to the target language.
17,text-17-12,en,es,¿Sabes cómo se forma un volcán?,The sentence is asking about the formation of a volcano. All words can be directly translated into Spanish.
28,text-28-2,en,es,Agua total en la Tierra,The phrase 'Total Water on Earth' can be translated directly as it refers to the entire quantity of water present on the planet.
17,text-17-13,en,es,"Muy por debajo de la superficie de la Tierra, las temperaturas son lo suficientemente altas como para derretir la roca.",The sentence describes a geological phenomenon where high temperatures melt rock below Earth's surface. The translation must capture both the geological context and the thermal conditions accurately in Spanish.
27,text-27-0,en,es,"aire (como vapor de agua), ríos y lagos, capas de hielo y glaciares, el suelo (como humedad del suelo y en acuíferos).","The words in the list are nouns and refer to different water sources and states, which need to be translated into Spanish."
28,text-28-3,en,es,97%,"The percentage symbol '%' is a universal symbol and should not be translated, but the text around it should be if necessary."
27,text-27-1,en,es,Agua dulce,The word 'Freshwater' is a noun that describes water that is not salty and should be translated to the target language.
28,text-28-4,en,es,Agua salina (océanos),The phrase includes the noun 'Saline water' with an additional specification in parenthesis 'oceans'. These should be translated accurately into Spanish.
17,text-17-15,en,es,Algunas erupciones derraman ríos de lava mientras que otros volcanes tienen erupciones más grandes.,"The sentence describes different types of volcanic eruptions, and both 'eruptions' and 'volcanoes' are nouns that need to be accurately translated into Spanish."
27,text-27-2,en,es,"Aunque solo puedas notar agua en la superficie de la Tierra, hay más agua dulce almacenada en el suelo que en forma líquida en la superficie.","When translating this sentence into Spanish, it is important to maintain the informational context. The concepts of Earth's surface, freshwater, ground, and liquid form are straightforward to translate."
28,text-28-5,en,es,3%,"Percentage symbols should not be altered during translation, and the numerical value remains the same in Spanish."
27,text-27-4,en,es,El agua de la precipitación se filtra continuamente en el suelo para llenar los acuíferos (reservorios subterráneos).,The sentence describes a natural process and includes terms that need to be translated into Spanish.
17,text-17-16,en,es,"Los volcanes pueden entrar en erupción bajo el agua, formando enormes cadenas de montañas volcánicas en el fondo del océano.","The sentence describes volcanoes, which are a type of geological feature. 'Volcanoes' and 'mountains' are nouns that should be translated into Spanish, as well as the actions associated with them, like 'erupt' and 'forming'. There are no math symbols or units in this sentence that should remain unchanged."
27,text-27-3,en,es,"De hecho, parte del agua que ves fluir en los ríos proviene del agua que se filtra en la superficie de la Tierra para convertirse en agua subterránea.",The sentence describes the natural water cycle involving rivers and groundwater. Every word and phrase must be checked to ensure accurate translation into Spanish.
17,text-17-17,en,es,Cinturón de Fuego del Pacífico.,"'Pacific Ring of Fire' is a proper name for a geographical area known for its volcanic activity and earthquakes, and in Spanish, the common translation for it is 'Cinturón de Fuego del Pacífico'."
17,text-17-14,en,es,"La roca fundida sale de las grietas en la corteza terrestre, resultando en un volcán.","The text describes a geological process involving 'melted rock', 'cracks', and 'volcano', all of which are nouns and should be translated accurately into Spanish."
