id,page_index,text_id,text,language_code,reasoning
easyread-text-10-18,10,text-10-18,Hoy es lunes.,es,I need to simplify this into an easily understandable statement that maintains the original meaning.
easyread-text-10-13,10,text-10-13,No hay texto para simplificar.,es,"The text contains a single letter 'E', which has no context or meaning on its own. Therefore, it's not possible to provide a simplified version of it."
easyread-text-10-16,10,text-10-16,"Estoy bien, ¡gracias!",es,"The text conveys a simple response to an inquiry about one's well-being, typically used in polite social exchanges."
easyread-text-10-8,10,text-10-8,¿Quién es él?,es,"The question is asking about the identity of a male person. To simplify, I will use familiar language and keep the sentence concise for children with cognitive and learning disabilities."
easyread-text-10-3,10,text-10-3,Estas son preguntas y respuestas que usamos mucho.,es,"The text is informing that there are some questions and answers that are frequently used. To simplify it for children, I should use familiar terms and make it direct."
easyread-text-10-6,10,text-10-6,¿Cómo te llamas?,es,"The input text is a simple question asking for a name in English. Since the target language is Spanish, I need to translate and simplify it into an easy-read question that retains the original context."
easyread-text-10-15,10,text-10-15,Uno es un número que representa una cantidad pequeña.,es,1 is a basic numerical value representing a small quantity.
easyread-text-10-9,10,text-10-9,C,es,"The text contains the letter 'C', which does not have any complex meaning or require simplification. For school children with cognitive and learning disabilities, we can provide this simple letter as it is and avoid any unnecessary complexity."
easyread-text-10-7,10,text-10-7,"Vamos a aprender sobre la letra B. Por ejemplo, ""B"" es para ""bola"" que es redonda y se usa para jugar.",es,"The text is about something related to the letter 'B' but without more context, it doesn't provide a lot of information. However, to simplify and create an example, I'll focus on a common object or name starting with 'B'."
easyread-text-10-4,10,text-10-4,Resuelve el reto: une las preguntas con las respuestas correctas.,es,"The task involves matching questions with correct answers, an activity that tests comprehension and understanding. It is usually quite simple and involves pairing related items."
easyread-text-10-10,10,text-10-10,¿Cómo está el clima?,es,The text is a simple everyday question asking about the weather.
easyread-text-10-17,10,text-10-17,El número 2 es fácil de entender. Representa la cantidad dos.,es,The number '2' is simple and doesn't need further explanation for school children.
easyread-text-10-20,10,text-10-20,Mi nombre es Peter.,es,This is a simple sentence introducing someone's name. I will translate it into Spanish keeping it straightforward and similar in structure.
easyread-text-10-19,10,text-10-19,El número es tres.,es,This is a simple question asking for the number 3. It does not need simplification as it is already in a form that is easy to understand.
easyread-text-10-5,10,text-10-5,No hay texto que simplificar porque solo es una letra.,es,"Since 'A' is a single letter and not a sentence or phrase, there is no text to simplify into easy-read Spanish. In this case, my response should acknowledge the lack of content to work with."
easyread-text-10-14,10,text-10-14,No puedo decir qué día es hoy porque soy un sistema inteligente que no sabe la fecha.,es,"I should provide an easy-read format for a given text, not actually answer questions about today's date."
easyread-text-10-11,10,text-10-11,La letra 'D' es una letra del abecedario.,es,The letter 'D' by itself does not provide enough context for me to simplify into an easy-read version.
easyread-text-10-2,10,text-10-2,"Para hablar bien inglés, es importante saber cómo responder preguntas.",es,"The text is explaining that to talk in English, you need to know how to reply when someone asks you something. This is a basic element of communication."
easyread-text-10-1,10,text-10-1,Dibuja los dos lugares que no están en el dibujo anterior.,es,"The original text is asking for a drawing task related to a 'graphic organizer.' It can be simplified by explaining the task in easier words, focusing on what action needs to be taken rather than implying the need to understand complex terms like 'graphic organizers.'"
easyread-text-10-21,10,text-10-21,Cuatro,es,"The given text is a number, which is '4'. This has no further context or complexity to simplify, other than stating it in words."
easyread-text-10-0,10,text-10-0,"Vivir en Uruguay significa disfrutar de hermosas playas, comer asados deliciosos y bailar tango. Las personas suelen ser amables y el país es tranquilo.",es,"The text provided is a vague or undefined concept, but simplifying content regarding living in a country would involve discussing basic daily activities, places, or aspects of life in that country in simple terms."
easyread-text-10-24,10,text-10-24,Él es Juan.,es,The original text introduces a person named John. My task is to maintain this simple concept using basic Spanish vocabulary accessible to children.
easyread-text-10-25,10,text-10-25,¡Buen trabajo!,es,The text is a form of praise for someone's achievement. It is important to use simple words that convey appreciation and positivity.
easyread-text-10-26,10,text-10-26,Habla con un amigo en clase.,es,"The sentence is asking to roleplay a dialogue with a classmate, which can be simplified to something more direct and specific for children."
easyread-text-10-28,10,text-10-28,Hola y bienvenido,es,The text is a general greeting saying hello and welcoming someone.
easyread-text-10-29,10,text-10-29,Doce,es,"The number 12 is a simple concept, often represented in counting and basic math. It doesn't need simplification as it's universally understood."
easyread-text-10-27,10,text-10-27,La primera parte de un libro o curso.,es,"The text ""UNIT 1"" refers to a section or a part in a book or a course which is usually labeled as 'unit' followed by a number. This means it is the first unit, typically indicating the starting chapter or introduction to the learning material."
easyread-text-10-23,10,text-10-23,cinco,es,"The number 5 is already simple and easy to understand for children, but I need to translate it into Spanish."
easyread-text-10-22,10,text-10-22,Está nublado y llueve.,es,I need to convey simple information about the weather using everyday language.
easyread-text-10-12,10,text-10-12,¿Cómo estás?,es,The phrase simply asks about the person's well-being in a familiar way.
easyread-text-11-18,11,text-11-18,hola,es,"The text 'hello' is a greeting in English, and the direct translation in Spanish is 'hola'. This is a simple and familiar word for most people, including those with cognitive and learning disabilities."
easyread-text-11-23,11,text-11-23,Yo,es,The text expresses a sense of individuality and self-identity.
easyread-text-11-13,11,text-11-13,Nico es una persona.,es,"The text provided 'Nico:' is incomplete and lacks context. However, I can infer that it might be referring to a person named Nico. In such a context, 'Nico:' could be part of a dialogue or piece of text where someone, possibly Nico, is going to say something or the text is going to provide information about Nico. Without additional information or a complete sentence, creating a simplified version is not feasible, but I can provide a potential start for a sentence involving Nico."
easyread-text-11-22,11,text-11-22,ella,es,The text refers to a female person using the pronoun 'she'.
easyread-text-11-2,11,text-11-2,"Estoy bien, ¿y tú?",es,The sentence is a simple greeting exchange where someone is responding positively to a question about their well-being and then inquiring about the other person's well-being.
easyread-text-11-0,11,text-11-0,Cuando conoces a una persona.,es,The text is about a simple action of meeting someone. My task is to turn it into an easy-read text for children in Spanish.
easyread-text-11-15,11,text-11-15,¿Es esta una niña pequeña?,es,The text is asking to identify if someone is a little girl. The sentence is simple and refers to a young female child.
easyread-text-11-20,11,text-11-20,¿Quién?,es,The question 'who' is asking for a person or a group of people. It does not need simplification because it is already a single word.​
easyread-text-11-19,11,text-11-19,Muy bien,es,"The text is expressing a positive sentiment, typically indicating a state of being good or okay."
easyread-text-11-3,11,text-11-3,Estoy muy bien. ¡Gracias!,es,"The text is a short response to an inquiry, expressing satisfaction or happiness. It's important to keep the friendly tone."
easyread-text-11-1,11,text-11-1,¡Hola! ¿Cómo estás?,es,The text is a simple greeting in English. No complex vocabulary or jargon present. I will translate it into very simple Spanish.
easyread-text-11-12,11,text-11-12,Es una pregunta.,es,"The text is asking a yes or no question without any specific context. So in this case, I'll just acknowledge that it's a question."
easyread-text-11-14,11,text-11-14,No hay texto proporcionado para simplificar.,es,"The input text is missing. Without the text, I cannot simplify it or provide an explanation."
easyread-text-11-4,11,text-11-4,Nico y su amigo Luis están en la puerta de la escuela.,es,The text is about two boys named Nico and Luis who are at the entrance of their school. Children with cognitive and learning disabilities will benefit from short and direct sentences.
easyread-text-11-24,11,text-11-24,tú,es,The text 'you' refers to the person being addressed. It's a simple reference and doesn't require much change for simplification.
easyread-text-11-16,11,text-11-16,Luis,es,"The original text is very short, mentioning only a person's name. Simplification for understanding doesn't apply here as there is no detailed information or context provided."
easyread-text-11-7,11,text-11-7,No hay texto para simplificar.,es,"This appears to be a placeholder text from the user indicating no specific content to simplify, which means no meaningful action is required under current instructions. Still, it should be addressed properly according to the derived action plan."
easyread-text-11-10,11,text-11-10,Luis es un niño.,es,I need to identify a possible context before simplifying given just the introduction 'Luis'. I'll assume it's asking about a person and keep the context open.
easyread-text-11-27,11,text-11-27,Unidad 1,es,"UNIT 1 may refer to the first section or chapter of a document or book. Since this needs more context to be simplified accurately for children, I will interpret it as just indicating the start of a section or lesson."
easyread-text-11-29,11,text-11-29,Trece,es,"The text given is a number, which does not require further simplification."
easyread-text-11-8,11,text-11-8,Nico es el nombre de una persona.,es,"The text likely refers to a person named Nico, but without additional context, it's unclear what specific information needs to be simplified."
easyread-text-11-9,11,text-11-9,¡Hola! ¿Cómo estás?,es,The goal is to simplify common greetings into an easy-to-understand format in Spanish.
easyread-text-11-21,11,text-11-21,Bueno,es,"The word 'good' is a simple and positive word. It is used to describe something pleasant, satisfactory, or of high quality."
easyread-text-11-11,11,text-11-11,"Estoy bien, gracias. ¿Cómo estás?",es,"The text is a simple question about someone's well-being, making it straightforward to translate and simplify into Spanish."
easyread-text-11-6,11,text-11-6,"No hay texto específico para simplificar. Por favor, proporciona más detalles o el texto completo que necesitas simplificar.",es,"The text was not provided, but I know to simplify any specific information by using simple and familiar terms to make it suitable for school children."
easyread-text-11-17,11,text-11-17,es mi hermana.,es,The sentence expresses a basic family relationship between the speaker and their sister.
easyread-text-11-5,11,text-11-5,Miren su charla y termínenla usando las palabras de la caja.,es,"The instruction asks to complete a conversation using words from a box. Simplifying this for children, it can be rephrased as an instruction to choose and write missing words in a chat."
easyread-text-11-26,11,text-11-26,Foto tomada por Aldo Rodriguez.,es,"The phrase indicates that the photo was taken by a person named Aldo Rodriguez, highlighting the photographer's credit."
easyread-text-11-28,11,text-11-28,Hola y bienvenidos,es,"The phrase is a simple greeting, welcoming someone to a place or event. It can be translated directly into Spanish using straightforward language."
easyread-text-11-25,11,text-11-25,Hoy es el primer día de clases; la maestra está llamando a los estudiantes por sus nombres.,es,The sentence describes the first day of school when the teacher checks who is present by calling each student's name.
easyread-text-12-0,12,text-12-0,Vivir en Uruguay es lindo porque es seguro y tranquilo. La gente disfruta de la vida sencilla.,es,"The text talks about living in Uruguay and its features such as safety and a slow pace of life, making it seem attractive to residents."
easyread-text-12-13,12,text-12-13,Luis dijo que está aquí.,es,Luis responded to a roll call indicating that he is present.
easyread-text-12-16,12,text-12-16,¿Fernando estás aquí?,es,"The text is calling a student named Fernando, possibly to take attendance or ask a question."
easyread-text-12-17,12,text-12-17,"¡Está ausente, maestro!",es,"The sentence is simple and straightforward, conveying that the person is not present."
easyread-text-12-18,12,text-12-18,"Mira a Nico, Lua y Emma y contesta sus preguntas.",es,"The text is instructing to pay attention to Nico, Lua, and Emma and respond to any questions they may have."
easyread-text-12-26,12,text-12-26,Hola y bienvenido,es,The sentence is a simple greeting welcoming someone.
easyread-text-12-15,12,text-12-15,¡Aquí!,es,"The text consists of Emma speaking and saying 'Here!'. Since this phrase is already simple, it translates directly to the equivalent Spanish phrase that is easy for children to understand."
easyread-text-12-6,12,text-12-6,Margarita es un nombre de persona.,es,"Margarita can refer to a person's name, a cocktail drink, or a type of flower. For school children, we must consider the context, but without more information, the most neutral simplification is a person's name."
easyread-text-12-4,12,text-12-4,La luna llena brilla en el cielo.,es,"I need to simplify the given text ""Lua"" for a school child who might have cognitive and learning disabilities. The term ""Lua"" can refer to the programming language or the moon in Portuguese. Without additional context, I would keep it simple and general, mentioning a full moon in a way that is easy for children to understand."
easyread-text-12-8,12,text-12-8,Ana,es,Name 'Ana' does not require transformation or simplification. It remains the same in Spanish as it stands as a proper noun.
easyread-text-12-10,12,text-12-10,Dora es una niña que vive muchas aventuras.,es,"The text is about Dora, presumably the character from a children's show. I will assume this and provide a simplified description that retains the character's gender and makes sense for children."
easyread-text-12-9,12,text-12-9,"Alma es una palabra que significa ""alma"" en español. Es lo que sentimos dentro de nosotros y nos hace ser quienes somos.",es,"I do not have context on what ""Alma"" refers to, so I will just simplify it to its basic meaning."
easyread-text-12-12,12,text-12-12,"Lo siento, no hay suficiente información para simplificar.",es,"The task requires simplifying the given text for easier comprehension by children, maintaining clarity and simplicity. It is important to provide a context or additional information if the text presented is too limited or vague without further reference."
easyread-text-12-1,12,text-12-1,Caja para pedir ayuda.,es,"The original text 'S.O.S. BOX' is a short phrase that may refer to a box intended for emergency use or help, but it needs more context. To make it understandable for children with cognitive and learning disabilities, we explain it as an item used when help is needed."
easyread-text-12-14,12,text-12-14,El maestro llama a Emma.,es,The text is simply a teacher calling on Emma.
easyread-text-12-3,12,text-12-3,Emma es un nombre.,es,"The text only contains the name 'Emma', which does not provide specific context or content to simplify."
easyread-text-12-2,12,text-12-2,Luis es un nombre de una persona.,es,"The text is about someone named Luis. There's no other information given, so it's very simple."
easyread-text-12-11,12,text-12-11,Benjamín es un nombre de niño.,es,"The name Benjamin is being referred to, and there might be more context needed, but the simplification focuses just on the name."
easyread-text-12-20,12,text-12-20,Tú,es,"The user wants the concept 'you' to be simplified. In Spanish, 'you' translates to 'tú' for informal settings or 'usted' for formal settings. For simplicity and commonality, I'll use 'tú'."
easyread-text-12-7,12,text-12-7,Fernando,es,"The original text is a name 'Fernando', which doesn't require simplification. It's appropriate for children because it is simply a name."
easyread-text-12-23,12,text-12-23,Mi color favorito es azul. ¿Cuál es tu color favorito?,es,The text is a simple question about favorite colors. It asks about the reader's favorite color. This concept is basic and straightforward.
easyread-text-12-19,12,text-12-19,Mi nombre es Emma. ¿Cuál es tu nombre?,es,The text is a simple introduction and question asking for someone's name. This is straightforward and requires direct translation to keep it simple.
easyread-text-12-24,12,text-12-24,Tú,es,The task is to simplify and make the text easier to understand for children with cognitive and learning disabilities. It should use simple words and structures in the Spanish language.
easyread-text-12-27,12,text-12-27,14,es,"The input text provided is a numerical value '14', which is a straightforward number requiring no simplification for comprehension. Additionally, numbers don't possess gender in language, so there are no gender concerns here."
easyread-text-12-5,12,text-12-5,Nico es un nombre corto y fácil de recordar.,es,"The text is simply a name 'Nico', which may refer to a person. The task is to provide an easy read version of the text, but since it's a name, there isn't a simplification beyond recognition or a playful rephrasing for children."
easyread-text-12-25,12,text-12-25,La primera parte de un libro o lección.,es,"I can focus on simplifying the text by clarifying what 'UNIT 1' might entail, as it could be referring to the first part of a book or lesson. Therefore, I should use simple words to explain it."
easyread-text-12-21,12,text-12-21,"Tengo la misma edad que una computadora, así que no tengo años.",es,"The text is a question about age, which is a simple concept that anyone can understand."
easyread-text-12-22,12,text-12-22,Tú,es,The provided text 'You' is a pronoun and doesn't have additional context or information. Simplifying the singular pronoun 'You' for clarity does not change its meaning.
easyread-text-13-25,13,text-13-25,Unidad 1,es,"The text does not contain any specific descriptions or sentences, it's just a title. Titles are typically simplified by retaining the original phrase, since they are usually concise and direct."
easyread-text-13-21,13,text-13-21,Voy a la escuela número 5.,es,"The text describes a student's school which is identified by a number. Keeping it simple for comprehension, we maintain the key information that they attend a school."
easyread-text-13-19,13,text-13-19,"Hola, me llamo Nico y mi apellido es Romero.",es,I need to keep the structure of introducing oneself by stating both their first and last names.
easyread-text-13-0,13,text-13-0,"Hablaste con Nico, Lua y Emma.",es,"The text is simple and states that you had a conversation with three individuals: Nico, Lua, and Emma. It contains familiar names and the structure is already in an active voice, so the simplification focuses on making it very clear and brief for understanding."
easyread-text-13-26,13,text-13-26,Hola y bienvenido,es,The text is a welcoming phrase that greets someone.
easyread-text-13-14,13,text-13-14,Me puedes llamar Em.,es,"The text is about a preferred name, 'Em'. Highlight that it's how someone wants to be called, in simple language."
easyread-text-13-18,13,text-13-18,Mi número favorito es el catorce.,es,"The sentence is simple, mentioning a favorite number. No complex terms or structures are present. The translation should reflect the same simplicity and clarity."
easyread-text-13-22,13,text-13-22,Mis papás ya no están juntos.,es,"The input sentence is simple and clear, but I can make it even more accessible by using familiar words that describe the situation in a direct way."
easyread-text-13-17,13,text-13-17,Mi color favorito es rosa.,es,The text states a preference for the color pink. This is a simple statement about a personal favorite. I should use simple language and keep the sentence short.
easyread-text-13-15,13,text-13-15,Llámame Em.,es,"The user simply asked to be called by a nickname, 'Em.' This text is already simple and doesn't require complex vocabulary or sentences. No changes or simplifications are needed for this request."
easyread-text-13-16,13,text-13-16,Mi cumpleaños es el 19 de octubre.,es,"The original text states the speaker's birthday. It needs to be simple, using familiar words relevant to indicating their special day."
easyread-text-13-24,13,text-13-24,Mi comida favorita es la pizza.,es,"The sentence is simple and uses common vocabulary. It has personal preference, not needing simplification."
easyread-text-13-7,13,text-13-7,Apodo,es,The text simply refers to a short or alternative name that people use instead of a longer or formal name. Children with cognitive and learning disabilities might be more familiar with everyday terms and the direct translation of 'nickname' in Spanish.
easyread-text-13-6,13,text-13-6,¿Cómo te llamas?,es,I will simplify the instruction to focus on asking someone for their name in Spanish in a straightforward way.
easyread-text-13-8,13,text-13-8,Cumpleaños,es,"The word 'Birthday' is simple and straightforward. It represents the day when someone was born, which is generally celebrated each year. The term does not have a complex meaning, so it does not require simplification beyond this explanation."
easyread-text-13-28,13,text-13-28,Vivir en Uruguay,es,"The text #livingUruguay1 suggests it may be referring to living in Uruguay, possibly an initiative or campaign related to that topic."
easyread-text-13-5,13,text-13-5,¡Hola!,es,"The text is supposed to be a simple greeting, so it should be welcoming and easy to understand."
easyread-text-13-27,13,text-13-27,El número quince.,es,"The text doesn't contain specific context or complex information, but as a simple number, there’s nothing to simplify. However, for educational engagement, mentioning the context of the number might be useful if provided in a larger context."
easyread-text-13-9,13,text-13-9,Color favorito,es,"Colors are simple concepts, and to communicate what someone's favorite color is, I will just state it simply."
easyread-text-13-3,13,text-13-3,Una 'expresión' es una manera de mostrar lo que sientes o lo que piensas.,es,"The task is to simplify the provided text for children with cognitive and learning disabilities. The text is a simple one-word request 'Expressions', so we need to provide a basic explanation of what expressions mean using simple structure and vocabulary."
easyread-text-13-23,13,text-13-23,Mi papá se llama Ismael y mi mamá se llama Teresa.,es,"The text introduces the names of the person's parents, which should be kept simple for easy comprehension."
easyread-text-13-10,13,text-13-10,Número favorito,es,The text 'Favorite number' conveys a simple concept that may be about liking a certain number. I can simplify it in Spanish for easy understanding.
easyread-text-13-4,13,text-13-4,"Hola, soy un asistente virtual. Estoy aquí para ayudarte.",es,"The prompt is about introducing oneself. In Spanish, the introduction can be simple and straightforward with familiar expressions."
easyread-text-13-2,13,text-13-2,Usa este cuadro para ayudarte.,es,"The text is instructing someone to use a chart for assistance, which involves a basic action that can be simplified for children."
easyread-text-13-11,13,text-13-11,¡Hola! / ¡Encantado de conocerte! / ¡Hey ahí!,es,"These phrases are simple greetings in English used to say hello when meeting someone. The task is to simplify them into easy-read Spanish, keeping them informal and friendly."
easyread-text-13-12,13,text-13-12,Mi nombre es Emma.,es,"The sentence introduces the person, Emma, in a direct and simple way. The name does not change in Spanish."
easyread-text-13-13,13,text-13-13,Soy Emma.,es,The text introduces a person named Emma in a simple and direct manner.
easyread-text-13-1,13,text-13-1,Mi nombre es asistente. Ayudo a las personas a encontrar información y responder preguntas. Me gusta aprender cosas nuevas. Siempre estoy listo para ayudar.,es,"The text is asking for basic information about myself that can be easily understood by children, using simple vocabulary and sentences."
