id,page_index,text_id,text,language_code,reasoning
easyread-text-17-12,17,text-17-12,Es el número once.,es,"The text '11' is a number and does not carry complex information that needs simplification. It's simply the number eleven, which is an intermediate level number in terms of counting."
easyread-text-18-15,18,text-18-15,Veinte es un número. Significa que hay dos grupos de diez.,es,"Although '20' is a number, the output should make it familiar to school children with cognitive disabilities by describing it in simple terms."
easyread-text-18-12,18,text-18-12,"Uruguay es un lugar bonito para vivir. La gente se siente segura, hay libertad, y el ambiente es limpio y bonito.",es,"The text should be simplified to explain that Uruguay has a good quality of life because people feel safe, there is freedom, and the environment is clean and beautiful. It should avoid complex sentences and maintain a focus on familiar concepts."
easyread-text-18-13,18,text-18-13,Unidad 1,es,The text 'UNIT 1' is simple and does not contain complex words or phrases. It indicates a section or chapter identifier commonly used in educational or instructional materials.
easyread-text-18-11,18,text-18-11,Usa estas frases para la clase y también las que aprendimos antes.,es,"The text suggests using certain language phrases in the classroom, referring to both new and previous ones."
easyread-text-18-7,18,text-18-7,"¿Puedes venir al pizarrón, por favor?",es,The text is a simple request asking someone to come to the board.
easyread-text-18-6,18,text-18-6,"El lunes, 9 de octubre de 2023.",es,"To write the date in Spanish, use the format: day of the week, day of the month, month, and year. Example: Monday, October 9, 2023, becomes Lunes, 9 de Octubre de 2023."
easyread-text-18-9,18,text-18-9,"Sí, he terminado.",es,"The sentence is simple and does not contain complex vocabulary, but it mentions completing a task which may need clarification depending on context."
easyread-text-18-2,18,text-18-2,"Escúchame, por favor.",es,The text is asking someone to pay attention.
easyread-text-18-5,18,text-18-5,"Sí, puedes escribir la fecha.",es,"The text is about someone asking if they can write the date, which is a simple question. A simplified response would use common and clear language that answers the question directly."
easyread-text-18-4,18,text-18-4,"Escuchen, por favor.",es,"The original text is a simple sentence asking for attention, directed towards others."
easyread-text-18-3,18,text-18-3,"Copiar, por favor.",es,"The text does not contain specific content to simplify. It's a request to 'Copy, please.' Instead of translating, I provide a simple response to this request."
easyread-text-18-8,18,text-18-8,¿Has terminado?,es,"The sentence 'Have you finished?' is very simple and does not contain complex vocabulary or structure, so it needs minimal simplification to be understood easily by school children."
easyread-text-18-0,18,text-18-0,Más palabras fáciles para usar en clase.,es,The phrase is about increasing the use of language that is common in a classroom setting. It's important to simplify so children understand it's about using simple and common words used in school.
easyread-text-18-1,18,text-18-1,"¿Puedes esperar un minuto, por favor?",es,The text asks for waiting a minute. I should make it simple and clear for children.
easyread-text-18-14,18,text-18-14,Hola y bienvenidos,es,The text is a simple greeting that can be easily understood by school children.
easyread-text-18-10,18,text-18-10,¡Imitar!,es,"The text simply states the word 'Mimicry!' directly and is not a complete sentence or context. Mimicry means copying or imitating something. Therefore, we can explain its meaning in simple Spanish language terms."
easyread-text-19-3,19,text-19-3,¿Cómo estás hoy?,es,This question asks about someone's well-being or mood today. It's a simple greeting.
easyread-text-19-21,19,text-19-21,¿Tú haces deportes?,es,The sentence needs to be simplified and presented in a way that children with cognitive and learning disabilities can easily understand. The question format should be straightforward and direct.
easyread-text-19-16,19,text-19-16,"Hoy, me siento",es,"The input text is a simple expression of current emotions, commonly used to describe one's mood. It needs to be translated into Spanish while keeping it simple. The words should be easy to understand for children."
easyread-text-19-15,19,text-19-15,Hoy me siento genial. Me encanta la escuela y mis compañeros.,es,"A simple statement from a student expressing their positive feelings about the day, school, and their classmates. It uses very familiar words and concepts for school children."
easyread-text-19-22,19,text-19-22,¿Tú ordenaste tu dormitorio?,es,The question is asking if you cleaned your bedroom.
easyread-text-19-18,19,text-19-18,¿Estás con amigos?,es,The question is a simple and direct inquiry about whether someone is spending time with friends. It needs to stay straightforward and clear.
easyread-text-19-14,19,text-19-14,"Hoy me siento feliz porque mis amigos me saludaron con una sonrisa cuando llegué a la escuela. También estoy contento porque comí mi comida favorita en el almuerzo. Sin embargo, me sentí un poco cansado después de jugar en el recreo.",es,"I need to write sentences that a child can understand easily about feelings today, using simple words and phrases."
easyread-text-19-0,19,text-19-0,"Vivir en Uruguay es estar en un lugar con gente amable, playas bonitas y ciudades tranquilas.",es,"The original text is about living in Uruguay. For children with cognitive disabilities, I need to use simple words and sentences in Spanish to help them understand the concept of living in a place."
easyread-text-19-17,19,text-19-17,¿Cómo te sientes cuando...?,es,The text is about understanding emotions by asking how someone feels in different situations. It should be simplified for better comprehension by children with disabilities.
easyread-text-19-23,19,text-19-23,No hay información para simplificar.,es,"The text is about UNIT 1, which seems to be the name or title of something but it doesn't provide context about what it is."
easyread-text-19-1,19,text-19-1,¡La cadena de sentirse bien!,es,This phrase suggests a sequence or series of actions that make people feel good.
easyread-text-19-20,19,text-19-20,¿Vas a una fiesta?,es,The text is asking if someone is going to attend a party. The syntax and vocabulary needs to be simple in Spanish.
easyread-text-19-2,19,text-19-2,Mira la cadena de buenos sentimientos de los personajes.,es,"The text is about observing or identifying the positive emotions or good feelings among characters. By simplifying this, we want to communicate the idea of understanding the happiness or positive emotions of the characters."
easyread-text-19-19,19,text-19-19,¿Dormiste bien?,es,"The text is a simple question asking about someone's quality of sleep, which is straightforward and uses common vocabulary easily understood by children."
easyread-text-19-4,19,text-19-4,Estoy bien. ¿Y tú?,es,"The text is a simple greeting exchange between two people, asking about each other's well-being. It requires no complex terminology and should just be simplified to reflect the basic intent."
easyread-text-19-25,19,text-19-25,Veintiuno,es,"The input '21' appears to be a standalone number and does not have context or textual content to simplify. However, if we treat '21' as a number, it can be directly translated into Spanish."
easyread-text-19-8,19,text-19-8,Todos pónganse de pie y hagan algo que los haga sentir bien.,es,The text is a command encouraging everyone to stand up and engage in an activity that makes them feel good and connected.
easyread-text-19-12,19,text-19-12,¡Genial!,es,"The word 'Terrific!' is usually used to express excitement or how something is great. To simplify this for school children with cognitive and learning disabilities, I should use a very simple word that they understand, like '¡Genial!' or '¡Increíble!'"
easyread-text-19-7,19,text-19-7,Ahora te toca a ti.,es,The phrase asks the reader to take their turn in a game or activity. It's important to use simple language to convey the message for children.
easyread-text-19-10,19,text-19-10,¡Maravilloso!,es,The text is expressing excitement or approval. I should use simple and familiar words to convey this feeling in Spanish.
easyread-text-19-13,19,text-19-13,¿Cómo te sientes hoy?,es,The text is asking a question about someone's feelings today.
easyread-text-19-5,19,text-19-5,Estoy bien. ¿Cómo estás?,es,The sentence is a simple greeting expressing a feeling and asking about the other person's well-being. It uses common conversational language.
easyread-text-19-9,19,text-19-9,¡Genial!,es,"The input seems to be a non-specific positive exclamation but since it does not provide clear content, I focus on simplifying the expression."
easyread-text-19-6,19,text-19-6,Estoy bien. ¿Cómo estás?,es,The text is a simple conversation where someone asks about the well-being of another person. The response should be short and easy to understand.
easyread-text-19-24,19,text-19-24,Hola y bienvenidos,es,"The text is a simple greeting and welcome message, which is straightforward."
easyread-text-19-11,19,text-19-11,¡Está bien!,es,The input text 'OK!' is a simple and commonly used expression that signifies agreement or acknowledgement. It doesn't require simplification as it is already familiar and easy to understand for children.
easyread-text-20-18,20,text-20-18,Una S.O.S. BOX ayuda a la gente en emergencias.,es,"The text is very short and uses the term 'S.O.S. BOX', which might not be familiar to school children with cognitive and learning disabilities. I need to explain it as something that helps people in emergencies."
easyread-text-20-1,20,text-20-1,"Las diferentes partes de la cabeza son los ojos, la nariz, la boca, las orejas, el cabello y la frente.",es,"The text asks about the parts of the head. To make it understandable for children with cognitive and learning disabilities, we should use simple words and describe the parts in a straightforward manner."
easyread-text-20-19,20,text-20-19,Unidad 1,es,"The task provided was simply a heading with no specific context or content to simplify. Just report it back as such, since 'UNIT 1' doesn't need simplification."
easyread-text-20-7,20,text-20-7,Las cejas son pelo arriba de los ojos. Ayudan a proteger los ojos y a mostrar emociones.,es,"The task is to provide a simple explanation of what eyebrows are in Spanish. Eyebrows are hair above the eyes on the face, which protect the eyes and also help express emotions."
easyread-text-20-20,20,text-20-20,Hola y bienvenido,es,The text is a simple greeting to someone.
easyread-text-20-14,20,text-20-14,Adivina los personajes...,es,"The text is a simple phrase inviting someone to guess characters, similar to a game or activity."
easyread-text-20-13,20,text-20-13,Tengo la nariz pequeña/grande.,es,"The sentence is about describing the size of the nose in simple terms, so I should keep it direct and use familiar words."
easyread-text-20-8,20,text-20-8,Tengo ojos marrones.,es,"The original text is simple, and its meaning is clear: someone is stating that they have eyes of a specific color. This idea can be simplified using everyday words."
easyread-text-20-0,20,text-20-0,Podemos ver los sentimientos en tu cara.,es,The text is about emotions being seen on a person's face.
easyread-text-20-4,20,text-20-4,Dientes,es,The text needs to be simplified for children with cognitive and learning disabilities. The word 'teeth' can be described in simple terms to help understanding.
easyread-text-20-9,20,text-20-9,Tengo una boca pequeña/grande.,es,"The sentence talks about a person having either a small or big mouth. It is straightforward and uses simple language, suitable for children."
easyread-text-20-6,20,text-20-6,Pelo,es,The word 'hair' refers to the strands that grow on a person's head and body. It's important to use simple terms so children can understand what it is.
easyread-text-20-11,20,text-20-11,Tengo el pelo corto/largo.,es,The sentence is about describing one's hair length in simple terms without technical language.
easyread-text-20-10,20,text-20-10,Tengo dientes blancos.,es,The sentence is simple and talks about having teeth that are white. It uses straightforward language that should be easy for children to understand.
easyread-text-20-15,20,text-20-15,Tenemos dos nuevos compañeros en la clase.,es,"The text informs about two new classmates joining, so I need to use simple and clear language."
easyread-text-20-17,20,text-20-17,Dibujemos una cara.,es,The text is asking to draw someone's face. This can be simplified for children by simply stating that someone wants us to draw a face.
easyread-text-20-16,20,text-20-16,Mira las historias que escribimos sobre Caroline y Michael.,es,"The text likely asked someone to compare the descriptions of two people, Caroline and Michael. For an easy-read version, I need to explain that we are talking about the descriptions or stories about these two people."
easyread-text-20-12,20,text-20-12,Tengo cejas gruesas/delgadas.,es,"The person is talking about their eyebrows being thick or thin, which are simple and easily understood concepts."
easyread-text-20-2,20,text-20-2,La boca es la parte del cuerpo que se usa para comer y hablar.,es,The term 'mouth' can refer to the part of a person's body where they eat and speak. It can also be a feature in animals used for similar functions.
easyread-text-20-21,20,text-20-21,El número es 22.,es,The input '22' does not provide context or information that needs simplification. It is already simplified as it is just a number.
easyread-text-20-3,20,text-20-3,El término 'nariz' es sencillo. La nariz es la parte del cuerpo que usamos para oler y respirar.,es,The term 'nose' is a simple word that doesn't need simplification because it is already familiar and understood by children with cognitive and learning disabilities. It refers to the body part used for smelling and breathing.
easyread-text-20-5,20,text-20-5,Los ojos son para ver.,es,"The word 'eyes' is simple and doesn't require any complex explanation for children. To simplify, we can explain what eyes are used for."
easyread-text-21-4,21,text-21-4,Este es Michael.,es,"The text introduces someone named Michael, and this is a simple statement that doesn't require any technical language."
easyread-text-21-2,21,text-21-2,"Ella tiene ojos grandes y azules, una nariz pequeña y una boca grande.",es,"The text describes a person by mentioning three facial features: big blue eyes, a small nose, and a big mouth. I should use simple, everyday words to describe the person."
easyread-text-21-6,21,text-21-6,"Su cabello es marrón, corto y rizado.",es,"The sentence is a simple description of physical appearance, specifically about the hair's color, length, and texture. It involves basic vocabulary suitable for easy understanding by school children."
easyread-text-21-1,21,text-21-1,Esta es Carolina.,es,The sentence is an introduction of a person named Caroline. It is already simple and direct.
easyread-text-21-7,21,text-21-7,Yo en el espejo:,es,"The original text's intent appears to be introspective or reflective, simply referring to one's own image in the mirror, without any complex context or details."
easyread-text-21-0,21,text-21-0,"Vivir en Uruguay es bonito. Hay playas, y la gente es amable. Puedes jugar y disfrutar del tiempo libre al aire libre.",es,"The text likely provides basic information about living in Uruguay, which may include aspects such as culture, environment, or lifestyle. Simplification involves removing complex terms and ensuring the text uses familiar words suitable for children with cognitive disabilities."
easyread-text-21-3,21,text-21-3,"Tiene el pelo rubio, largo y liso.",es,"The text describes a person's hair using simple physical details like color, length, and texture, which easily can be represented with familiar words."
easyread-text-21-10,21,text-21-10,La primera parte o sección de algo.,es,"The term 'Unit 1' is a label often used in educational or instructional contexts to refer to the first section or topic in a series. In simplifying this, it's important to maintain the fundamental idea that it represents the beginning or initial part of a sequence."
easyread-text-21-9,21,text-21-9,"Cuando me miro en el espejo, veo mi cara, mis ojos, mi nariz y mi boca. Puedo ver mi pelo y mi sonrisa.",es,"The text asks to describe oneself when looking in the mirror, likely focusing on physical attributes or feelings. I should use simple words and an active voice to make it easy for children with disabilities to understand."
easyread-text-21-12,21,text-21-12,23,es,"The text should be simplified using everyday language to ensure comprehensibility for children with cognitive and learning disabilities, while preserving the original intent and meaning."
easyread-text-21-11,21,text-21-11,Hola y bienvenidos,es,"The text is a greeting, welcoming someone in a friendly manner. The goal is to use simple Spanish words that convey a warm welcome."
easyread-text-21-5,21,text-21-5,"Él tiene ojos verdes pequeños, una nariz grande y una boca pequeña.",es,The original sentence describes the facial features of a male individual using simple adjectives for size and color. The goal is to translate this description clearly to Spanish while maintaining the original meaning and using easy words.
easyread-text-21-8,21,text-21-8,Mira tu cara en un espejo y dibújala o pega una foto tuya.,es,"The text is instructing the reader to either draw their face or paste a picture on a mirror, which might be a task to recognize oneself. I need to simplify the instruction to make it easier for children."
easyread-text-22-8,22,text-22-8,Haz un diccionario con dibujos para aprender palabras nuevas. Dibuja una imagen para cada palabra.,es,Creating a picture dictionary is helpful because it allows children to understand new words by associating them with images. It is easier for them to remember words when they can see a picture that represents the word.
easyread-text-22-13,22,text-22-13,¿Qué ropa te gusta más?,es,"The original text suggests talking about which clothes you like. To make it simple for children, we can directly ask them which clothes they like."
easyread-text-22-7,22,text-22-7,La cama está en el medio del dormitorio. La mesita de noche está al lado de la cama. El armario está en la esquina del dormitorio. La lámpara está sobre la mesita de noche. La alfombra está en el suelo. La ventana está en la pared cerca de la cama.,es,The task is to list common objects in a bedroom and describe where they are using simple and familiar words.
easyread-text-22-14,22,text-22-14,El número 24 es después del 23 y antes del 25.,es,"The text '24' is a number that stands alone without additional context. In such cases, simplifying it into a narrative suitable for children involves associating it with familiar concepts."
easyread-text-22-9,22,text-22-9,Piensa en tu juguete favorito cuando eras niño. Habla sobre cómo era y por qué te gustaba mucho.,es,"The text asks to think about a favorite toy from childhood and discuss it. This relates to personal experiences, so the simplified text should encourage thinking about easy-to-understand concepts like remembering, describing, and sharing feelings about the toy."
easyread-text-22-6,22,text-22-6,"Mi habitación ideal tiene una cama cómoda, una ventana grande para mirar afuera, un escritorio para dibujar y jugar, y muchos juguetes y libros.",es,"The sentence is a simple request to describe an ideal bedroom. To make it easier to understand for school children, I will give a short and clear description using common words about what might be in a nice bedroom."
easyread-text-22-11,22,text-22-11,Las ropas de invierno son abrigadas para el frío. Usamos chaquetas y suéteres. Las ropas de verano son ligeras para el calor. Usamos camisetas y pantalones cortos.,es,"Winter clothes are warm and help protect from the cold, like coats and sweaters. Summer clothes are light and keep us cool, like t-shirts and shorts."
easyread-text-22-10,22,text-22-10,Conozcan palabras sobre ropa.,es,The text is about learning words related to clothing. I should simplify it by using familiar words for children.
easyread-text-22-4,22,text-22-4,"Sala, cocina, baño, dormitorio, comedor.",es,The request is simple and asks for names of rooms that can be found in a typical house. An easy method is to list common rooms using simple and familiar words.
easyread-text-22-0,22,text-22-0,"""Unidad 2"" es una parte de una lección o un curso que enseña algo nuevo.",es,"Unit 2 is likely a lesson or section in a textbook or course that covers specific content. In simplifying, I need to explain that it is a part of learning."
easyread-text-22-3,22,text-22-3,Escucha y lee para conocer diferentes tipos de casas.,es,The task involves identifying different house types through descriptions by reading and listening. It is important to simplify the idea for better understanding.
easyread-text-22-12,22,text-22-12,Mi amigo lleva una camisa y pantalones. Yo uso una camiseta y jeans.,es,"The task requires us to describe outfits in simple and understandable terms for children, using easy language that specifies the clothing items worn by each person."
easyread-text-22-1,22,text-22-1,Yo mismo,es,"I need to facilitate your understanding by recognizing that you are talking about yourself, and I should use simple words to convey this concept."
easyread-text-22-2,22,text-22-2,"Al terminar esta parte, podrás hacer algo nuevo.",es,"The original text communicates a goal or outcome, focusing on the future ability of the reader after completing a unit. It needs to be simplified to be more direct and clear for children."
easyread-text-22-5,22,text-22-5,"Mi casa es pequeña y de color azul. Tiene una puerta, ventanas, una cocina, un baño, y dos habitaciones. También hay un jardín con flores.",es,"I should make it easy for children to understand by describing the shape, color, and features like rooms or garden."
easyread-text-23-11,23,text-23-11,Una persona que habla en un evento.,es,"The text is about Speaker 1, which refers to a person who speaks at a certain event. There is not much context, so I need to provide a simple text about a person who speaks."
easyread-text-23-4,23,text-23-4,A,es,"The input text doesn't provide any specific context or information, so it's interpreted as just the letter 'A'."
easyread-text-23-5,23,text-23-5,"No hay texto para simplificar, solo está la letra 'B'.",es,"This text is a single letter 'B', so it's unclear what needs to be simplified. It's possible this was a placeholder or error."
easyread-text-23-10,23,text-23-10,¿A qué casa se refieren?,es,"The original text is a question asking about the name of a house. To make it clear for children or people with learning disabilities, we need to rephrase it to be more straightforward and specific."
easyread-text-23-6,23,text-23-6,La letra 'C' por sí sola no da suficiente información. Necesitamos más para simplificar.,es,The letter 'C' by itself does not provide enough information to contextualize or simplify. A description or a fuller text is needed to apply simplification.
easyread-text-23-2,23,text-23-2,Estas son fotos de algunas casas del barrio.,es,"The text describes that pictures are taken of houses in a neighborhood, which needs to be simplified for children by using simpler and everyday words."
easyread-text-23-3,23,text-23-3,Mira los diferentes tipos de casas.,es,The text is asking to look at different types of houses in a simple way for children to understand. It should be easy and clear.
easyread-text-23-9,23,text-23-9,Escucha sobre la casa y elige la letra que corresponde.,es,"The original task involves listening and identifying the correct house based on a description, which might be complex for children with cognitive and learning disabilities. Simplifying this involves making short, clear and direct statements when describing houses, and prompting them to just pick the letter referred rather than understanding multi-step instructions."
easyread-text-23-0,23,text-23-0,"Mira el programa sobre vivir en Uruguay los martes a las 21:00 en canal de televisión, y usa '#livingUruguay' para compartir tus comentarios.",es,The text instructs viewers on when to watch a program about living in Uruguay and to share their thoughts using a specific hashtag. I should make the instruction clear and simple for children.
easyread-text-23-8,23,text-23-8,La letra 'E' no tiene contexto o contenido para simplificar.,es,"The text 'E' doesn't provide a context or content to simplify. To produce an easy-read version for children, we would need more information. Usually, when provided with a complex text, I break it down into understandable parts while using simple words."
easyread-text-23-7,23,text-23-7,La letra 'D' sola no significa nada aquí.,es,"The text contains only the letter 'D', which does not convey a complete message or sentence that can be simplified."
easyread-text-23-1,23,text-23-1,"Mi casa, mi hogar",es,The sentence highlights a personal connection and sentiment towards a person's house and home. It's important to maintain that sense of familiar comfort in translation.
easyread-text-23-13,23,text-23-13,Habla la persona número 3.,es,"Since the original text only contains the word 'Speaker 3', I need to provide additional context or create a related easy-read version that would be understandable."
easyread-text-23-12,23,text-23-12,Hablo sobre el progreso de las mujeres y la importancia de apoyarlas.,es,"The text is a speech by Speaker 2, focusing on women's empowerment and progress."
