id,page_index,text_id,text,language_code,reasoning
easyread-text-27-24,27,text-27-24,Jack y Joe son dos amigos que encuentran una cueva secreta. Allí conocen a personas amables llamadas Elfos. Los Elfos invitan a los chicos a tomar té y les hablan de su cultura. Los niños se sienten asombrados y felices por aprender sobre los Elfos.,es,"The text is about two boys, Jack and Joe, who find a hidden cave and encounter a group of friendly people called Elves. They have tea and learn about Elf culture, which is fascinating for the boys."
easyread-text-27-26,27,text-27-26,No hay información para simplificar.,es,There seems to be no content to simplify in the text provided.
easyread-text-27-28,27,text-27-28,Veintinueve,es,"The text suggests the number 29 without any additional context or explanation, so no simplification or reasoning is needed beyond identifying that it is a number."
easyread-text-27-25,27,text-27-25,No hay texto para simplificar.,es,The input ideally should have included a complete sentence to simplify.
easyread-text-27-23,27,text-27-23,G,es,"The text only contains the letter 'G', which doesn't seem to have an inherent meaning or context. However, if it's intended to mean something like a person's initial or a letter in a sequence, that's all that can be simplified."
easyread-text-27-8,27,text-27-8,El salón es un lugar de la casa donde las personas se sientan y pasan tiempo juntas.,es,The text describes a place at home where people usually gather together to relax or entertain guests.
easyread-text-27-10,27,text-27-10,Me encanta mi dormitorio.,es,The text is simple and describes a personal feeling about a bedroom.
easyread-text-27-9,27,text-27-9,Mi dormitorio es un lugar especial para mí.,es,"The text expresses a personal feeling about how the bedroom holds great importance, possibly because it is a personal space where one feels comfortable and safe. To make it easy to understand, we refer to the bedroom as a special place."
easyread-text-27-11,27,text-27-11,Tengo mi propia habitación.,es,The text is straightforward and does not contain complex words or structures. It's important to maintain the simplicity and clarity in the translation.
easyread-text-27-19,27,text-27-19,La letra 'C' es una letra del abecedario que usamos para escribir palabras.,es,The letter 'C' is part of the alphabet and is commonly used in writing. My task is to create an easily understandable explanation for school children.
easyread-text-27-18,27,text-27-18,Es la letra B.,es,The letter 'B' is the second letter of the alphabet. It can be used in context to start words or represent sounds. There is no further context or content to simplify.
easyread-text-27-13,27,text-27-13,Las paredes son blancas.,es,"The sentence is simple, but we will make it even easier for children to understand by keeping it straightforward."
easyread-text-27-17,27,text-27-17,No hay texto proporcionado para simplificar.,es,The document provides no textual input to simplify. I will assume it is a placeholder and return no simplification.
easyread-text-27-14,27,text-27-14,Hay una cama individual en él.,es,"The sentence states that there is a twin bed, without unnecessary complexity."
easyread-text-27-16,27,text-27-16,Conecta el objeto con su nombre.,es,The sentence gives an instruction to match objects with their names. It is important for instructions to be clear and direct for children.
easyread-text-27-15,27,text-27-15,En mi habitación hay muchas cosas.,es,The text is simple and doesn't need much simplification. It talks about having many objects in a bedroom. It can be simplified by directly saying there are many things in the room.
easyread-text-27-12,27,text-27-12,Es grande y cómodo.,es,The sentence describes an object that is both large in size and provides comfort.
easyread-text-27-20,27,text-27-20,El texto es confuso. No hay suficiente información.,es,The word is unclear without context. It could refer to multiple things. I aim to transform complex sentences rather than single letters or ambiguous input.
easyread-text-27-0,27,text-27-0,"Uruguay es un país donde la gente vive tranquila. Hay bonitas playas, buena comida y personas amables.",es,"The original text might be talking about living conditions in Uruguay. The topic is likely covering aspects like culture, environment, or lifestyle in Uruguay, and these need to be simplified for easier understanding by using clear and direct language in Spanish."
easyread-text-27-5,27,text-27-5,Pega los dibujos y ponles nombre.,es,The text is about labeling pictures. It uses simple words like 'pictures' and 'label' which are easy for children to understand. I will simplify it by replacing the word 'label' with 'name'.
easyread-text-27-2,27,text-27-2,Me pidieron que haga el texto más fácil de leer para los niños. Debo usar palabras simples para que los niños puedan entender mejor. No tengo que cambiar el significado del texto. Solo hacerlo más claro y fácil.,es,"The text is about explaining the context of what I am about to reply, that involves generating content specifically tailored for children with cognitive and learning disabilities. So, I need to simplify whatever text content is given and have a defined example approach to follow, which involves simpler syntax using everyday words."
easyread-text-27-6,27,text-27-6,El número es 3.,es,"The input provided is just the number '3' with no additional context or information to simplify or rewrite. Thus, there is no substantive text to simplify based on the guidelines provided."
easyread-text-27-4,27,text-27-4,El número '2' es un número después de '1' y antes '3'. Es un número pequeño y fácil de contar con los dedos.,es,The input '2' represents a number. We should explain the number '2' in simpler terms for better understanding.
easyread-text-27-3,27,text-27-3,Busca fotos de los lugares mencionados en la caja de S.O.S.,es,"The text instructs children to search for pictures of places mentioned in a box labeled 'S.O.S.' By simplifying, we use simple words to help them understand the task better."
easyread-text-27-21,27,text-27-21,Puede hacer calor en un lugar y frío en otro al mismo tiempo.,es,The text is about the different temperatures across the northern and southern hemispheres. I simplified it to explain how it can be hot or cold in different parts of the world at the same time.
easyread-text-27-7,27,text-27-7,Haz esto regularmente cuando aprendas palabras nuevas.,es,The text is suggesting a routine action to perform regularly when learning new vocabulary.
easyread-text-27-1,27,text-27-1,Un diccionario con imágenes es un libro que muestra dibujos de palabras para ayudar a entenderlas mejor. Es útil para niños pequeños o para aprender un nuevo idioma.,es,"A picture dictionary is a book that shows pictures of words to help understand their meanings. It is especially helpful for young children or those learning a language, as the visuals make it easier to connect the words to their meanings."
easyread-text-28-1,28,text-28-1,"Los estantes son lugares donde pones cosas como libros, juguetes o fotos. Puedes encontrarlos en casa o en la escuela para organizar tus cosas.",es,"The text was not provided entirely, and a single word 'shelves' is vague. Assuming I need to explain what shelves are in an easy-read manner for children."
easyread-text-28-9,28,text-28-9,Una cama pequeña para una persona.,es,"The text is about a type of bed known as 'twin bed,' which might not be easily understandable for young children or those with cognitive disabilities. The idea is to describe it in simpler terms that are more relatable."
easyread-text-28-10,28,text-28-10,Un cojín es algo blando sobre lo que te sientas o apoyas.,es,The word 'cushion' may be unfamiliar or too abstract for children with cognitive and learning disabilities. It is important to describe its use or function in simple terms that they can understand.
easyread-text-28-0,28,text-28-0,La vida en Uruguay es especial por su gente amable y sus hermosas playas.,es,This is the first part of a text about living in Uruguay and what makes it interesting or special.
easyread-text-28-7,28,text-28-7,Una alfombra es un material suave que se pone en el suelo para caminar sobre él.,es,"The text 'carpet' is a single word which refers to a thick material used to cover the floor. To explain this in a simpler way for children, I will use easy and common words in Spanish, such as describing it as a soft floor cover one can walk on."
easyread-text-28-8,28,text-28-8,Armario,es,"The text is simply 'wardrobe', which is referring to a piece of furniture used for storing clothes."
easyread-text-28-2,28,text-28-2,Es un mueble con cajones para guardar ropa u otras cosas.,es,The text is just a simple term and we need to explain what a chest of drawers is to children.
easyread-text-28-6,28,text-28-6,Es un mueble donde uno se sienta a estudiar o trabajar.,es,"The word 'desk' is a simple noun referring to a piece of furniture, typically used in educational and office settings. It is a term that is familiar and accessible to children."
easyread-text-28-5,28,text-28-5,Una mesa que está al lado de la cama para poner cosas cerca mientras duermes.,es,"The concept of a 'night table' typically refers to a small table or stand placed beside a bed for easy access to items during the night. For simplification, I can describe it directly with its primary function for a young audience."
easyread-text-28-4,28,text-28-4,Sillón.,es,"An armchair is a chair with arms, often more comfortable, like the ones found in living rooms. In Spanish, it is called 'sillón'. This maintains the simplification by using a familiar term instead of specifying different types of armchairs."
easyread-text-28-3,28,text-28-3,Es un lugar donde ponemos el papel que ya no necesitamos.,es,The phrase refers to a container where paper is disposed of. I need to use simple words to describe it.
easyread-text-28-11,28,text-28-11,(Por favor proporciona el texto que necesitas simplificar),es,"The text is not provided, so I can't simplify it directly. However, if there was text to simplify, I would identify complex words and structures, and replace them with simple words and active sentences in Spanish."
easyread-text-28-15,28,text-28-15,"""E"" es una letra del alfabeto.",es,The text refers to the name 'E'. There is no additional context or information provided in the input.
easyread-text-28-14,28,text-28-14,La letra 'D' no tiene suficiente contenido para simplificar.,es,"The text 'D' does not provide sufficient context or content to simplify as it is a single character. In such cases, there isn't any meaningful content or passage to simplify."
easyread-text-28-19,28,text-28-19,"Por favor, proporciona un texto completo para simplificarlo.",es,"Without a complete text, I'm unable to provide a simplification. However, typically, my task would involve rephrasing the provided text into short, clear sentences using simple vocabulary. For example, if the text was about a complex science topic, I'd explain it using everyday words and examples that kids understand."
easyread-text-28-25,28,text-28-25,"En mi cuarto tengo una cama, una mesa, una silla y una lámpara.",es,The text should simple enough for children to understand the objects that could be in a room. Use simple and familiar words.
easyread-text-28-20,28,text-28-20,"La letra ""I"" no tiene suficiente información para simplificar.",es,"The original text needs to be simplified into a basic level Spanish equivalent for school children with learning disabilities. However, the provided text is a single character 'I', which is not complete or specific enough to simplify. As there is not enough content to interpret or simplify, the response should acknowledge this."
easyread-text-28-21,28,text-28-21,No entiendo el texto. Falta información para simplificar.,es,This text seems to be an incomplete input with only one letter 'J'.
easyread-text-28-18,28,text-28-18,G es una letra del alfabeto. Se usa en muchas palabras.,es,"There is no context provided in the input text, so it's challenging to generate new content. Instead, I'll treat 'G' as a placeholder for completing the task and will create a sample response."
easyread-text-28-17,28,text-28-17,La letra F es la sexta letra del alfabeto.,es,The text needs to be simplified so that children can easily understand it and relate to everyday words. It should also be concise and maintain the overall gender context where applicable.
easyread-text-28-22,28,text-28-22,"Diferentes tipos de camas pueden ser: una cama simple para una persona, una cama doble para dos personas, una litera que tiene una cama arriba de otra, y una cama plegable que se puede guardar cuando no se usa.",es,The text lists different types of beds which might be difficult to understand for children with learning disabilities. I need to use simple language and examples they can relate to in order to explain this concept.
easyread-text-28-12,28,text-28-12,B,es,"The text is the letter 'B', which does not need simplification."
easyread-text-28-16,28,text-28-16,Una cama individual es una cama para una sola persona. Es más pequeña que otras camas.,es,"A 'twin bed' is simply a type of bed that is smaller and usually meant for one person. This term can be confusing, but it just refers to a single bed."
easyread-text-28-23,28,text-28-23,"Son diferentes tamaños de camas: twin, full, queen, king y California king.",es,The text is listing different types of bed sizes.
easyread-text-28-24,28,text-28-24,¿Cuáles de estos objetos tienes en tu habitación?,es,The question asks what items are present in the bedroom. An easy-read version should use simpler words and a common structure to help understanding.
easyread-text-28-28,28,text-28-28,Guías para actividades de escritura al final de este libro.,es,"The text refers to evaluation guidelines or criteria used for writing activities. These could be complicated for some students, so I aim to replace 'rubrics' with 'guidelines' and describe them simply."
easyread-text-28-26,28,text-28-26,Unidad 2: Yo mismo,es,"The text 'UNIT 2 Myself' likely indicates a chapter or section from a learning resource that focuses on self-awareness or personal information. I need to simplify this for children, making it relatable and understandable."
easyread-text-28-27,28,text-28-27,30,es,"The input only contains the number 30 which doesn't require simplification. For comprehension, use familiar objects or quantities. For example, I could relate it to things like 30 pieces of candy or 30 school days. But the original input needs to stay as is in this case."
easyread-text-28-13,28,text-28-13,Letra C,es,"The letter 'C' is often used as an abbreviation or initial for various terms, but in this case, there is no further context given, so there is no need to simplify further."
easyread-text-29-52,29,text-29-52,¿Está la ventana al lado de la puerta?,es,"The sentence asks about the position of the window in relation to the door, using simple language and direct question form."
easyread-text-29-16,29,text-29-16,"La letra ""b"" es la segunda letra del alfabeto.",es,"The letter 'b' could be part of a text, but by itself, it's a letter and doesn't convey a specific message. It may be referring to the second letter in the alphabet or have a specific meaning depending on the context. To make it more simplified or relatable for children, we could relate it to being simply a letter of the alphabet."
easyread-text-29-49,29,text-29-49,"Por favor, proporciona una oración completa para simplificar.",es,"The input seems to be a single character 'd', which does not form any meaningful sentence or text on its own. For simplification, I need a complete sentence or context."
easyread-text-29-35,29,text-29-35,puerta,es,The word 'door' is a simple term that kids can understand as something they open or close to go in or out of a room.
easyread-text-29-40,29,text-29-40,Formen equipos de 4 personas.,es,This sentence instructs individuals to form groups consisting of 4 people each. It is a straightforward instruction commonly used in classroom settings.
easyread-text-29-38,29,text-29-38,Presiona aquí.,es,"To simplify the idea of 'clicking here', I need to use simple terms about pressing buttons on devices."
easyread-text-29-54,29,text-29-54,¿Qué otras cosas están colgadas en las paredes?,es,The question is asking about objects that are on the walls. We should use simple words to describe that there are more things on the wall than the question might first suggest.
easyread-text-29-25,29,text-29-25,Mesa de noche,es,"A 'night table' is a small table usually placed beside a bed. In Spanish, it's known as 'mesa de noche', referring to this piece of furniture used at night."
easyread-text-29-56,29,text-29-56,Yo mismo,es,"The user input is ambiguous and doesn't provide enough context. It may suggest self-reference or self-introduction, meaning the text might be referring to 'myself'. Therefore, in simplifying, I should interpret it as introducing oneself or one's presence, which is not textually complex."
easyread-text-29-36,29,text-29-36,"Un ""balde"" es un recipiente que se usa para llevar agua u otras cosas.",es,The term 'bucket' refers to a simple tool often used for carrying water or other materials. It is important to use words that are easy to understand.
easyread-text-29-37,29,text-29-37,Mira el tráiler que el maestro va a poner.,es,The text is about a task where students are instructed to watch a trailer that the teacher will show.
easyread-text-29-34,29,text-29-34,alfombra,es,"The text is a single word 'carpet' referring to an item, generally used as an everyday object to cover floors. In Spanish, 'carpet' translates directly to 'alfombra', which is a simple and commonly understood word."
easyread-text-29-24,29,text-29-24,La televisión es un aparato para ver programas y películas.,es,"The text 'television' refers to a device used to watch shows and movies. To express this idea simply, we focus on its basic function that children can understand easily."
easyread-text-29-55,29,text-29-55,Unidad 2,es,"The text refers to a unit within a larger structure, perhaps an educational curriculum or a product."
easyread-text-29-29,29,text-29-29,Un cartel es un papel grande con dibujos y mensajes que se muestra a muchas personas para dar información.,es,"A poster is typically a printed notice, a large picture or an announcement designed to be displayed. It usually presents information in a simple and visual manner making it easier for viewers to understand quickly."
easyread-text-29-46,29,text-29-46,No tengo información sobre el color de la manta de Andy.,es,"The text is asking about the color of a specific item, which is Andy's blanket."
easyread-text-29-26,29,text-29-26,"Es una máquina que usamos para trabajar, jugar y aprender.",es,"The original text has a single word that signifies a machine that can process information. In simplifying for children with cognitive and learning disabilities, it's important to relate it to a familiar and everyday object."
easyread-text-29-21,29,text-29-21,"Piensa en las cosas que Andy podría tener en su cuarto. Por ejemplo, una cama, una lámpara, y libros.",es,"The text is asking to imagine or highlight what objects Andy might have in his room. It is a simple exercise that could involve listing everyday items someone might typically have in their room, which is suitable for children's understanding."
easyread-text-29-50,29,text-29-50,¿Qué juguetes de animales tiene Andy?,es,The question asks about the animal toys that a person named Andy owns.
easyread-text-29-41,29,text-29-41,Mira el avance otra vez.,es,"The sentence is instructing someone to watch a movie or show trailer one more time. In Spanish, I need to use simple words to say the same thing."
easyread-text-29-51,29,text-29-51,La letra 'e' es una letra del abecedario.,es,This message doesn't contain any meaningful information to simplify.
easyread-text-29-45,29,text-29-45,"Letra ""b"".",es,"The text is a single letter. The goal is to simplify the text for easier understanding, but a single letter doesn't provide much to simplify."
easyread-text-29-32,29,text-29-32,Reloj,es,"The word 'clock' is a simple term and is known to many people as an object that tells time, making it accessible for school children."
easyread-text-29-57,29,text-29-57,31,es,The number 31 is a simple number and does not need further simplification.
easyread-text-29-48,29,text-29-48,¿Cuántas camas hay en el dormitorio?,es,"The text asks about the number of beds in a bedroom, a simple question that can be answered directly."
easyread-text-29-47,29,text-29-47,La letra es 'c'.,es,The text is a single letter 'c' and has no context or meaning to simplify into an easy-read format.
easyread-text-29-43,29,text-29-43,a,es,"The text 'a' is already a very simple and common word with no need for further simplification, making it appropriate for early learners and those with cognitive or learning disabilities. It's also a single letter that can function as a word in Spanish, signifying 'to' or 'at.' Since there's no more context or complexity to it, the simplified text remains the same."
easyread-text-29-28,29,text-29-28,Una lámpara es un objeto que usamos para dar luz.,es,"The text is a single word 'lamp', which might be confusing because it's not a complete idea or sentence. However, for simplification purposes for children, we should explain what a lamp is in a way that is easy to understand."
easyread-text-29-27,29,text-29-27,Un tablón de anuncios es una superficie donde las personas pueden poner información o avisos.,es,I need to simplify the text by explaining that a bulletin board is a board where people can post information or announcements.
easyread-text-29-42,29,text-29-42,"Por favor, responda las preguntas.",es,"The text instructs to simplify and answer questions, but my task is to simplify the content. The objective is to make it easier for children, so I will focus on using simple phrases. In Spanish, I must write in an easy-to-understand manner for kids."
easyread-text-29-33,29,text-29-33,Silla: Un objeto donde te sientas.,es,The word 'chair' should be simplified in a way that children can easily understand without changing its meaning.
easyread-text-29-39,29,text-29-39,¿Sabes qué cosas tiene Andy en su cuarto de la lista?,es,"The text is asking if someone knows what objects Andy has in his room from a list. To simplify it for children, I should focus on the main question, which is about identifying objects in Andy's room."
easyread-text-29-44,29,text-29-44,¿Hay un cubo lleno de muñecas?,es,"The text is asking if there is a container full of toy dolls, which is a simple concept that students would understand."
easyread-text-29-30,29,text-29-30,libros,es,"The input is a simple word 'books,' which is easy for children to understand. There is no need for complex reasoning or simplification here, as the word 'books' is already at an easy reading level."
easyread-text-29-53,29,text-29-53,"Por favor, proporciona el texto que necesitas simplificar.",es,The text was not provided for simplification. I need the text to simplify it.
easyread-text-29-31,29,text-29-31,Es un mueble con cajones donde podemos guardar la ropa.,es,"A chest of drawers is a piece of furniture with drawers used for storing clothes or other items. For children, it's simpler to describe it as a kind of storage furniture where they can keep their clothes."
easyread-text-29-7,29,text-29-7,"La letra ""a"" es una vocal del alfabeto.",es,The letter 'a' is a single vowel and a common letter in the alphabet. There is no complex concept to simplify beyond mentioning it's a letter.
easyread-text-29-10,29,text-29-10,La historia es sobre una ciudad.,es,"The text introduces a story centered around a city, without giving any specific details about the story itself."
easyread-text-29-5,29,text-29-5,¡Vamos a ver el avance de una película animada!,es,This is a simple sentence inviting someone to watch an animated movie trailer. The task is to simplify it using everyday words for children.
easyread-text-29-9,29,text-29-9,b,es,"The text given is a single character 'b', which doesn't provide any context or information to simplify. Therefore, the output remains the same as there's nothing more to interpret or transform."
easyread-text-29-8,29,text-29-8,La historia es sobre un niño.,es,I need to simplify the sentence for children with cognitive and learning disabilities while maintaining the focus on a child.
easyread-text-29-3,29,text-29-3,¿Lo tienes en tu dormitorio?,es,"The sentence is simple and direct, so minimal changes are needed. I translated it to Spanish while maintaining the directness and simplicity."
easyread-text-29-2,29,text-29-2,¿Todavía lo tienes?,es,The question is asking if something is still in possession. I should keep it simple and direct while maintaining the question format.
easyread-text-29-0,29,text-29-0,Tiempo para pensar,es,"The text is about taking time to think or reflect on something. In Spanish, we use simple words and keep the message straightforward."
easyread-text-29-1,29,text-29-1,¿Tenías un juguete favorito cuando eras niño?,es,"The question asks about a favorite toy from childhood. To simplify, we focus on having a toy that you liked as a child."
easyread-text-29-15,29,text-29-15,Los perros son animales que a muchas personas les gustan. Ellos son muy amigables.,es,"The original text simply contains the word 'Dogs.' To simplify it for children with cognitive and learning disabilities, we will provide context and make it relatable to their daily experiences."
easyread-text-29-4,29,text-29-4,Trabaja con un compañero y hablen sobre sus ideas.,es,The prompt asks students to work with a partner and discuss their ideas. It encourages collaboration.
