id,page_index,text_id,text,language_code,reasoning
easyread-text-13-20,13,text-13-20,Tengo 13 años y vivo en una ciudad con mucha gente en Uruguay.,es,"The statement shares that a 13-year-old lives in a crowded city in Uruguay. It's simple and should be easy to understand by children, but it can be slightly simplified further in sentence structure."
easyread-text-14-12,14,text-14-12,Soy estudiante.,es,"The sentence is simple and direct, making it understandable for children with cognitive and learning disabilities. It uses common vocabulary and clearly states who the person is."
easyread-text-14-19,14,text-14-19,Tu compañero,es,The task is to simplify the term 'Your Partner' for school children with cognitive and learning disabilities in a way that is easy to understand and uses simple language.
easyread-text-14-2,14,text-14-2,Hola!! Mi nombre es,es,"The text is not provided entirely, so I cannot provide a full simplified version. However, introducing oneself is a simple expression, which in Spanish is 'Hola!! Mi nombre es'. This keeps the essential structure very simple for understanding."
easyread-text-14-5,14,text-14-5,años.,es,The input is a small part of a larger text that mentions age. The task is to make it easy to understand for children with cognitive or learning disabilities.
easyread-text-14-15,14,text-14-15,Yo soy.,es,"The text is a phonetic representation of the contraction 'I'm', which combines 'I am'. We need to simplify this using familiar Spanish words suitable for school children."
easyread-text-14-3,14,text-14-3,Mi apellido es,es,"To simplify the text 'My last name is', I will use simple words and avoid any unnecessary complexity. The gender of the speaker does not affect this sentence."
easyread-text-14-4,14,text-14-4,Soy,es,Potentially completing the sentence as a form of assistance.
easyread-text-14-1,14,text-14-1,Nico se presentó. Ahora te toca a ti. Completa la tabla.,es,The text is about taking turns to introduce oneself and fill in some information in a chart.
easyread-text-14-28,14,text-14-28,16,es,"To simplify a number is to present it in a way that is understandable as is. In this case, the number '16' does not need any modification since it's a basic numerical value."
easyread-text-14-23,14,text-14-23,Color favorito,es,"The text is simply asking about someone's favorite color. It doesn't require much simplification, just a direct translation maintaining the original meaning."
easyread-text-14-22,14,text-14-22,"Un cumpleaños es un día especial para celebrar el nacimiento de alguien. Hay fiestas, regalos y pasteles.",es,"A birthday is a special day when we celebrate the day someone was born. Parties, gifts, and cakes are common."
easyread-text-14-20,14,text-14-20,Nombre,es,The term 'name' is a simple and familiar word that does not require simplification. It's already easy to understand for children.
easyread-text-14-24,14,text-14-24,Elige un número que más te guste.,es,The text is asking someone to choose a number that they like best. It should be simplified to make the concept of 'favorite' more understandable for children.
easyread-text-14-25,14,text-14-25,Una caja S.O.S. es un lugar donde puedes pedir ayuda si estás en peligro.,es,The text 'S.O.S. BOX' needs to be explained in simpler terms so children can understand what it is and its purpose.
easyread-text-14-26,14,text-14-26,Unidad 1,es,The text is a placeholder consisting of unit identifier 'UNIT 1' without additional context or content that requires simplification.
easyread-text-14-27,14,text-14-27,Hola y bienvenidos,es,"I need to simplify a common greeting phrase for children with cognitive and learning disabilities, maintaining the friendly tone."
easyread-text-14-18,14,text-14-18,Hagan parejas y pregúntale a tu compañero o compañera sobre su información personal.,es,The text is a simple instruction for a classroom activity where students need to interact with a partner and gather personal information through questioning.
easyread-text-14-21,14,text-14-21,Apodo,es,'Nickname' is a common and simple word for a name that people use informally instead of one's real name. It doesn't require complex understanding.
easyread-text-14-14,14,text-14-14,Soy,es,"The text provides a phonetic pronunciation for the phrase 'I am'. There isn't much content to simplify, but for a child's understanding, it's just introducing a contraction in English along with its phonetic pronunciation."
easyread-text-14-13,14,text-14-13,'I am' es largo y 'I'm' es corto. Es más fácil usar palabras cortas.,es,The text is about using 'I am' or 'I'm'. 'I am' is longer and 'I'm' is the short form. Using short words is easier for children to understand and say.
easyread-text-14-9,14,text-14-9,Mis padres son amables.,es,"The text simply mentions 'My parents are', so it is meant to describe something about the person's parents. Since the sentence isn't complete, I will complete it in a simple way for school children."
easyread-text-14-8,14,text-14-8,Escuela.,es,"The word 'school' is simple and doesn't require further simplification for children. However, in Spanish, it is translated to 'escuela'."
easyread-text-14-6,14,text-14-6,Yo vivo en...,es,"The text 'I live in' is incomplete and requires additional information to convey meaning, such as a location or a context. However, for simplification, we will consider it as a simple statement someone might say when talking about their home or city. In Spanish, 'I live in' can be translated to 'Yo vivo en', maintaining the simplicity of the statement."
easyread-text-14-11,14,text-14-11,Soy un estudiante.,es,The original sentence is straightforward but can be more explicit for young children by providing additional context.
easyread-text-14-16,14,text-14-16,Conocer más a tu pareja.,es,"The text is about learning more about the person you are in a relationship with, phrased in an engaging and friendly way."
easyread-text-14-17,14,text-14-17,La maestra te pide que aprendas más sobre uno de tus compañeros de clase.,es,The teacher wants you to learn things about one of your classmates. It's a simple task to know them better.
easyread-text-14-7,14,text-14-7,Yo voy a,es,"I want to make sure this simple phrase communicates an action of going, which is easy to understand."
easyread-text-14-10,14,text-14-10,Mi comida favorita es,es,The text can be simplified by using basic and common words to convey the idea of favorite foods.
easyread-text-14-0,14,text-14-0,"En Uruguay, la gente es muy amable y la vida es tranquila. Hace calor en verano y fresco en invierno. La comida es deliciosa, y hay mucho asado. Todos los días, se puede disfrutar de paseos al aire libre por las playas o el campo.",es,"The text provides general information and tips about living in Uruguay, including details about the culture, climate, and lifestyle."
easyread-text-15-13,15,text-15-13,Una foto es después de la clase de Matemáticas.,es,"The sentence refers to a picture that was taken specifically after the Math class, and it is important to communicate this simply and directly for better understanding."
easyread-text-15-18,15,text-15-18,Foto de Aldo Rodriguez,es,The task is to simplify a title or credit line for a photo to make it more accessible to children with learning disabilities.
easyread-text-15-11,15,text-15-11,Mi amigo se llama Juan. Le gusta mucho jugar al fútbol. Es muy bueno y siempre sonríe. Juan también quiere ayudar a los demás. Es un gran amigo.,es,"The task involves introducing a classmate in a simple and clear manner, using everyday language appropriate for children with cognitive and learning disabilities."
easyread-text-15-14,15,text-15-14,La otra foto es después de la clase de inglés.,es,"The original sentence is straightforward, but it might need a simpler structure for better understanding. The key information is about the timing of when the other picture was taken, which is after the English class."
easyread-text-15-12,15,text-15-12,Mira nuestra clase.,es,The text asks someone to see the classroom. It's a simple sentence meant to invite someone to observe the classroom setting.
easyread-text-15-10,15,text-15-10,Su número favorito es,es,"The sentence has to be simplified for children to understand. The sentence should be short, in active voice, and clear in the message about favorite numbers."
easyread-text-15-15,15,text-15-15,Busca qué cosas no son iguales en las dos imágenes.,es,"The task involves comparing two pictures to find differences, which means identifying what is not the same in both images. This might involve differences in color, shape, position, or items present."
easyread-text-15-16,15,text-15-16,En la imagen A hay una goma sobre la mesa.,es,"We want to make the information simple for children. It should be very straightforward, stating what is seen in the picture."
easyread-text-15-21,15,text-15-21,17,es,"The number 17 is a simple and straightforward concept, requiring no significant simplification."
easyread-text-15-19,15,text-15-19,UNIDAD 1,es,The text 'UNIT 1' is a phrase usually indicating a section or chapter in a book or course. There is no gender-specific language or jargon to simplify here. It mainly signposts the beginning of a section.
easyread-text-15-20,15,text-15-20,Hola y bienvenidos,es,The text is a simple greeting phrase and should remain in its essence without any complex words or expressions.
easyread-text-15-17,15,text-15-17,En la foto B hay una goma de borrar en la silla.,es,"The instruction is simple, stating that there's an eraser located on a specific object, the chair. The aim is to convey this information clearly for easier understanding."
easyread-text-15-3,15,text-15-3,¡Hola! Me llamo,es,"To give an easy-read version of an introduction, I need to understand that simple self-introduction in Spanish should be straightforward and relatable."
easyread-text-15-5,15,text-15-5,Este es mi compañero o Esta es mi compañera.,es,"This sentence is about introducing someone in Spanish, maintaining the gender of words."
easyread-text-15-7,15,text-15-7,Puedes llamarlo/llamarla.,es,"The phrase indicates that someone has the option to call another person, possibly a friend or family member. I need to translate it into Spanish while maintaining gender options."
easyread-text-15-8,15,text-15-8,Su cumpleaños es el,es,"I need to translate the sentence into simple Spanish while ensuring that 'his/her' is translated in a way that maintains neutral gender, which in Spanish is usually addressed singularly if not specified."
easyread-text-15-6,15,text-15-6,Su nombre es,es,"The text shares a name, hence I should convey it simply, while describing what is meant by 'name' in context."
easyread-text-15-1,15,text-15-1,"Para hacer un informe sobre un compañero de clase, puedes escribir sobre sus cualidades buenas y las cosas que hace bien. Por ejemplo, puedes decir si es amigable y qué materias o deportes le gustan.",es,"The text is a prompt asking to write a report about a classmate. To simplify, I should address the topic by describing how one could write a report focusing on the classmate's positive qualities and activities."
easyread-text-15-4,15,text-15-4,Voy a presentar a mi amigo.,es,The text is about introducing a friend. It is a simple idea that can be expressed in familiar terms.
easyread-text-15-9,15,text-15-9,Su color favorito es,es,The sentence is about someone's favorite color. I need to simplify it while keeping the gender neutral and maintaining its meaning.
easyread-text-15-2,15,text-15-2,"Un pirata asustaba a la gente en los mares, y sus aventuras hicieron que otros escribieran historias y canciones sobre él.",es,"To make the text simple for children, I need to use easy words and short sentences. The text talks about a pirate who frightened people on the seas and inspired others to create stories about him."
easyread-text-15-0,15,text-15-0,Vivir en Uruguay puede ser agradable por su gente amable y sus paisajes bonitos. A las personas les gusta por su tranquilidad y su buena comida.,es,"The text is likely about living in Uruguay and possibly focuses on some aspects that make it good or bad to live there. I'll simplify by emphasizing basic, relatable information like what the country is known for or reasons someone might like living there."
easyread-text-16-10,16,text-16-10,Escribe los objetos que adivinó tu grupo y los que adivinó el otro grupo.,es,The sentence asks to write down the objects that each group guessed during a game or activity. I should simplify this idea using easy words and structure.
easyread-text-16-2,16,text-16-2,Dibuja o coloca los objetos en el gráfico.,es,The instruction is asking to place the objects on a chart. This needs to be simplified for children so they understand they need to move or draw the objects on the chart.
easyread-text-16-1,16,text-16-1,¡Vamos a jugar! Ven y adivina los objetos de la bolsa.,es,"The text is offering an invitation to play a guessing game with objects in a bag, providing an engaging and playful invitation for kids."
easyread-text-16-17,16,text-16-17,Vivir en Uruguay es tranquilo. La gente es amigable y las ciudades son seguras.,es,"The text is intended to provide an overview or introduction about living in Uruguay. Simplifying the text involves using easy vocabulary and short sentences to convey the main idea, which is living in Uruguay and how the experience might be."
easyread-text-16-0,16,text-16-0,¡Juego de adivinanzas!,es,The text 'Guessing game!' is simple and refers to a game where players try to guess something. Keeping it simple for children would mean explaining it is a fun game.
easyread-text-16-16,16,text-16-16,Dieciocho,es,"18 is a number and the text is just a simple representation of it. No prefixes or suffixes are attached, nor are any gendered or complex terms included. The prompt wants simple number representation instead."
easyread-text-16-3,16,text-16-3,Hay cosas en la bolsa.,es,"I need to describe the presence of objects in a bag in simple Spanish, using basic vocabulary accessible for children."
easyread-text-16-12,16,text-16-12,El otro grupo de personas.,es,The text refers to another group of people or individuals distinct from the current or known group. I need to keep this simple by clarifying that it involves people different from the ones currently being considered.
easyread-text-16-5,16,text-16-5,La persona toca el objeto y le dice a su grupo cómo es.,es,The original sentence is about a person touching an object and telling their group what it feels like or looks like. I will maintain the gender-neutral language and simplify it for children.
easyread-text-16-8,16,text-16-8,Parece ser una fruta.,es,"This phrase is identifying something that appears to be a fruit. In simple terms, I should focus on describing that it looks like a fruit."
easyread-text-16-7,16,text-16-7,Es grande. / Es pequeño.,es,"The text is providing a simple comparison of size, using everyday concepts of 'big' and 'small', which are basic and familiar."
easyread-text-16-15,16,text-16-15,Hola y bienvenido,es,The input is a simple greeting phrase and doesn't contain any complex words or jargon. It can be directly translated into a simpler version in Spanish.
easyread-text-16-6,16,text-16-6,"Por ejemplo, es una frase que usamos para dar un ejemplo y ayudar a entender mejor.",es,"The text ""for example"" can be explained as a phrase used to give an example of something mentioned before. It is meant to provide clarification or a better understanding of what was previously stated."
easyread-text-16-9,16,text-16-9,Creo que lo puedes comer.,es,"The sentence communicates that something is safe to eat, using a simple structure and familiar vocabulary for children with cognitive and learning disabilities."
easyread-text-16-11,16,text-16-11,Tu grupo,es,"The text 'Your group' is very short and refers to a familiar concept for most school children: the idea of belonging to a group. School children often experience group settings in classrooms, teams, or play groups. The task here is to translate it into simple and direct Spanish while keeping the familiar context."
easyread-text-16-4,16,text-16-4,Una persona del grupo va al frente de la clase.,es,The text describes one person from a group going to the front of the classroom. It's a simple action and can be easily understood by young children. Using basic words will help in this explanation.
easyread-text-16-13,16,text-16-13,Esta es una foto que tomó una persona llamada Aldo Rodriguez.,es,I need to simplify and describe a photo credited to Aldo Rodriguez for young children.
easyread-text-16-14,16,text-16-14,UNIDAD 1,es,"The text is a heading referring to a specific section or part of a book, curriculum, or lesson. Since it is just a simple title, it doesn't require simplification, but a translation into Spanish."
easyread-text-17-31,17,text-17-31,azul,es,"The task is to interpret and simplify text. In this case, the text is just a single word, 'blue'. Hence, we simplify it into Spanish as it is straightforward and widely understood."
easyread-text-17-33,17,text-17-33,"El color negro es como la noche. Es oscuro y se puede ver en muchas cosas, como el carbón o un pantalón negro.",es,"The text 'black' is very short and does not provide much context or detail. For school children, I will simplify by giving a general easy-read explanation of the word."
easyread-text-17-3,17,text-17-3,Dos,es,"The number 2 is a simple and basic number, easily understood by young children or individuals with cognitive disabilities. It simply represents the number two."
easyread-text-17-32,17,text-17-32,azul claro,es,"The text is simply a color name without complex context or structures. It should be maintained as a familiar and universally recognizable term. For children with cognitive and learning disabilities, it's essential to leave terms like colors in their simple forms since they are associated with sensory perception and everyday language."
easyread-text-17-34,17,text-17-34,"Una naranja es una fruta redonda y dulce. Su color es naranja. La gente come naranjas porque tienen mucha vitamina C, que es buena para la salud.",es,"I need to provide a simple definition of 'orange' that is suitable for children with cognitive and learning disabilities. It should be clear and easy to understand, explaining what an orange is in a straightforward way."
easyread-text-17-0,17,text-17-0,"Vivir en Uruguay es tranquilo y bonito. Hay playas, campos y ciudades. La gente es amable y hay buena comida como carne y mate.",es,"The text should simplify content about living in Uruguay, focusing on everyday life aspects and using familiar words."
easyread-text-17-17,17,text-17-17,Escribe oraciones que sean verdaderas.,es,The statement asks to write sentences that are correct or truthful. This can be interpreted as instructing someone to write sentences based on facts or reality.
easyread-text-17-15,17,text-17-15,"Busca cosas de colores, como: una manzana roja, el cielo azul, hojas verdes. Encuentra un objeto para cada color.",es,"The task is to identify objects that commonly correspond with different colors, making it relatable and simple for children."
easyread-text-17-1,17,text-17-1,¡Mira los colores diferentes!,es,The text is exclamatory and invites attention to colors. Simplifying it for children involves using familiar words focusing on the action of looking at colors.
easyread-text-17-16,17,text-17-16,"Por ejemplo, rojo: manzana",es,"The text is a simple association between a color (red) and an object (apple), which might be used to help children learn colors and objects."
easyread-text-17-18,17,text-17-18,La manzana es roja.,es,"The original sentence is simple and direct, describing the color of an apple using words that are straightforward for children to understand. Thus, minimal modification is needed for comprehension."
easyread-text-17-19,17,text-17-19,Formen parejas. Pregunten y respondan.,es,The text instructs students to group themselves into pairs and have a conversation by asking and answering questions. It uses simple language and gives a clear direction for interaction.
easyread-text-17-27,17,text-17-27,El color gris es como cuando mezclas blanco y negro. Es un color que vemos en el cielo cuando está nublado.,es,"The task requires a simple explanation of the word 'grey' for children, especially those with cognitive and learning disabilities, using Spanish."
easyread-text-17-35,17,text-17-35,"El violeta es un color que parece morado. Está en las flores y algunas frutas, como las uvas.",es,The task is to simplify the text about color 'violet' into easy Spanish for children with cognitive disabilities. The word 'violet' can refer to a color and should be described in simple terms that relate to everyday experiences or familiar objects.
easyread-text-17-11,17,text-17-11,Diez,es,"The text appears to be a number, possibly '10', which is simple and recognizable as a numeral indicating an amount or value."
easyread-text-17-23,17,text-17-23,La primera parte o lección de un libro.,es,The text 'UNIT 1' refers to the first section of a series or book. It indicates the beginning of a topic or lesson.
easyread-text-17-6,17,text-17-6,El número es cinco.,es,"The text provided seems to be a simple input, possibly a number. A direct translation might not be necessary. However, confirming the context or elaborating might be helpful for a more useful output."
easyread-text-17-26,17,text-17-26,amarillo,es,"I need to simplify a single word, which is also a color, into easy-read Spanish for children."
easyread-text-17-7,17,text-17-7,Seis,es,"Without additional context, the text '6' can represent the number six in a context that's unclear. Hence, to make it easy for school children, especially those with cognitive and learning disabilities, it should be simplified to just the number in Spanish."
easyread-text-17-10,17,text-17-10,El número 9 es un número. Es después del 8 y antes del 10.,es,"The text '9' is a simple number and does not require simplification for understanding. However, I will present it in a simplified context for children."
easyread-text-17-25,17,text-17-25,rojo,es,"The word 'red' is simple and universally understood as a color. In Spanish, the word 'red' translates directly to 'rojo', which is a basic and familiar term that can be easily understood by children."
easyread-text-17-24,17,text-17-24,Hola y bienvenidos,es,"The text is a simple greeting in English that welcomes someone. In Spanish, I need to convey the same welcoming feeling using simple and familiar words."
easyread-text-17-9,17,text-17-9,ocho,es,"The text is asking for a simplified version of a number in Spanish. Since the number 8 is straightforward and universally known across most languages, it simply needs to be translated directly."
easyread-text-17-8,17,text-17-8,Siete,es,"The prompt is a simple number '7', which does not require simplification into Spanish. However, presenting the number in Spanish maintains consistency with the language requirement."
easyread-text-17-14,17,text-17-14,Une cada color con su nombre en la paleta.,es,The task involves identifying what color corresponds to what name. Using simple language will help children understand easily.
easyread-text-17-28,17,text-17-28,Marrón,es,"The task is to provide a simplified version of the text for school children with cognitive and learning disabilities in Spanish, using everyday, familiar words and active voice."
easyread-text-17-20,17,text-17-20,¿De qué color es la manzana?,es,The text asks about the color of an apple. It's important to note that apples can come in different colors.
easyread-text-17-30,17,text-17-30,blanco,es,"In this context, we simplify the word using familiar everyday language. Since the word 'white' refers to a color, we can present it directly in Spanish as 'blanco', which is easy for children to understand."
easyread-text-17-4,17,text-17-4,El número es 3.,es,The number given is a simple single-digit integer and does not require any further breakdown.
easyread-text-17-29,17,text-17-29,Verde es el color de la hierba y las hojas de los árboles.,es,"The word 'green' is a color. It's a basic concept and does not require simplification for understanding. However, if we are to explain or expand on it in a simple way, we could relate it to nature or objects that are commonly understood."
easyread-text-17-5,17,text-17-5,Cuatro,es,The text '4' refers to the number which in Spanish is 'cuatro'. It should be presented in a simple manner using familiar words.
easyread-text-17-36,17,text-17-36,Rosa es un color que a muchas personas les gusta.,es,The word 'pink' is a color. It can be difficult for young children with cognitive or learning disabilities to understand abstract concepts like colors without any context.
easyread-text-17-2,17,text-17-2,"Asustaba a la gente en los mares del norte de Europa, y sus aventuras inspiraron a muchas personas a escribir canciones, libros y obras de teatro sobre él.",es,"We need to simplify the text to make it easy to understand. The original text is about fear and inspiration, but we will use simpler words."
easyread-text-17-13,17,text-17-13,El número 12 es un número después del 11 y antes del 13.,es,"Since the input is just a number, I will provide a simple explanation about it in Spanish to make it relatable and easily understandable for children."
easyread-text-17-22,17,text-17-22,La foto es de Aldo Rodriguez.,es,"The text tells who took or created the photo, making it easy for children to understand the photographer's name."
easyread-text-17-21,17,text-17-21,Es rojo.,es,The text is very simple and describes the color red.
easyread-text-17-37,17,text-17-37,Diecinueve.,es,The input appears to be a number which I will treat simply as it is.
